12:20:18.780623 IP 192.0.0.1.46225 > 192.0.0.2.domain: 21342+ A? example.com. (29)
12:20:18.804028 IP 192.0.0.2.domain > 192.0.0.1.46225: 21342*- 1/0/0 A 93.184.216.34 (45)
12:20:19.813200 IP 192.0.0.1.46225 > 192.0.0.2.domain: 29809+ [1au] A? example.com. (40)
12:20:19.836604 IP 192.0.0.2.domain > 192.0.0.1.46225: 29809*- 2/0/1 A 93.184.216.34, RRSIG (227)
12:20:20.846652 IP 192.0.0.1.46225 > 192.0.0.2.domain: 51786+ [1au] A? example.com. (51)
12:20:20.870071 IP 192.0.0.2.domain > 192.0.0.1.46225: 51786*- 1/0/1 A 93.184.216.34 (67)
12:20:21.876046 IP 192.0.0.1.46225 > 192.0.0.2.domain: 61017+ [1au] A? example.com. (52)
12:20:21.899416 IP 192.0.0.2.domain > 192.0.0.1.46225: 61017*- 1/0/1 A 93.184.216.34 (68)
12:20:22.918825 IP 192.0.0.1.46225 > 192.0.0.2.domain: 52552+ [1au] A? example.com. (61)
12:20:22.942157 IP 192.0.0.2.domain > 192.0.0.1.46225: 52552*- 1/0/1 A 93.184.216.34 (77)
12:20:23.955601 IP 192.0.0.1.46225 > 192.0.0.2.domain: 1054+ [1au] A? example.com. (52)
12:20:23.979436 IP 192.0.0.2.domain > 192.0.0.1.46225: 1054*- 1/0/1 A 93.184.216.34 (84)
12:20:24.984886 IP 192.0.0.1.46225 > 192.0.0.2.domain: 26094+ [1au] A? example.com. (46)
12:20:25.008364 IP 192.0.0.2.domain > 192.0.0.1.46225: 26094*- 2/0/1 A 93.184.216.34, RRSIG (227)
12:20:26.016534 IP 192.0.0.1.46225 > 192.0.0.2.domain: 32711+ [1au] A? example.com. (55)
12:20:26.040059 IP 192.0.0.2.domain > 192.0.0.1.46225: 32711*- 2/0/1 A 93.184.216.34, RRSIG (227)
12:20:27.047904 IP 192.0.0.1.46225 > 192.0.0.2.domain: 21680+ [1au] A? example.com. (61)
12:20:27.071464 IP 192.0.0.2.domain > 192.0.0.1.46225: 21680*- 2/0/1 A 93.184.216.34, RRSIG (227)
12:20:28.077688 IP 192.0.0.1.46225 > 192.0.0.2.domain: 65262+ [1au] A? example.com. (46)
12:20:28.100998 IP 192.0.0.2.domain > 192.0.0.1.46225: 65262*- 1/0/1 A 93.184.216.34 (56)
12:20:29.119658 IP 192.0.0.1.46225 > 192.0.0.2.domain: 19262+ [1au] A? example.com. (46)
12:20:29.142993 IP 192.0.0.2.domain > 192.0.0.1.46225: 19262*- 2/0/1 A 93.184.216.34, RRSIG (227)
12:20:30.161854 IP 192.0.0.1.46225 > 192.0.0.2.domain: 56424+ [1au] A? example.com. (48)
12:20:30.185192 IP 192.0.0.2.domain > 192.0.0.1.46225: 56424*- 2/0/1 A 93.184.216.34, RRSIG (227)
12:20:31.205674 IP 192.0.0.1.46225 > 192.0.0.2.domain: 3561+ [1au] A? example.com. (44)
12:20:31.229073 IP 192.0.0.2.domain > 192.0.0.1.46225: 3561*- 1/0/1 A 93.184.216.34 (56)
12:20:32.236977 IP 192.0.0.1.46225 > 192.0.0.2.domain: 27711+ [1au] A? example.com. (48)
12:20:32.260301 IP 192.0.0.2.domain > 192.0.0.1.46225: 27711*- 1/0/1 A 93.184.216.34 (56)
12:20:32.509504 IP 192.0.0.2.46225 > 192.0.0.1.1900: UDP, length 126
12:20:33.270280 IP 192.0.0.1.46225 > 192.0.0.2.domain: 5254+ [1au] A? example.com. (44)
12:20:33.293721 IP 192.0.0.2.domain > 192.0.0.1.46225: 5254*- 1/0/1 A 93.184.216.34 (56)
12:20:34.311165 IP 192.0.0.1.46225 > 192.0.0.2.domain: 38755+ [1au] A? example.com. (54)
12:20:34.334891 IP 192.0.0.2.domain > 192.0.0.1.46225: 38755*- 1/0/1 A 93.184.216.34 (56)
12:20:35.344160 IP 192.0.0.1.46225 > 192.0.0.2.domain: 52486+ [1au] A? example.com. (48)
12:20:35.368282 IP 192.0.0.2.domain > 192.0.0.1.46225: 52486*- 1/0/1 A 93.184.216.34 (56)
12:20:36.374902 IP 192.0.0.1.46225 > 192.0.0.2.domain: 20629+ [1au] A? example.com. (50)
12:20:36.398312 IP 192.0.0.2.domain > 192.0.0.1.46225: 20629*- 1/0/1 A 93.184.216.34 (56)
12:20:37.405706 IP 192.0.0.1.46225 > 192.0.0.2.domain: 55422+ [1au] A? example.com. (80)
12:20:37.429076 IP 192.0.0.2.domain > 192.0.0.1.46225: 55422*- 1/0/1 A 93.184.216.34 (84)
12:20:38.447384 IP 192.0.0.1.46225 > 192.0.0.2.domain: 58856+ [1au] A? example.com. (62)
12:20:38.485022 IP 192.0.0.2.domain > 192.0.0.1.46225: 58856*- 1/0/1 A 93.184.216.34 (94)
12:20:39.494526 IP 192.0.0.1.46225 > 192.0.0.2.domain: 5035+ [1au] A? example.com. (72)
12:20:39.517880 IP 192.0.0.2.domain > 192.0.0.1.46225: 5035*- 1/0/1 A 93.184.216.34 (56)
