14:58:40.639715 IP 192.0.0.1.46225 > 192.0.0.2.domain: 13784+ A? example.com. (29)
14:58:40.661836 IP 192.0.0.2.domain > 192.0.0.1.46225: 13784*- 1/0/0 A 93.184.216.34 (45)
14:58:41.671700 IP 192.0.0.1.46225 > 192.0.0.2.domain: 47424+ [1au] A? example.com. (40)
14:58:41.693577 IP 192.0.0.2.domain > 192.0.0.1.46225: 47424*- 2/0/1 A 93.184.216.34, RRSIG (227)
14:58:42.703534 IP 192.0.0.1.46225 > 192.0.0.2.domain: 41739+ [1au] A? example.com. (51)
14:58:42.725559 IP 192.0.0.2.domain > 192.0.0.1.46225: 41739*- 1/0/1 A 93.184.216.34 (67)
14:58:43.734693 IP 192.0.0.1.46225 > 192.0.0.2.domain: 18065+ [1au] A? example.com. (52)
14:58:43.756707 IP 192.0.0.2.domain > 192.0.0.1.46225: 18065*- 1/0/1 A 93.184.216.34 (68)
14:58:44.766528 IP 192.0.0.1.46225 > 192.0.0.2.domain: 34237+ [1au] A? example.com. (61)
14:58:44.788502 IP 192.0.0.2.domain > 192.0.0.1.46225: 34237*- 1/0/1 A 93.184.216.34 (77)
14:58:45.797638 IP 192.0.0.1.46225 > 192.0.0.2.domain: 30225+ [1au] A? example.com. (52)
14:58:45.819504 IP 192.0.0.2.domain > 192.0.0.1.46225: 30225*- 1/0/1 A 93.184.216.34 (84)
14:58:46.829454 IP 192.0.0.1.46225 > 192.0.0.2.domain: 52688+ [1au] A? example.com. (46)
14:58:46.851441 IP 192.0.0.2.domain > 192.0.0.1.46225: 52688*- 2/0/1 A 93.184.216.34, RRSIG (227)
14:58:47.860858 IP 192.0.0.1.46225 > 192.0.0.2.domain: 57808+ [1au] A? example.com. (55)
14:58:47.882669 IP 192.0.0.2.domain > 192.0.0.1.46225: 57808*- 2/0/1 A 93.184.216.34, RRSIG (227)
14:58:48.892587 IP 192.0.0.1.46225 > 192.0.0.2.domain: 33054+ [1au] A? example.com. (61)
14:58:48.914406 IP 192.0.0.2.domain > 192.0.0.1.46225: 33054*- 2/0/1 A 93.184.216.34, RRSIG (227)
14:58:49.924625 IP 192.0.0.1.46225 > 192.0.0.2.domain: 14353+ [1au] A? example.com. (46)
14:58:49.946523 IP 192.0.0.2.domain > 192.0.0.1.46225: 14353*- 1/0/1 A 93.184.216.34 (56)
14:58:50.956601 IP 192.0.0.1.46225 > 192.0.0.2.domain: 17010+ [1au] A? example.com. (46)
14:58:50.978366 IP 192.0.0.2.domain > 192.0.0.1.46225: 17010*- 2/0/1 A 93.184.216.34, RRSIG (227)
14:58:51.988387 IP 192.0.0.1.46225 > 192.0.0.2.domain: 3894+ [1au] A? example.com. (48)
14:58:52.010258 IP 192.0.0.2.domain > 192.0.0.1.46225: 3894*- 2/0/1 A 93.184.216.34, RRSIG (227)
14:58:53.015716 IP 192.0.0.1.46225 > 192.0.0.2.domain: 8476+ [1au] A? example.com. (44)
14:58:53.037529 IP 192.0.0.2.domain > 192.0.0.1.46225: 8476*- 1/0/1 A 93.184.216.34 (56)
14:58:54.047412 IP 192.0.0.1.46225 > 192.0.0.2.domain: 3966+ [1au] A? example.com. (48)
14:58:54.069358 IP 192.0.0.2.domain > 192.0.0.1.46225: 3966*- 1/0/1 A 93.184.216.34 (56)
14:58:55.078435 IP 192.0.0.1.46225 > 192.0.0.2.domain: 26580+ [1au] A? example.com. (44)
14:58:55.100224 IP 192.0.0.2.domain > 192.0.0.1.46225: 26580*- 1/0/1 A 93.184.216.34 (56)
14:58:56.110237 IP 192.0.0.1.46225 > 192.0.0.2.domain: 2190+ [1au] A? example.com. (54)
14:58:56.132070 IP 192.0.0.2.domain > 192.0.0.1.46225: 2190*- 1/0/1 A 93.184.216.34 (56)
14:58:57.142215 IP 192.0.0.1.46225 > 192.0.0.2.domain: 16386+ [1au] A? example.com. (48)
14:58:57.164050 IP 192.0.0.2.domain > 192.0.0.1.46225: 16386*- 1/0/1 A 93.184.216.34 (56)
14:58:58.174193 IP 192.0.0.1.46225 > 192.0.0.2.domain: 6373+ [1au] A? example.com. (50)
14:58:58.195911 IP 192.0.0.2.domain > 192.0.0.1.46225: 6373*- 1/0/1 A 93.184.216.34 (56)
14:58:59.206181 IP 192.0.0.1.46225 > 192.0.0.2.domain: 29267+ [1au] A? example.com. (80)
14:58:59.228465 IP 192.0.0.2.domain > 192.0.0.1.46225: 29267*- 1/0/1 A 93.184.216.34 (84)
14:59:00.238274 IP 192.0.0.1.46225 > 192.0.0.2.domain: 59326+ [1au] A? example.com. (62)
14:59:00.260209 IP 192.0.0.2.domain > 192.0.0.1.46225: 59326*- 1/0/1 A 93.184.216.34 (94)
14:59:01.269390 IP 192.0.0.1.46225 > 192.0.0.2.domain: 17122+ [1au] A? example.com. (72)
14:59:01.291167 IP 192.0.0.2.domain > 192.0.0.1.46225: 17122*- 2/0/1 A 93.184.216.34, RRSIG (227)
