14:23:28.492791 IP 192.0.0.1.46225 > 192.0.0.2.domain: 22326+ A? example.com. (29)
14:23:28.516326 IP 192.0.0.2.domain > 192.0.0.1.46225: 22326*- 1/0/0 A 93.184.216.34 (45)
14:23:29.526361 IP 192.0.0.1.46225 > 192.0.0.2.domain: 23828+ [1au] A? example.com. (40)
14:23:29.549994 IP 192.0.0.2.domain > 192.0.0.1.46225: 23828*- 2/0/1 A 93.184.216.34, RRSIG (227)
14:23:30.560353 IP 192.0.0.1.46225 > 192.0.0.2.domain: 7069+ [1au] A? example.com. (51)
14:23:30.583729 IP 192.0.0.2.domain > 192.0.0.1.46225: 7069*- 1/0/1 A 93.184.216.34 (67)
14:23:31.593417 IP 192.0.0.1.46225 > 192.0.0.2.domain: 17838+ [1au] A? example.com. (52)
14:23:31.617782 IP 192.0.0.2.domain > 192.0.0.1.46225: 17838*- 1/0/1 A 93.184.216.34 (68)
14:23:32.627518 IP 192.0.0.1.46225 > 192.0.0.2.domain: 9504+ [1au] A? example.com. (61)
14:23:32.651123 IP 192.0.0.2.domain > 192.0.0.1.46225: 9504*- 1/0/1 A 93.184.216.34 (77)
14:23:33.661422 IP 192.0.0.1.46225 > 192.0.0.2.domain: 47778+ [1au] A? example.com. (52)
14:23:33.684740 IP 192.0.0.2.domain > 192.0.0.1.46225: 47778*- 1/0/1 A 93.184.216.34 (84)
14:23:34.694395 IP 192.0.0.1.46225 > 192.0.0.2.domain: 42626+ [1au] A? example.com. (46)
14:23:34.718606 IP 192.0.0.2.domain > 192.0.0.1.46225: 42626*- 2/0/1 A 93.184.216.34, RRSIG (227)
14:23:35.728391 IP 192.0.0.1.46225 > 192.0.0.2.domain: 44776+ [1au] A? example.com. (55)
14:23:35.751796 IP 192.0.0.2.domain > 192.0.0.1.46225: 44776*- 2/0/1 A 93.184.216.34, RRSIG (227)
14:23:36.761275 IP 192.0.0.1.46225 > 192.0.0.2.domain: 49225+ [1au] A? example.com. (61)
14:23:36.784794 IP 192.0.0.2.domain > 192.0.0.1.46225: 49225*- 2/0/1 A 93.184.216.34, RRSIG (227)
14:23:37.794297 IP 192.0.0.1.46225 > 192.0.0.2.domain: 13497+ [1au] A? example.com. (46)
14:23:37.817838 IP 192.0.0.2.domain > 192.0.0.1.46225: 13497*- 1/0/1 A 93.184.216.34 (56)
14:23:38.828093 IP 192.0.0.1.46225 > 192.0.0.2.domain: 4811+ [1au] A? example.com. (46)
14:23:38.851830 IP 192.0.0.2.domain > 192.0.0.1.46225: 4811*- 2/0/1 A 93.184.216.34, RRSIG (227)
14:23:39.861321 IP 192.0.0.1.46225 > 192.0.0.2.domain: 38053+ [1au] A? example.com. (48)
14:23:39.884813 IP 192.0.0.2.domain > 192.0.0.1.46225: 38053*- 2/0/1 A 93.184.216.34, RRSIG (227)
14:23:40.895069 IP 192.0.0.1.46225 > 192.0.0.2.domain: 56863+ [1au] A? example.com. (44)
14:23:40.919763 IP 192.0.0.2.domain > 192.0.0.1.46225: 56863*- 1/0/1 A 93.184.216.34 (56)
14:23:41.930093 IP 192.0.0.1.46225 > 192.0.0.2.domain: 47598+ [1au] A? example.com. (48)
14:23:41.953596 IP 192.0.0.2.domain > 192.0.0.1.46225: 47598*- 1/0/1 A 93.184.216.34 (56)
14:23:42.963130 IP 192.0.0.1.46225 > 192.0.0.2.domain: 28412+ [1au] A? example.com. (44)
14:23:42.986476 IP 192.0.0.2.domain > 192.0.0.1.46225: 28412*- 1/0/1 A 93.184.216.34 (56)
14:23:43.996149 IP 192.0.0.1.46225 > 192.0.0.2.domain: 7625+ [1au] A? example.com. (54)
14:23:44.019639 IP 192.0.0.2.domain > 192.0.0.1.46225: 7625*- 1/0/1 A 93.184.216.34 (56)
14:23:45.029974 IP 192.0.0.1.46225 > 192.0.0.2.domain: 17003+ [1au] A? example.com. (48)
14:23:45.053398 IP 192.0.0.2.domain > 192.0.0.1.46225: 17003*- 1/0/1 A 93.184.216.34 (56)
14:23:46.063066 IP 192.0.0.1.46225 > 192.0.0.2.domain: 13853+ [1au] A? example.com. (50)
14:23:46.086364 IP 192.0.0.2.domain > 192.0.0.1.46225: 13853*- 1/0/1 A 93.184.216.34 (56)
14:23:47.096068 IP 192.0.0.1.46225 > 192.0.0.2.domain: 38689+ [1au] A? example.com. (80)
14:23:47.119534 IP 192.0.0.2.domain > 192.0.0.1.46225: 38689*- 1/0/1 A 93.184.216.34 (84)
14:23:48.129087 IP 192.0.0.1.46225 > 192.0.0.2.domain: 16238+ [1au] A? example.com. (62)
14:23:48.152321 IP 192.0.0.2.domain > 192.0.0.1.46225: 16238*- 1/0/1 A 93.184.216.34 (94)
14:23:49.162032 IP 192.0.0.1.46225 > 192.0.0.2.domain: 29600+ [1au] A? example.com. (72)
14:23:49.185371 IP 192.0.0.2.domain > 192.0.0.1.46225: 29600*- 2/0/1 A 93.184.216.34, RRSIG (227)
