    1  00:00:00.000000 IP 192.1.2.23.4500 > 192.1.2.45.4500: UDP-encap: ESP(spi=0x12345678,seq=0x1), length 116
    2  00:00:00.000000 IP 192.1.2.23.4500 > 192.1.2.45.4500: UDP-encap: ESP(spi=0x12345678,seq=0x2), length 116:  ip-proto-227 49
    3  00:00:00.000000 IP 192.1.2.23.4500 > 192.1.2.45.4500: UDP-encap: ESP(spi=0x12345678,seq=0x3), length 116: PIMv13, length 10
    4  00:00:00.000000 IP 192.1.2.23.4500 > 192.1.2.45.4500: UDP-encap: ESP(spi=0x12345678,seq=0x4), length 116
    5  00:00:00.000000 IP 192.1.2.23.4500 > 192.1.2.45.4500: UDP-encap: ESP(spi=0x12345678,seq=0x5), length 116
    6  00:00:00.000000 IP 192.1.2.23.4500 > 192.1.2.45.4500: UDP-encap: ESP(spi=0x12345678,seq=0x6), length 116:  ip-proto-183 28
    7  00:00:00.000000 IP 192.1.2.23.4500 > 192.1.2.45.4500: UDP-encap: ESP(spi=0x12345678,seq=0x7), length 116:  ip-proto-72 34
    8  00:00:00.000000 IP 192.1.2.23.4500 > 192.1.2.45.4500: UDP-encap: ESP(spi=0x12345678,seq=0x8), length 116:  ip-proto-224 59
