    1  2024-01-01 22:21:42.293205 IP 204.194.23.128 > 149.28.74.237: ICMP extended echo request, id 63210, seq 0, length 28
    2  2024-01-01 22:22:02.791281 IP 204.194.23.128 > 149.28.74.237: ICMP extended echo request, id 63239, seq 0, length 30
    3  2024-01-01 22:22:49.391909 IP 204.194.23.128 > 149.28.74.237: ICMP extended echo request, id 63269, seq 0, length 32
    4  2024-01-01 22:23:14.907148 IP 204.194.23.128 > 149.28.74.237: ICMP extended echo request, id 63274, seq 0, length 32
    5  2024-01-01 22:36:36.688455 IP 149.28.74.237 > 204.194.23.128: ICMP extended echo request, id 42, seq 42, length 32
    6  2024-01-01 22:36:36.750419 IP 204.194.23.128 > 149.28.74.237: ICMP extended echo reply, id 42, seq 42, length 32
    7  2024-01-01 22:36:44.864530 IP 149.28.74.237 > 204.194.23.128: ICMP extended echo request, id 42, seq 42, length 24
    8  2024-01-01 22:36:44.926583 IP 204.194.23.128 > 149.28.74.237: ICMP extended echo reply, id 42, seq 42, length 24
    9  2024-01-01 22:37:03.384499 IP 149.28.74.237 > 204.194.23.128: ICMP extended echo request, id 42, seq 42, length 28
   10  2024-01-01 22:37:03.446572 IP 204.194.23.128 > 149.28.74.237: ICMP extended echo reply, id 42, seq 42, length 28
