IP 10.0.1.1.33306 > 10.0.2.1.10004: Flags [S], seq 2180756989, win 65535, options [mss 1460,sackOK,TS val 464494241 ecr 0,nop,wscale 8,mptcp capable v1}], length 0
IP 10.0.2.1.10004 > 10.0.1.1.33306: Flags [S.], seq 791415661, ack 2180756990, win 65535, options [mss 1460,sackOK,TS val 3275212179 ecr 464494241,nop,wscale 8,mptcp capable v1 {0x29a6c86981ad933c}], length 0
IP 10.0.1.1.33306 > 10.0.2.1.10004: Flags [.], ack 1, win 256, options [nop,nop,TS val 464494241 ecr 3275212179,mptcp capable v1 {0x1fdb5df328bc3def,0x29a6c86981ad933c}], length 0
IP 10.0.1.1.33306 > 10.0.2.1.10004: Flags [P.], seq 1:7101, ack 1, win 256, options [nop,nop,TS val 464494241 ecr 3275212179,mptcp capable v1 {0x1fdb5df328bc3def,0x29a6c86981ad933c},nop,nop], length 7100
IP 10.0.2.1.10004 > 10.0.1.1.33306: Flags [.], ack 7101, win 312, options [nop,nop,TS val 3275212179 ecr 464494241,mptcp dss ack 14413541604287230030], length 0
IP 10.0.1.1.33306 > 10.0.2.1.10004: Flags [P.], seq 7101:8193, ack 1, win 256, options [nop,nop,TS val 464494241 ecr 3275212179,mptcp dss ack 11713449205243392242], length 1092
IP 10.0.2.1.10004 > 10.0.1.1.33306: Flags [P.], seq 1:7101, ack 7101, win 312, options [nop,nop,TS val 3275212179 ecr 464494241,mptcp dss ack 14413541604287230030 seq 11713449205243392242 subseq 1 len 8192,nop,nop], length 7100
IP 10.0.1.1.33306 > 10.0.2.1.10004: Flags [.], ack 7101, win 312, options [nop,nop,TS val 464494241 ecr 3275212179,mptcp dss ack 11713449205243392242], length 0
IP 10.0.1.1.33306 > 10.0.2.1.10004: Flags [.], seq 8193:9613, ack 7101, win 312, options [nop,nop,TS val 464494241 ecr 3275212179,mptcp dss ack 11713449205243392242 seq 14413541604287238222 subseq 8193 len 2076,nop,nop], length 1420
IP 10.0.2.1.10004 > 10.0.1.1.33306: Flags [P.], seq 7101:8193, ack 7101, win 312, options [nop,nop,TS val 3275212179 ecr 464494241,mptcp dss ack 14413541604287230030], length 1092
IP 10.0.2.1.10004 > 10.0.1.1.33306: Flags [.], ack 8193, win 323, options [nop,nop,TS val 3275212179 ecr 464494241,mptcp dss ack 14413541604287230030], length 0
IP 10.0.1.1.33306 > 10.0.2.1.10004: Flags [.], ack 8193, win 323, options [nop,nop,TS val 464494241 ecr 3275212179,mptcp dss ack 11713449205243392242], length 0
IP 10.0.1.1.33306 > 10.0.2.1.10004: Flags [P.], seq 9613:10269, ack 8193, win 323, options [nop,nop,TS val 464494241 ecr 3275212179,mptcp dss ack 11713449205243392242], length 656
IP 10.0.2.1.10004 > 10.0.1.1.33306: Flags [.], ack 9613, win 334, options [nop,nop,TS val 3275212179 ecr 464494241,mptcp dss ack 14413541604287230030], length 0
IP 10.0.2.1.10004 > 10.0.1.1.33306: Flags [.], ack 10269, win 345, options [nop,nop,TS val 3275212179 ecr 464494241,mptcp dss ack 14413541604287230030], length 0
IP 10.0.1.1.33306 > 10.0.2.1.10004: Flags [F.], seq 10269, ack 8193, win 323, options [nop,nop,TS val 464494241 ecr 3275212179,mptcp dss fin ack 11713449205243400434 seq 14413541604287240298 subseq 0 len 1,nop,nop], length 0
IP 10.0.2.1.10004 > 10.0.1.1.33306: Flags [P.], seq 8193:10269, ack 10270, win 345, options [nop,nop,TS val 3275212179 ecr 464494241,mptcp dss ack 14413541604287238222 seq 11713449205243400434 subseq 8193 len 2076,nop,nop], length 2076
IP 10.0.1.1.33306 > 10.0.2.1.10004: Flags [.], ack 10269, win 339, options [nop,nop,TS val 464494241 ecr 3275212179,mptcp dss ack 11713449205243400434], length 0
IP 10.0.2.1.10004 > 10.0.1.1.33306: Flags [F.], seq 10269, ack 10270, win 345, options [nop,nop,TS val 3275212179 ecr 464494241,mptcp dss fin ack 14413541604287240298 seq 11713449205243402510 subseq 0 len 1,nop,nop], length 0
IP 10.0.1.1.33306 > 10.0.2.1.10004: Flags [.], ack 10270, win 339, options [nop,nop,TS val 464494241 ecr 3275212179,mptcp dss ack 11713449205243402510], length 0
