    1  06:39:25.778133 IP 192.168.200.198.857 > 192.168.200.1.2049: Flags [P.], seq 3806116338:3806116382, ack 3240065782, win 229, options [nop,nop,TS val 190691472 ecr 193176172], length 44: NFS request xid 1710309038 40 v4 null
    2  06:39:25.778431 IP 192.168.200.1.2049 > 192.168.200.198.857: Flags [P.], seq 1:29, ack 44, win 227, options [nop,nop,TS val 193176172 ecr 190691472], length 28: NFS reply xid 1710309038 reply ok 24 v4 null
    3  06:39:25.778791 IP 192.168.200.198.857 > 192.168.200.1.2049: Flags [P.], seq 44:284, ack 29, win 229, options [nop,nop,TS val 190691473 ecr 193176172], length 240: NFS request xid 1727086254 236 v4.1 compound ops 1
    4  06:39:25.778965 IP 192.168.200.1.2049 > 192.168.200.198.857: Flags [P.], seq 29:133, ack 284, win 235, options [nop,nop,TS val 193176173 ecr 190691473], length 104: NFS reply xid 1727086254 reply ok 100 v4 compound
    5  06:39:35.254619 IP 192.168.200.198.857 > 192.168.200.1.2049: Flags [P.], seq 3584:3776, ack 3801, win 371, options [nop,nop,TS val 190700949 ecr 193185649], length 192: NFS request xid 2079407790 188 v4.1 compound ops 5
    6  06:39:35.254792 IP 192.168.200.1.2049 > 192.168.200.198.857: Flags [P.], seq 3801:3901, ack 3776, win 411, options [nop,nop,TS val 193185649 ecr 190700949], length 100: NFS reply xid 2079407790 reply ok 96 v4 compound ERROR: NFS4ERR_NOENT
