    1  2023-05-21 15:21:08.215897 IP 127.0.0.1.57694 > 127.0.0.1.31337: sctp (1) [INIT] [init tag: 413521971] [rwnd: 106496] [OS: 10] [MIS: 65535] [init TSN: 2253051237] 
    2  2023-05-21 15:21:08.215923 IP 127.0.0.1.31337 > 127.0.0.1.57694: sctp (1) [INIT ACK] [init tag: 145384071] [rwnd: 106496] [OS: 10] [MIS: 10] [init TSN: 4266748061] 
    3  2023-05-21 15:21:08.215940 IP 127.0.0.1.57694 > 127.0.0.1.31337: sctp (1) [COOKIE ECHO] 
    4  2023-05-21 15:21:08.215959 IP 127.0.0.1.31337 > 127.0.0.1.57694: sctp (1) [COOKIE ACK] 
    5  2023-05-21 15:21:09.986643 IP 10.0.0.169.57694 > 10.0.0.169.31337: sctp (1) [HB REQ] 
    6  2023-05-21 15:21:09.986673 IP 10.0.0.169.31337 > 10.0.0.169.57694: sctp (1) [HB ACK] 
    7  2023-05-21 15:21:10.338722 IP 10.0.0.169.31337 > 10.0.0.169.57694: sctp (1) [HB REQ] 
    8  2023-05-21 15:21:10.338734 IP 10.0.0.169.57694 > 10.0.0.169.31337: sctp (1) [HB ACK] 
    9  2023-05-21 15:21:11.106508 IP 192.168.122.1.57694 > 192.168.122.1.31337: sctp (1) [HB REQ] 
   10  2023-05-21 15:21:11.106570 IP 192.168.122.1.31337 > 192.168.122.1.57694: sctp (1) [HB ACK] 
   11  2023-05-21 15:21:11.618660 IP 10.0.0.192.57694 > 10.0.0.192.31337: sctp (1) [HB REQ] 
   12  2023-05-21 15:21:11.618665 IP 192.168.122.1.31337 > 192.168.122.1.57694: sctp (1) [HB REQ] 
   13  2023-05-21 15:21:11.618678 IP 10.0.0.192.31337 > 10.0.0.192.57694: sctp (1) [HB ACK] 
   14  2023-05-21 15:21:11.618695 IP 192.168.122.1.57694 > 192.168.122.1.31337: sctp (1) [HB ACK] 
   15  2023-05-21 15:21:12.642329 IP 10.0.0.192.31337 > 10.0.0.192.57694: sctp (1) [HB REQ] 
   16  2023-05-21 15:21:12.642340 IP 10.0.0.192.57694 > 10.0.0.192.31337: sctp (1) [HB ACK] 
   17  2023-05-21 15:21:13.410696 IP 127.0.0.1.31337 > 127.0.0.1.57694: sctp (1) [HB REQ] , (2) [PAD] 
   18  2023-05-21 15:21:13.410716 IP 127.0.0.1.57694 > 127.0.0.1.31337: sctp (1) [HB REQ] , (2) [PAD] 
   19  2023-05-21 15:21:13.410727 IP 127.0.0.1.57694 > 127.0.0.1.31337: sctp (1) [HB ACK] 
   20  2023-05-21 15:21:13.410732 IP 127.0.0.1.31337 > 127.0.0.1.57694: sctp (1) [HB ACK] 
   21  2023-05-21 15:21:13.410736 IP 127.0.0.1.31337 > 127.0.0.1.57694: sctp (1) [HB REQ] , (2) [PAD] 
   22  2023-05-21 15:21:13.410739 IP 127.0.0.1.57694 > 127.0.0.1.31337: sctp (1) [HB REQ] , (2) [PAD] 
   23  2023-05-21 15:21:13.410743 IP 127.0.0.1.57694 > 127.0.0.1.31337: sctp (1) [HB ACK] 
   24  2023-05-21 15:21:13.410746 IP 127.0.0.1.31337 > 127.0.0.1.57694: sctp (1) [HB ACK] 
   25  2023-05-21 15:21:13.410750 IP 127.0.0.1.31337 > 127.0.0.1.57694: sctp (1) [HB REQ] , (2) [PAD] 
   26  2023-05-21 15:21:13.410754 IP 127.0.0.1.57694 > 127.0.0.1.31337: sctp (1) [HB REQ] , (2) [PAD] 
   27  2023-05-21 15:21:13.410757 IP 127.0.0.1.57694 > 127.0.0.1.31337: sctp (1) [HB ACK] 
   28  2023-05-21 15:21:13.410760 IP 127.0.0.1.31337 > 127.0.0.1.57694: sctp (1) [HB ACK] 
   29  2023-05-21 15:21:13.410763 IP 127.0.0.1.31337 > 127.0.0.1.57694: sctp (1) [HB REQ] , (2) [PAD] 
   30  2023-05-21 15:21:13.410767 IP 127.0.0.1.57694 > 127.0.0.1.31337: sctp (1) [HB REQ] , (2) [PAD] 
