    1  2023-05-13 19:45:01.497381 IP 192.168.5.1.36413 > 192.168.5.2.36297: sctp (1) [INIT] [init tag: 3820459860] [rwnd: 106496] [OS: 10] [MIS: 65535] [init TSN: 2906273895] 
    2  2023-05-13 19:45:01.497403 IP 192.168.5.2.36297 > 192.168.5.1.36413: sctp (1) [INIT ACK] [init tag: 3868939720] [rwnd: 106496] [OS: 5] [MIS: 5] [init TSN: 2320017092] 
    3  2023-05-13 19:45:01.497422 IP 192.168.5.1.36413 > 192.168.5.2.36297: sctp (1) [COOKIE ECHO] 
    4  2023-05-13 19:45:01.497437 IP 192.168.5.2.36297 > 192.168.5.1.36413: sctp (1) [COOKIE ACK] 
    5  2023-05-13 19:45:01.497461 IP 192.168.5.1.36413 > 192.168.5.2.36297: sctp (1) [I-DATA] (B) [TSN: 2906273895] [SID: 0] [MID: 0] [PPID 0x0] 
    6  2023-05-13 19:45:01.497469 IP 192.168.5.2.36297 > 192.168.5.1.36413: sctp (1) [SACK] [cum ack 2906273895] [a_rwnd 105048] [#gap acks 0] [#dup tsns 0] 
    7  2023-05-13 19:45:01.497473 IP 192.168.5.1.36413 > 192.168.5.2.36297: sctp (1) [I-DATA] (E) [TSN: 2906273896] [SID: 0] [MID: 0] [FSN: 0] 
    8  2023-05-13 19:45:01.497529 IP 192.168.5.2.36297 > 192.168.5.1.36413: sctp (1) [SACK] [cum ack 2906273896] [a_rwnd 106496] [#gap acks 0] [#dup tsns 0] , (2) [I-DATA] (B) [TSN: 2320017092] [SID: 0] [MID: 0] [PPID 0x0] 
    9  2023-05-13 19:45:01.497539 IP 192.168.5.1.36413 > 192.168.5.2.36297: sctp (1) [SACK] [cum ack 2320017092] [a_rwnd 105064] [#gap acks 0] [#dup tsns 0] 
   10  2023-05-13 19:45:01.497543 IP 192.168.5.2.36297 > 192.168.5.1.36413: sctp (1) [I-DATA] (E) [TSN: 2320017093] [SID: 0] [MID: 0] [FSN: 0] 
   11  2023-05-13 19:45:01.497595 IP 192.168.5.1.36413 > 192.168.5.2.36297: sctp (1) [SHUTDOWN] 
   12  2023-05-13 19:45:01.497603 IP 192.168.5.2.36297 > 192.168.5.1.36413: sctp (1) [SHUTDOWN ACK] 
   13  2023-05-13 19:45:01.497608 IP 192.168.5.1.36413 > 192.168.5.2.36297: sctp (1) [SHUTDOWN COMPLETE] 
