    1  2023-05-16 21:05:30.306064 IP 192.168.5.1.36296 > 192.168.5.2.36297: sctp (1) [INIT] [init tag: 418238363] [rwnd: 106496] [OS: 10] [MIS: 65535] [init TSN: 1890701201] 
    2  2023-05-16 21:05:30.306083 IP 192.168.5.2.36297 > 192.168.5.1.36296: sctp (1) [INIT ACK] [init tag: 4149529168] [rwnd: 106496] [OS: 5] [MIS: 5] [init TSN: 3973583667] 
    3  2023-05-16 21:05:30.306092 IP 192.168.5.1.36296 > 192.168.5.2.36297: sctp (1) [COOKIE ECHO] 
    4  2023-05-16 21:05:30.306103 IP 192.168.5.2.36297 > 192.168.5.1.36296: sctp (1) [COOKIE ACK] 
    5  2023-05-16 21:05:30.306113 IP 192.168.5.1.36296 > 192.168.5.2.36297: sctp (1) [DATA] (B)(E) [TSN: 1890701201] [SID: 0] [SSEQ 0] [PPID 0x0] 
    6  2023-05-16 21:05:30.306117 IP 192.168.5.2.36297 > 192.168.5.1.36296: sctp (1) [SACK] [cum ack 1890701201] [a_rwnd 106486] [#gap acks 0] [#dup tsns 0] 
    7  2023-05-16 21:05:30.306174 IP 192.168.5.2.36297 > 192.168.5.1.36296: sctp (1) [DATA] (B)(E) [TSN: 3973583667] [SID: 0] [SSEQ 0] [PPID 0x0] 
    8  2023-05-16 21:05:30.306182 IP 192.168.5.1.36296 > 192.168.5.2.36297: sctp (1) [SACK] [cum ack 3973583667] [a_rwnd 106486] [#gap acks 0] [#dup tsns 0] 
    9  2023-05-16 21:05:30.306212 IP 192.168.5.1.36296 > 192.168.5.2.36297: sctp (1) [ASCONF] [SEQ: 1890701201, ADDR: 192.168.5.1] [ADD ADDR]
   10  2023-05-16 21:05:30.306220 IP 192.168.5.2.36297 > 192.168.5.1.36296: sctp (1) [ASCONF-ACK] [SEQ: 1890701201] 
   11  2023-05-16 21:05:30.306221 IP 192.168.5.2.36297 > 192.168.5.3.36296: sctp (1) [HB REQ] 
   12  2023-05-16 21:05:30.306231 IP 192.168.5.1.36296 > 192.168.5.2.36297: sctp (1) [HB ACK] 
   13  2023-05-16 21:05:30.306267 IP 192.168.5.1.36296 > 192.168.5.2.36297: sctp (1) [DATA] (B)(E) [TSN: 1890701202] [SID: 0] [SSEQ 1] [PPID 0x0] 
   14  2023-05-16 21:05:30.306308 IP 192.168.5.2.36297 > 192.168.5.1.36296: sctp (1) [SACK] [cum ack 1890701202] [a_rwnd 106496] [#gap acks 0] [#dup tsns 0] , (2) [DATA] (B)(E) [TSN: 3973583668] [SID: 0] [SSEQ 1] [PPID 0x0] 
   15  2023-05-16 21:05:30.306356 IP 192.168.5.1.36296 > 192.168.5.2.36297: sctp (1) [ASCONF] [SEQ: 1890701202, ADDR: 192.168.5.3] [SET PRIM ADDR]
   16  2023-05-16 21:05:30.306360 IP 192.168.5.2.36297 > 192.168.5.1.36296: sctp (1) [ASCONF-ACK] [SEQ: 1890701202] 
   17  2023-05-16 21:05:30.306385 IP 192.168.5.1.36296 > 192.168.5.2.36297: sctp (1) [SACK] [cum ack 3973583668] [a_rwnd 106496] [#gap acks 0] [#dup tsns 0] , (2) [DATA] (B)(E) [TSN: 1890701203] [SID: 0] [SSEQ 2] [PPID 0x0] 
   18  2023-05-16 21:05:30.306503 IP 192.168.5.2.36297 > 192.168.5.3.36296: sctp (1) [DATA] (B)(E) [TSN: 3973583669] [SID: 0] [SSEQ 2] [PPID 0x0] 
   19  2023-05-16 21:05:30.514024 IP 192.168.5.1.36296 > 192.168.5.2.36297: sctp (1) [SACK] [cum ack 3973583669] [a_rwnd 106496] [#gap acks 0] [#dup tsns 0] , (2) [DATA] (B)(E) [TSN: 1890701204] [SID: 0] [SSEQ 3] [PPID 0x0] 
   20  2023-05-16 21:05:30.514024 IP 192.168.5.2.36297 > 192.168.5.1.36296: sctp (1) [SACK] [cum ack 1890701203] [a_rwnd 106496] [#gap acks 0] [#dup tsns 0] 
   21  2023-05-16 21:05:30.514075 IP 192.168.5.2.36297 > 192.168.5.3.36296: sctp (1) [DATA] (B)(E) [TSN: 3973583670] [SID: 0] [SSEQ 3] [PPID 0x0] 
   22  2023-05-16 21:05:30.514137 IP 192.168.5.1.36296 > 192.168.5.2.36297: sctp (1) [ASCONF] [SEQ: 1890701203, ADDR: 192.168.5.1] [DEL ADDR]
   23  2023-05-16 21:05:30.514145 IP 192.168.5.2.36297 > 192.168.5.1.36296: sctp (1) [ASCONF-ACK] [SEQ: 1890701203] 
   24  2023-05-16 21:05:30.718033 IP 192.168.5.1.36296 > 192.168.5.2.36297: sctp (1) [SACK] [cum ack 3973583670] [a_rwnd 106496] [#gap acks 0] [#dup tsns 0] , (2) [DATA] (B)(E) [TSN: 1890701205] [SID: 0] [SSEQ 4] [PPID 0x0] 
   25  2023-05-16 21:05:30.718039 IP 192.168.5.2.36297 > 192.168.5.1.36296: sctp (1) [SACK] [cum ack 1890701204] [a_rwnd 106496] [#gap acks 0] [#dup tsns 0] 
   26  2023-05-16 21:05:30.718097 IP 192.168.5.2.36297 > 192.168.5.1.36296: sctp (1) [SACK] [cum ack 1890701205] [a_rwnd 106496] [#gap acks 0] [#dup tsns 0] , (2) [DATA] (B)(E) [TSN: 3973583671] [SID: 0] [SSEQ 4] [PPID 0x0] 
   27  2023-05-16 21:05:30.718123 IP 192.168.5.1.36296 > 192.168.5.2.36297: sctp (1) [SHUTDOWN] 
   28  2023-05-16 21:05:30.718131 IP 192.168.5.2.36297 > 192.168.5.1.36296: sctp (1) [SHUTDOWN ACK] 
   29  2023-05-16 21:05:30.718162 IP 192.168.5.1.36296 > 192.168.5.2.36297: sctp (1) [SHUTDOWN COMPLETE] 
