    1  2023-05-13 19:56:38.595332 IP 192.168.5.1.58384 > 192.168.5.2.36297: sctp (1) [INIT] [init tag: 2670115933] [rwnd: 106496] [OS: 10] [MIS: 65535] [init TSN: 1593007960] 
    2  2023-05-13 19:56:38.595368 IP 192.168.5.2.36297 > 192.168.5.1.58384: sctp (1) [INIT ACK] [init tag: 2082750980] [rwnd: 106496] [OS: 5] [MIS: 5] [init TSN: 2238062072] 
    3  2023-05-13 19:56:38.595379 IP 192.168.5.1.58384 > 192.168.5.2.36297: sctp (1) [COOKIE ECHO] 
    4  2023-05-13 19:56:38.595392 IP 192.168.5.2.36297 > 192.168.5.1.58384: sctp (1) [COOKIE ACK] 
    5  2023-05-13 19:56:38.595416 IP 192.168.5.1.58384 > 192.168.5.2.36297: sctp (1) [RE-CONFIG] [OUT SSN RESET][IN SSN RESET]
    6  2023-05-13 19:56:38.595421 IP 192.168.5.2.36297 > 192.168.5.1.58384: sctp (1) [RE-CONFIG] [RESP], (2) [RE-CONFIG] [OUT SSN RESET]
    7  2023-05-13 19:56:38.595426 IP 192.168.5.1.58384 > 192.168.5.2.36297: sctp (1) [RE-CONFIG] [RESP]
    8  2023-05-13 19:56:38.595434 IP 192.168.5.1.58384 > 192.168.5.2.36297: sctp (1) [DATA] (B)(E) [TSN: 1593007960] [SID: 0] [SSEQ 0] [PPID 0x0] 
    9  2023-05-13 19:56:38.595440 IP 192.168.5.2.36297 > 192.168.5.1.58384: sctp (1) [SACK] [cum ack 1593007960] [a_rwnd 106486] [#gap acks 0] [#dup tsns 0] 
   10  2023-05-13 19:56:40.359603 IP 192.168.5.1.58384 > 192.168.5.4.36297: sctp (1) [HB REQ] 
   11  2023-05-13 19:56:40.359631 IP 192.168.5.2.36297 > 192.168.5.1.58384: sctp (1) [HB ACK] 
   12  2023-05-13 19:56:42.055670 IP 192.168.5.2.36297 > 192.168.5.3.58384: sctp (1) [HB REQ] 
   13  2023-05-13 19:56:42.055866 IP 192.168.5.1.58384 > 192.168.5.2.36297: sctp (1) [HB ACK] 
   14  2023-05-13 19:56:51.811692 IP 192.168.5.1.58384 > 192.168.5.2.36297: sctp (1) [SHUTDOWN] 
   15  2023-05-13 19:56:51.811707 IP 192.168.5.2.36297 > 192.168.5.1.58384: sctp (1) [SHUTDOWN ACK] 
   16  2023-05-13 19:56:51.811712 IP 192.168.5.1.58384 > 192.168.5.2.36297: sctp (1) [SHUTDOWN COMPLETE] 
