    1  16:57:31.257128 IP 127.0.0.1.40054 > 127.0.0.1.3309: Flags [S], seq 3784122596, win 65495, options [mss 65495,sackOK,TS val 1977541146 ecr 0,nop,wscale 7], length 0
    2  16:57:31.257135 IP 127.0.0.1.3309 > 127.0.0.1.40054: Flags [S.], seq 4139244470, ack 3784122597, win 65483, options [mss 65495,sackOK,TS val 1977541146 ecr 1977541146,nop,wscale 7], length 0
    3  16:57:31.257142 IP 127.0.0.1.40054 > 127.0.0.1.3309: Flags [.], ack 1, win 512, options [nop,nop,TS val 1977541146 ecr 1977541146], length 0
    4  16:57:31.257310 IP 127.0.0.1.3309 > 127.0.0.1.40054: Flags [P.], seq 1:129, ack 1, win 512, options [nop,nop,TS val 1977541146 ecr 1977541146], length 128: IPROTO: Tarantool 2.10.4 (Binary) e6bd3069-1336-4934-97d1-61b2dc4392f9 
    5  16:57:31.257314 IP 127.0.0.1.40054 > 127.0.0.1.3309: Flags [.], ack 129, win 511, options [nop,nop,TS val 1977541146 ecr 1977541146], length 0
    6  16:57:31.257375 IP 127.0.0.1.40054 > 127.0.0.1.3309: Flags [P.], seq 1:9, ack 129, win 512, options [nop,nop,TS val 1977541146 ecr 1977541146], length 8: IPROTO
	1) size 8: request: VOTE
    7  16:57:31.257378 IP 127.0.0.1.3309 > 127.0.0.1.40054: Flags [.], ack 9, win 512, options [nop,nop,TS val 1977541146 ecr 1977541146], length 0
    8  16:57:31.257559 IP 127.0.0.1.3309 > 127.0.0.1.40054: Flags [P.], seq 129:174, ack 9, win 512, options [nop,nop,TS val 1977541146 ecr 1977541146], length 45: IPROTO
	1) size 45: response: OK, SYNC: 0, SCHEMA_VERSION: 0
    9  16:57:31.266905 IP 127.0.0.1.40054 > 127.0.0.1.3309: Flags [F.], seq 9, ack 174, win 512, options [nop,nop,TS val 1977541156 ecr 1977541146], length 0
   10  16:57:31.267007 IP 127.0.0.1.3309 > 127.0.0.1.40054: Flags [F.], seq 174, ack 10, win 512, options [nop,nop,TS val 1977541156 ecr 1977541156], length 0
   11  16:57:31.267015 IP 127.0.0.1.40054 > 127.0.0.1.3309: Flags [.], ack 175, win 512, options [nop,nop,TS val 1977541156 ecr 1977541156], length 0
   12  16:57:31.284958 IP 127.0.0.1.40070 > 127.0.0.1.3309: Flags [S], seq 1357811807, win 65495, options [mss 65495,sackOK,TS val 1977541174 ecr 0,nop,wscale 7], length 0
   13  16:57:31.284966 IP 127.0.0.1.3309 > 127.0.0.1.40070: Flags [S.], seq 4221993135, ack 1357811808, win 65483, options [mss 65495,sackOK,TS val 1977541174 ecr 1977541174,nop,wscale 7], length 0
   14  16:57:31.284972 IP 127.0.0.1.40070 > 127.0.0.1.3309: Flags [.], ack 1, win 512, options [nop,nop,TS val 1977541174 ecr 1977541174], length 0
   15  16:57:31.285240 IP 127.0.0.1.3309 > 127.0.0.1.40070: Flags [P.], seq 1:129, ack 1, win 512, options [nop,nop,TS val 1977541174 ecr 1977541174], length 128: IPROTO: Tarantool 2.10.4 (Binary) e6bd3069-1336-4934-97d1-61b2dc4392f9 
   16  16:57:31.285247 IP 127.0.0.1.40070 > 127.0.0.1.3309: Flags [.], ack 129, win 511, options [nop,nop,TS val 1977541174 ecr 1977541174], length 0
   17  16:57:31.285353 IP 127.0.0.1.40070 > 127.0.0.1.3309: Flags [P.], seq 1:9, ack 129, win 512, options [nop,nop,TS val 1977541174 ecr 1977541174], length 8: IPROTO
	1) size 8: request: VOTE
   18  16:57:31.285357 IP 127.0.0.1.3309 > 127.0.0.1.40070: Flags [.], ack 9, win 512, options [nop,nop,TS val 1977541174 ecr 1977541174], length 0
   19  16:57:31.285461 IP 127.0.0.1.3309 > 127.0.0.1.40070: Flags [P.], seq 129:176, ack 9, win 512, options [nop,nop,TS val 1977541174 ecr 1977541174], length 47: IPROTO
	1) size 47: response: OK, SYNC: 0, SCHEMA_VERSION: 80
   20  16:57:31.285500 IP 127.0.0.1.40070 > 127.0.0.1.3309: Flags [P.], seq 9:63, ack 176, win 512, options [nop,nop,TS val 1977541174 ecr 1977541174], length 54: IPROTO
	1) size 54: request: AUTH, SYNC: 0
   21  16:57:31.285673 IP 127.0.0.1.3309 > 127.0.0.1.40070: Flags [P.], seq 176:205, ack 63, win 512, options [nop,nop,TS val 1977541174 ecr 1977541174], length 29: IPROTO
	1) size 29: response: OK, SYNC: 0, SCHEMA_VERSION: 80
   22  16:57:31.285736 IP 127.0.0.1.40070 > 127.0.0.1.3309: Flags [P.], seq 63:117, ack 205, win 512, options [nop,nop,TS val 1977541174 ecr 1977541174], length 54: IPROTO
	1) size 54: request: JOIN, SYNC: 0
   23  16:57:31.286004 IP 127.0.0.1.3309 > 127.0.0.1.40070: Flags [P.], seq 205:218, ack 117, win 512, options [nop,nop,TS val 1977541175 ecr 1977541174], length 13: IPROTO
	1) size 13: response: HEARTBEAT
   24  16:57:31.286011 IP 127.0.0.1.3309 > 127.0.0.1.40070: Flags [P.], seq 218:226, ack 117, win 512, options [nop,nop,TS val 1977541175 ecr 1977541174], length 8: IPROTO
	1) size 8: request: JOIN_META, SYNC: 0
   25  16:57:31.286014 IP 127.0.0.1.3309 > 127.0.0.1.40070: Flags [P.], seq 226:243, ack 117, win 512, options [nop,nop,TS val 1977541175 ecr 1977541174], length 17: IPROTO
	1) size 17: request: RAFT_PROMOTE, SYNC: 0, REPLICA_ID: 1
   26  16:57:31.286016 IP 127.0.0.1.3309 > 127.0.0.1.40070: Flags [P.], seq 243:251, ack 117, win 512, options [nop,nop,TS val 1977541175 ecr 1977541174], length 8: IPROTO
	1) size 8: request: JOIN_SNAPSHOT, SYNC: 0
   27  16:57:31.286048 IP 127.0.0.1.40070 > 127.0.0.1.3309: Flags [.], ack 251, win 512, options [nop,nop,TS val 1977541175 ecr 1977541175], length 0
   28  16:57:31.286105 IP 127.0.0.1.3309 > 127.0.0.1.40070: Flags [P.], seq 251:314, ack 117, win 512, options [nop,nop,TS val 1977541175 ecr 1977541175], length 63: IPROTO
	1) size 63: request: INSERT, SYNC: 0
   29  16:57:31.286111 IP 127.0.0.1.3309 > 127.0.0.1.40070: Flags [P.], seq 314:341, ack 117, win 512, options [nop,nop,TS val 1977541175 ecr 1977541175], length 27: IPROTO
	1) size 27: request: INSERT, SYNC: 0
   30  16:57:31.286115 IP 127.0.0.1.3309 > 127.0.0.1.40070: Flags [P.], seq 341:369, ack 117, win 512, options [nop,nop,TS val 1977541175 ecr 1977541175], length 28: IPROTO
	1) size 28: request: INSERT, SYNC: 0
   31  16:57:31.286118 IP 127.0.0.1.3309 > 127.0.0.1.40070: Flags [P.], seq 369:402, ack 117, win 512, options [nop,nop,TS val 1977541175 ecr 1977541175], length 33: IPROTO
	1) size 33: request: INSERT, SYNC: 0
   32  16:57:31.286120 IP 127.0.0.1.3309 > 127.0.0.1.40070: Flags [P.], seq 402:453, ack 117, win 512, options [nop,nop,TS val 1977541175 ecr 1977541175], length 51: IPROTO
	1) size 51: request: INSERT, SYNC: 0
   33  16:57:31.286122 IP 127.0.0.1.3309 > 127.0.0.1.40070: Flags [P.], seq 453:506, ack 117, win 512, options [nop,nop,TS val 1977541175 ecr 1977541175], length 53: IPROTO
	1) size 53: request: INSERT, SYNC: 0
   34  16:57:31.286124 IP 127.0.0.1.3309 > 127.0.0.1.40070: Flags [P.], seq 506:541, ack 117, win 512, options [nop,nop,TS val 1977541175 ecr 1977541175], length 35: IPROTO
	1) size 35: request: INSERT, SYNC: 0
   35  16:57:31.286126 IP 127.0.0.1.3309 > 127.0.0.1.40070: Flags [P.], seq 541:599, ack 117, win 512, options [nop,nop,TS val 1977541175 ecr 1977541175], length 58: IPROTO
	1) size 58: request: INSERT, SYNC: 0
   36  16:57:31.286128 IP 127.0.0.1.3309 > 127.0.0.1.40070: Flags [P.], seq 599:659, ack 117, win 512, options [nop,nop,TS val 1977541175 ecr 1977541175], length 60: IPROTO
	1) size 60: request: INSERT, SYNC: 0
   37  16:57:31.286130 IP 127.0.0.1.3309 > 127.0.0.1.40070: Flags [P.], seq 659:718, ack 117, win 512, options [nop,nop,TS val 1977541175 ecr 1977541175], length 59: IPROTO
	1) size 59: request: INSERT, SYNC: 0
   38  16:57:31.286166 IP 127.0.0.1.40070 > 127.0.0.1.3309: Flags [.], ack 718, win 512, options [nop,nop,TS val 1977541175 ecr 1977541175], length 0
   39  16:57:31.286173 IP 127.0.0.1.3309 > 127.0.0.1.40070: Flags [P.], seq 718:5866, ack 117, win 512, options [nop,nop,TS val 1977541175 ecr 1977541175], length 5148: IPROTO
	1) size 58: request: INSERT, SYNC: 0
	2) size 60: request: INSERT, SYNC: 0
	3) size 59: request: INSERT, SYNC: 0
	4) size 58: request: INSERT, SYNC: 0
	5) size 60: request: INSERT, SYNC: 0
	6) size 59: request: INSERT, SYNC: 0
	7) size 58: request: INSERT, SYNC: 0
	8) size 60: request: INSERT, SYNC: 0
	9) size 59: request: INSERT, SYNC: 0
	10) size 58: request: INSERT, SYNC: 0
	11) size 60: request: INSERT, SYNC: 0
	12) size 59: request: INSERT, SYNC: 0
	13) size 58: request: INSERT, SYNC: 0
	14) size 60: request: INSERT, SYNC: 0
	15) size 59: request: INSERT, SYNC: 0
	16) size 58: request: INSERT, SYNC: 0
	17) size 60: request: INSERT, SYNC: 0
	18) size 59: request: INSERT, SYNC: 0
	19) size 58: request: INSERT, SYNC: 0
	20) size 60: request: INSERT, SYNC: 0
	21) size 59: request: INSERT, SYNC: 0
	22) size 68: request: INSERT, SYNC: 0
	23) size 70: request: INSERT, SYNC: 0
	24) size 69: request: INSERT, SYNC: 0
	25) size 58: request: INSERT, SYNC: 0
	26) size 60: request: INSERT, SYNC: 0
	27) size 59: request: INSERT, SYNC: 0
	28) size 58: request: INSERT, SYNC: 0
	29) size 60: request: INSERT, SYNC: 0
	30) size 59: request: INSERT, SYNC: 0
	31) size 58: request: INSERT, SYNC: 0
	32) size 60: request: INSERT, SYNC: 0
	33) size 59: request: INSERT, SYNC: 0
	34) size 58: request: INSERT, SYNC: 0
	35) size 60: request: INSERT, SYNC: 0
	36) size 59: request: INSERT, SYNC: 0
	37) size 85: request: INSERT, SYNC: 0
	38) size 87: request: INSERT, SYNC: 0
	39) size 86: request: INSERT, SYNC: 0
	40) size 87: request: INSERT, SYNC: 0
	41) size 89: request: INSERT, SYNC: 0
	42) size 88: request: INSERT, SYNC: 0
	43) size 60: request: INSERT, SYNC: 0
	44) size 62: request: INSERT, SYNC: 0
	45) size 61: request: INSERT, SYNC: 0
	46) size 58: request: INSERT, SYNC: 0
	47) size 60: request: INSERT, SYNC: 0
	48) size 59: request: INSERT, SYNC: 0
	49) size 58: request: INSERT, SYNC: 0
	50) size 60: request: INSERT, SYNC: 0
	51) size 59: request: INSERT, SYNC: 0
	52) size 58: request: INSERT, SYNC: 0
	53) size 60: request: INSERT, SYNC: 0
	54) size 59: request: INSERT, SYNC: 0
	55) size 81: request: INSERT, SYNC: 0
	56) size 83: request: INSERT, SYNC: 0
	57) size 82: request: INSERT, SYNC: 0
	58) size 58: request: INSERT, SYNC: 0
	59) size 60: request: INSERT, SYNC: 0
	60) size 59: request: INSERT, SYNC: 0
	61) size 58: request: INSERT, SYNC: 0
	62) size 60: request: INSERT, SYNC: 0
	63) size 59: request: INSERT, SYNC: 0
	64) size 58: request: INSERT, SYNC: 0
	65) size 60: request: INSERT, SYNC: 0
	66) size 59: request: INSERT, SYNC: 0
	67) size 82: request: INSERT, SYNC: 0
	68) size 84: request: INSERT, SYNC: 0
	69) size 83: request: INSERT, SYNC: 0
	70) size 60: request: INSERT, SYNC: 0
	71) size 62: request: INSERT, SYNC: 0
	72) size 61: request: INSERT, SYNC: 0
	73) size 58: request: INSERT, SYNC: 0
	74) size 60: request: INSERT, SYNC: 0
	75) size 59: request: INSERT, SYNC: 0
	76) size 64: request: INSERT, SYNC: 0
	77) size 66: request: INSERT, SYNC: 0
	78) size 65: request: INSERT, SYNC: 0
	79) size 58: request: INSERT, SYNC: 0
	80) size 60: request: INSERT, SYNC: 0
	81) size 59: request: INSERT, SYNC: 0
   40  16:57:31.286176 IP 127.0.0.1.3309 > 127.0.0.1.40070: Flags [P.], seq 5866:5924, ack 117, win 512, options [nop,nop,TS val 1977541175 ecr 1977541175], length 58: IPROTO
	1) size 58: request: INSERT, SYNC: 0
   41  16:57:31.286178 IP 127.0.0.1.3309 > 127.0.0.1.40070: Flags [P.], seq 5924:5984, ack 117, win 512, options [nop,nop,TS val 1977541175 ecr 1977541175], length 60: IPROTO
	1) size 60: request: INSERT, SYNC: 0
   42  16:57:31.286179 IP 127.0.0.1.3309 > 127.0.0.1.40070: Flags [P.], seq 5984:6043, ack 117, win 512, options [nop,nop,TS val 1977541175 ecr 1977541175], length 59: IPROTO
	1) size 59: request: INSERT, SYNC: 0
   43  16:57:31.286181 IP 127.0.0.1.3309 > 127.0.0.1.40070: Flags [P.], seq 6043:6103, ack 117, win 512, options [nop,nop,TS val 1977541175 ecr 1977541175], length 60: IPROTO
	1) size 60: request: INSERT, SYNC: 0
   44  16:57:31.286183 IP 127.0.0.1.3309 > 127.0.0.1.40070: Flags [P.], seq 6103:6165, ack 117, win 512, options [nop,nop,TS val 1977541175 ecr 1977541175], length 62: IPROTO
	1) size 62: request: INSERT, SYNC: 0
   45  16:57:31.286185 IP 127.0.0.1.3309 > 127.0.0.1.40070: Flags [P.], seq 6165:6226, ack 117, win 512, options [nop,nop,TS val 1977541175 ecr 1977541175], length 61: IPROTO
	1) size 61: request: INSERT, SYNC: 0
   46  16:57:31.286187 IP 127.0.0.1.3309 > 127.0.0.1.40070: Flags [P.], seq 6226:6284, ack 117, win 512, options [nop,nop,TS val 1977541175 ecr 1977541175], length 58: IPROTO
	1) size 58: request: INSERT, SYNC: 0
   47  16:57:31.286189 IP 127.0.0.1.3309 > 127.0.0.1.40070: Flags [P.], seq 6284:6344, ack 117, win 512, options [nop,nop,TS val 1977541175 ecr 1977541175], length 60: IPROTO
	1) size 60: request: INSERT, SYNC: 0
   48  16:57:31.286190 IP 127.0.0.1.3309 > 127.0.0.1.40070: Flags [P.], seq 6344:6403, ack 117, win 512, options [nop,nop,TS val 1977541175 ecr 1977541175], length 59: IPROTO
	1) size 59: request: INSERT, SYNC: 0
   49  16:57:31.286192 IP 127.0.0.1.3309 > 127.0.0.1.40070: Flags [P.], seq 6403:6461, ack 117, win 512, options [nop,nop,TS val 1977541175 ecr 1977541175], length 58: IPROTO
	1) size 58: request: INSERT, SYNC: 0
   50  16:57:31.286194 IP 127.0.0.1.3309 > 127.0.0.1.40070: Flags [P.], seq 6461:6521, ack 117, win 512, options [nop,nop,TS val 1977541175 ecr 1977541175], length 60: IPROTO
	1) size 60: request: INSERT, SYNC: 0
   51  16:57:31.286196 IP 127.0.0.1.3309 > 127.0.0.1.40070: Flags [P.], seq 6521:6580, ack 117, win 512, options [nop,nop,TS val 1977541175 ecr 1977541175], length 59: IPROTO
	1) size 59: request: INSERT, SYNC: 0
   52  16:57:31.286198 IP 127.0.0.1.3309 > 127.0.0.1.40070: Flags [P.], seq 6580:6638, ack 117, win 512, options [nop,nop,TS val 1977541175 ecr 1977541175], length 58: IPROTO
	1) size 58: request: INSERT, SYNC: 0
   53  16:57:31.286200 IP 127.0.0.1.3309 > 127.0.0.1.40070: Flags [P.], seq 6638:6698, ack 117, win 512, options [nop,nop,TS val 1977541175 ecr 1977541175], length 60: IPROTO
	1) size 60: request: INSERT, SYNC: 0
   54  16:57:31.286202 IP 127.0.0.1.3309 > 127.0.0.1.40070: Flags [P.], seq 6698:6757, ack 117, win 512, options [nop,nop,TS val 1977541175 ecr 1977541175], length 59: IPROTO
	1) size 59: request: INSERT, SYNC: 0
   55  16:57:31.286204 IP 127.0.0.1.3309 > 127.0.0.1.40070: Flags [P.], seq 6757:6815, ack 117, win 512, options [nop,nop,TS val 1977541175 ecr 1977541175], length 58: IPROTO
	1) size 58: request: INSERT, SYNC: 0
   56  16:57:31.286206 IP 127.0.0.1.3309 > 127.0.0.1.40070: Flags [P.], seq 6815:6875, ack 117, win 512, options [nop,nop,TS val 1977541175 ecr 1977541175], length 60: IPROTO
	1) size 60: request: INSERT, SYNC: 0
   57  16:57:31.286208 IP 127.0.0.1.3309 > 127.0.0.1.40070: Flags [P.], seq 6875:6934, ack 117, win 512, options [nop,nop,TS val 1977541175 ecr 1977541175], length 59: IPROTO
	1) size 59: request: INSERT, SYNC: 0
   58  16:57:31.286210 IP 127.0.0.1.3309 > 127.0.0.1.40070: Flags [P.], seq 6934:6992, ack 117, win 512, options [nop,nop,TS val 1977541175 ecr 1977541175], length 58: IPROTO
	1) size 58: request: INSERT, SYNC: 0
   59  16:57:31.286312 IP 127.0.0.1.40070 > 127.0.0.1.3309: Flags [.], ack 6992, win 463, options [nop,nop,TS val 1977541175 ecr 1977541175], length 0
   60  16:57:31.286319 IP 127.0.0.1.3309 > 127.0.0.1.40070: Flags [P.], seq 6992:26160, ack 117, win 512, options [nop,nop,TS val 1977541175 ecr 1977541175], length 19168: IPROTO
	1) size 60: request: INSERT, SYNC: 0
	2) size 59: request: INSERT, SYNC: 0
	3) size 58: request: INSERT, SYNC: 0
	4) size 60: request: INSERT, SYNC: 0
	5) size 59: request: INSERT, SYNC: 0
	6) size 58: request: INSERT, SYNC: 0
	7) size 60: request: INSERT, SYNC: 0
	8) size 59: request: INSERT, SYNC: 0
	9) size 58: request: INSERT, SYNC: 0
	10) size 60: request: INSERT, SYNC: 0
	11) size 59: request: INSERT, SYNC: 0
	12) size 58: request: INSERT, SYNC: 0
	13) size 60: request: INSERT, SYNC: 0
	14) size 59: request: INSERT, SYNC: 0
	15) size 58: request: INSERT, SYNC: 0
	16) size 60: request: INSERT, SYNC: 0
	17) size 59: request: INSERT, SYNC: 0
	18) size 58: request: INSERT, SYNC: 0
	19) size 60: request: INSERT, SYNC: 0
	20) size 59: request: INSERT, SYNC: 0
	21) size 58: request: INSERT, SYNC: 0
	22) size 61: request: INSERT, SYNC: 0
	23) size 60: request: INSERT, SYNC: 0
	24) size 61: request: INSERT, SYNC: 0
	25) size 63: request: INSERT, SYNC: 0
	26) size 62: request: INSERT, SYNC: 0
	27) size 59: request: INSERT, SYNC: 0
	28) size 61: request: INSERT, SYNC: 0
	29) size 60: request: INSERT, SYNC: 0
	30) size 61: request: INSERT, SYNC: 0
	31) size 63: request: INSERT, SYNC: 0
	32) size 62: request: INSERT, SYNC: 0
	33) size 59: request: INSERT, SYNC: 0
	34) size 61: request: INSERT, SYNC: 0
	35) size 60: request: INSERT, SYNC: 0
	36) size 59: request: INSERT, SYNC: 0
	37) size 61: request: INSERT, SYNC: 0
	38) size 60: request: INSERT, SYNC: 0
	39) size 59: request: INSERT, SYNC: 0
	40) size 61: request: INSERT, SYNC: 0
	41) size 60: request: INSERT, SYNC: 0
	42) size 59: request: INSERT, SYNC: 0
	43) size 61: request: INSERT, SYNC: 0
	44) size 60: request: INSERT, SYNC: 0
	45) size 59: request: INSERT, SYNC: 0
	46) size 61: request: INSERT, SYNC: 0
	47) size 60: request: INSERT, SYNC: 0
	48) size 59: request: INSERT, SYNC: 0
	49) size 61: request: INSERT, SYNC: 0
	50) size 60: request: INSERT, SYNC: 0
	51) size 59: request: INSERT, SYNC: 0
	52) size 61: request: INSERT, SYNC: 0
	53) size 60: request: INSERT, SYNC: 0
	54) size 59: request: INSERT, SYNC: 0
	55) size 61: request: INSERT, SYNC: 0
	56) size 60: request: INSERT, SYNC: 0
	57) size 59: request: INSERT, SYNC: 0
	58) size 61: request: INSERT, SYNC: 0
	59) size 60: request: INSERT, SYNC: 0
	60) size 61: request: INSERT, SYNC: 0
	61) size 63: request: INSERT, SYNC: 0
	62) size 62: request: INSERT, SYNC: 0
	63) size 59: request: INSERT, SYNC: 0
	64) size 61: request: INSERT, SYNC: 0
	65) size 60: request: INSERT, SYNC: 0
	66) size 59: request: INSERT, SYNC: 0
	67) size 61: request: INSERT, SYNC: 0
	68) size 60: request: INSERT, SYNC: 0
	69) size 59: request: INSERT, SYNC: 0
	70) size 61: request: INSERT, SYNC: 0
	71) size 60: request: INSERT, SYNC: 0
	72) size 59: request: INSERT, SYNC: 0
	73) size 61: request: INSERT, SYNC: 0
	74) size 60: request: INSERT, SYNC: 0
	75) size 59: request: INSERT, SYNC: 0
	76) size 61: request: INSERT, SYNC: 0
	77) size 60: request: INSERT, SYNC: 0
	78) size 59: request: INSERT, SYNC: 0
	79) size 61: request: INSERT, SYNC: 0
	80) size 60: request: INSERT, SYNC: 0
	81) size 59: request: INSERT, SYNC: 0
	82) size 61: request: INSERT, SYNC: 0
	83) size 60: request: INSERT, SYNC: 0
	84) size 59: request: INSERT, SYNC: 0
	85) size 61: request: INSERT, SYNC: 0
	86) size 60: request: INSERT, SYNC: 0
	87) size 81: request: INSERT, SYNC: 0
	88) size 83: request: INSERT, SYNC: 0
	89) size 82: request: INSERT, SYNC: 0
	90) size 59: request: INSERT, SYNC: 0
	91) size 61: request: INSERT, SYNC: 0
	92) size 60: request: INSERT, SYNC: 0
	93) size 59: request: INSERT, SYNC: 0
	94) size 61: request: INSERT, SYNC: 0
	95) size 60: request: INSERT, SYNC: 0
	96) size 59: request: INSERT, SYNC: 0
	97) size 61: request: INSERT, SYNC: 0
	98) size 60: request: INSERT, SYNC: 0
	99) size 59: request: INSERT, SYNC: 0
	100) size 61: request: INSERT, SYNC: 0
	101) size 60: request: INSERT, SYNC: 0
	102) size 69: request: INSERT, SYNC: 0
	103) size 71: request: INSERT, SYNC: 0
	104) size 70: request: INSERT, SYNC: 0
	105) size 59: request: INSERT, SYNC: 0
	106) size 61: request: INSERT, SYNC: 0
	107) size 60: request: INSERT, SYNC: 0
	108) size 83: request: INSERT, SYNC: 0
	109) size 85: request: INSERT, SYNC: 0
	110) size 84: request: INSERT, SYNC: 0
	111) size 59: request: INSERT, SYNC: 0
	112) size 61: request: INSERT, SYNC: 0
	113) size 60: request: INSERT, SYNC: 0
	114) size 59: request: INSERT, SYNC: 0
	115) size 61: request: INSERT, SYNC: 0
	116) size 60: request: INSERT, SYNC: 0
	117) size 59: request: INSERT, SYNC: 0
	118) size 61: request: INSERT, SYNC: 0
	119) size 60: request: INSERT, SYNC: 0
	120) size 59: request: INSERT, SYNC: 0
	121) size 61: request: INSERT, SYNC: 0
	122) size 60: request: INSERT, SYNC: 0
	123) size 59: request: INSERT, SYNC: 0
	124) size 61: request: INSERT, SYNC: 0
	125) size 60: request: INSERT, SYNC: 0
	126) size 59: request: INSERT, SYNC: 0
	127) size 61: request: INSERT, SYNC: 0
	128) size 60: request: INSERT, SYNC: 0
	129) size 64: request: INSERT, SYNC: 0
	130) size 66: request: INSERT, SYNC: 0
	131) size 65: request: INSERT, SYNC: 0
	132) size 59: request: INSERT, SYNC: 0
	133) size 61: request: INSERT, SYNC: 0
	134) size 60: request: INSERT, SYNC: 0
	135) size 59: request: INSERT, SYNC: 0
	136) size 61: request: INSERT, SYNC: 0
	137) size 60: request: INSERT, SYNC: 0
	138) size 59: request: INSERT, SYNC: 0
	139) size 61: request: INSERT, SYNC: 0
	140) size 60: request: INSERT, SYNC: 0
	141) size 59: request: INSERT, SYNC: 0
	142) size 61: request: INSERT, SYNC: 0
	143) size 60: request: INSERT, SYNC: 0
	144) size 61: request: INSERT, SYNC: 0
	145) size 63: request: INSERT, SYNC: 0
	146) size 62: request: INSERT, SYNC: 0
	147) size 59: request: INSERT, SYNC: 0
	148) size 61: request: INSERT, SYNC: 0
	149) size 60: request: INSERT, SYNC: 0
	150) size 60: request: INSERT, SYNC: 0
	151) size 62: request: INSERT, SYNC: 0
	152) size 61: request: INSERT, SYNC: 0
	153) size 60: request: INSERT, SYNC: 0
	154) size 62: request: INSERT, SYNC: 0
	155) size 61: request: INSERT, SYNC: 0
	156) size 82: request: INSERT, SYNC: 0
	157) size 84: request: INSERT, SYNC: 0
	158) size 83: request: INSERT, SYNC: 0
	159) size 83: request: INSERT, SYNC: 0
	160) size 85: request: INSERT, SYNC: 0
	161) size 84: request: INSERT, SYNC: 0
	162) size 80: request: INSERT, SYNC: 0
	163) size 82: request: INSERT, SYNC: 0
	164) size 81: request: INSERT, SYNC: 0
	165) size 80: request: INSERT, SYNC: 0
	166) size 82: request: INSERT, SYNC: 0
	167) size 81: request: INSERT, SYNC: 0
	168) size 80: request: INSERT, SYNC: 0
	169) size 82: request: INSERT, SYNC: 0
	170) size 81: request: INSERT, SYNC: 0
	171) size 143: request: INSERT, SYNC: 0
	172) size 94: request: INSERT, SYNC: 0
	173) size 181: request: INSERT, SYNC: 0
	174) size 184: request: INSERT, SYNC: 0
	175) size 211: request: INSERT, SYNC: 0
	176) size 214: request: INSERT, SYNC: 0
	177) size 257: request: INSERT, SYNC: 0
	178) size 93: request: INSERT, SYNC: 0
	179) size 260: request: INSERT, SYNC: 0
	180) size 173: request: INSERT, SYNC: 0
	181) size 176: request: INSERT, SYNC: 0
	182) size 562: request: INSERT, SYNC: 0
	183) size 565: request: INSERT, SYNC: 0
	184) size 151: request: INSERT, SYNC: 0
	185) size 154: request: INSERT, SYNC: 0
	186) size 180: request: INSERT, SYNC: 0
	187) size 183: request: INSERT, SYNC: 0
	188) size 85: request: INSERT, SYNC: 0
	189) size 111: request: INSERT, SYNC: 0
	190) size 89: request: INSERT, SYNC: 0
	191) size 182: request: INSERT, SYNC: 0
	192) size 295: request: INSERT, SYNC: 0
	193) size 202: request: INSERT, SYNC: 0
	194) size 128: request: INSERT, SYNC: 0
	195) size 105: request: INSERT, SYNC: 0
	196) size 49: request: INSERT, SYNC: 0
	197) size 53: request: INSERT, SYNC: 0
	198) size 55: request: INSERT, SYNC: 0
	199) size 50: request: INSERT, SYNC: 0
	200) size 55: request: INSERT, SYNC: 0
	201) size 50: request: INSERT, SYNC: 0
	202) size 55: request: INSERT, SYNC: 0
	203) size 53: request: INSERT, SYNC: 0
	204) size 50: request: INSERT, SYNC: 0
	205) size 55: request: INSERT, SYNC: 0
	206) size 53: request: INSERT, SYNC: 0
	207) size 50: request: INSERT, SYNC: 0
	208) size 55: request: INSERT, SYNC: 0
	209) size 53: request: INSERT, SYNC: 0
	210) size 50: request: INSERT, SYNC: 0
	211) size 55: request: INSERT, SYNC: 0
	212) size 55: request: INSERT, SYNC: 0
	213) size 53: request: INSERT, SYNC: 0
	214) size 50: request: INSERT, SYNC: 0
	215) size 66: request: INSERT, SYNC: 0
	216) size 61: request: INSERT, SYNC: 0
	217) size 66: request: INSERT, SYNC: 0
	218) size 61: request: INSERT, SYNC: 0
	219) size 55: request: INSERT, SYNC: 0
	220) size 53: request: INSERT, SYNC: 0
	221) size 50: request: INSERT, SYNC: 0
	222) size 55: request: INSERT, SYNC: 0
	223) size 53: request: INSERT, SYNC: 0
	224) size 50: request: INSERT, SYNC: 0
	225) size 55: request: INSERT, SYNC: 0
	226) size 53: request: INSERT, SYNC: 0
	227) size 50: request: INSERT, SYNC: 0
	228) size 55: request: INSERT, SYNC: 0
	229) size 53: request: INSERT, SYNC: 0
	230) size 50: request: INSERT, SYNC: 0
	231) size 73: request: INSERT, SYNC: 0
	232) size 53: request: INSERT, SYNC: 0
	233) size 61: request: INSERT, SYNC: 0
	234) size 73: request: INSERT, SYNC: 0
	235) size 53: request: INSERT, SYNC: 0
	236) size 61: request: INSERT, SYNC: 0
	237) size 55: request: INSERT, SYNC: 0
	238) size 50: request: INSERT, SYNC: 0
	239) size 53: request: INSERT, SYNC: 0
	240) size 56: request: INSERT, SYNC: 0
	241) size 55: request: INSERT, SYNC: 0
	242) size 55: request: INSERT, SYNC: 0
	243) size 56: request: INSERT, SYNC: 0
	244) size 64: request: INSERT, SYNC: 0
	245) size 56: request: INSERT, SYNC: 0
	246) size 64: request: INSERT, SYNC: 0
	247) size 66: request: INSERT, SYNC: 0
	248) size 51: request: INSERT, SYNC: 0
	249) size 53: request: INSERT, SYNC: 0
	250) size 50: request: INSERT, SYNC: 0
	251) size 122: request: INSERT, SYNC: 0
	252) size 169: request: INSERT, SYNC: 0
	253) size 70: request: INSERT, SYNC: 0
	254) size 31: request: INSERT, SYNC: 0
	255) size 32: request: INSERT, SYNC: 0
   61  16:57:31.286320 IP 127.0.0.1.3309 > 127.0.0.1.40070: Flags [P.], seq 26160:26197, ack 117, win 512, options [nop,nop,TS val 1977541175 ecr 1977541175], length 37: IPROTO
	1) size 37: request: INSERT, SYNC: 0
   62  16:57:31.286322 IP 127.0.0.1.3309 > 127.0.0.1.40070: Flags [P.], seq 26197:26228, ack 117, win 512, options [nop,nop,TS val 1977541175 ecr 1977541175], length 31: IPROTO
	1) size 31: request: INSERT, SYNC: 0
   63  16:57:31.286325 IP 127.0.0.1.3309 > 127.0.0.1.40070: Flags [P.], seq 26228:26303, ack 117, win 512, options [nop,nop,TS val 1977541175 ecr 1977541175], length 75: IPROTO
	1) size 75: request: INSERT, SYNC: 0
   64  16:57:31.286328 IP 127.0.0.1.3309 > 127.0.0.1.40070: Flags [P.], seq 26303:26329, ack 117, win 512, options [nop,nop,TS val 1977541175 ecr 1977541175], length 26: IPROTO
	1) size 26: request: INSERT, SYNC: 0
   65  16:57:31.286330 IP 127.0.0.1.3309 > 127.0.0.1.40070: Flags [P.], seq 26329:26359, ack 117, win 512, options [nop,nop,TS val 1977541175 ecr 1977541175], length 30: IPROTO
	1) size 30: request: INSERT, SYNC: 0
   66  16:57:31.286332 IP 127.0.0.1.3309 > 127.0.0.1.40070: Flags [P.], seq 26359:26393, ack 117, win 512, options [nop,nop,TS val 1977541175 ecr 1977541175], length 34: IPROTO
	1) size 34: request: INSERT, SYNC: 0
   67  16:57:31.286334 IP 127.0.0.1.3309 > 127.0.0.1.40070: Flags [P.], seq 26393:26423, ack 117, win 512, options [nop,nop,TS val 1977541175 ecr 1977541175], length 30: IPROTO
	1) size 30: request: INSERT, SYNC: 0
   68  16:57:31.286336 IP 127.0.0.1.3309 > 127.0.0.1.40070: Flags [P.], seq 26423:26453, ack 117, win 512, options [nop,nop,TS val 1977541175 ecr 1977541175], length 30: IPROTO
	1) size 30: request: INSERT, SYNC: 0
   69  16:57:31.286338 IP 127.0.0.1.3309 > 127.0.0.1.40070: Flags [P.], seq 26453:26482, ack 117, win 512, options [nop,nop,TS val 1977541175 ecr 1977541175], length 29: IPROTO
	1) size 29: request: INSERT, SYNC: 0
   70  16:57:31.286340 IP 127.0.0.1.3309 > 127.0.0.1.40070: Flags [P.], seq 26482:26511, ack 117, win 512, options [nop,nop,TS val 1977541175 ecr 1977541175], length 29: IPROTO
	1) size 29: request: INSERT, SYNC: 0
   71  16:57:31.286342 IP 127.0.0.1.3309 > 127.0.0.1.40070: Flags [P.], seq 26511:26540, ack 117, win 512, options [nop,nop,TS val 1977541175 ecr 1977541175], length 29: IPROTO
	1) size 29: request: INSERT, SYNC: 0
   72  16:57:31.286344 IP 127.0.0.1.3309 > 127.0.0.1.40070: Flags [P.], seq 26540:26569, ack 117, win 512, options [nop,nop,TS val 1977541175 ecr 1977541175], length 29: IPROTO
	1) size 29: request: INSERT, SYNC: 0
   73  16:57:31.286346 IP 127.0.0.1.3309 > 127.0.0.1.40070: Flags [P.], seq 26569:26598, ack 117, win 512, options [nop,nop,TS val 1977541175 ecr 1977541175], length 29: IPROTO
	1) size 29: request: INSERT, SYNC: 0
   74  16:57:31.286348 IP 127.0.0.1.3309 > 127.0.0.1.40070: Flags [P.], seq 26598:26627, ack 117, win 512, options [nop,nop,TS val 1977541175 ecr 1977541175], length 29: IPROTO
	1) size 29: request: INSERT, SYNC: 0
   75  16:57:31.286350 IP 127.0.0.1.3309 > 127.0.0.1.40070: Flags [P.], seq 26627:26656, ack 117, win 512, options [nop,nop,TS val 1977541175 ecr 1977541175], length 29: IPROTO
	1) size 29: request: INSERT, SYNC: 0
   76  16:57:31.286352 IP 127.0.0.1.3309 > 127.0.0.1.40070: Flags [P.], seq 26656:26685, ack 117, win 512, options [nop,nop,TS val 1977541175 ecr 1977541175], length 29: IPROTO
	1) size 29: request: INSERT, SYNC: 0
   77  16:57:31.286354 IP 127.0.0.1.3309 > 127.0.0.1.40070: Flags [P.], seq 26685:26714, ack 117, win 512, options [nop,nop,TS val 1977541175 ecr 1977541175], length 29: IPROTO
	1) size 29: request: INSERT, SYNC: 0
   78  16:57:31.286357 IP 127.0.0.1.3309 > 127.0.0.1.40070: Flags [P.], seq 26714:26743, ack 117, win 512, options [nop,nop,TS val 1977541175 ecr 1977541175], length 29: IPROTO
	1) size 29: request: INSERT, SYNC: 0
   79  16:57:31.286359 IP 127.0.0.1.3309 > 127.0.0.1.40070: Flags [P.], seq 26743:26772, ack 117, win 512, options [nop,nop,TS val 1977541175 ecr 1977541175], length 29: IPROTO
	1) size 29: request: INSERT, SYNC: 0
   80  16:57:31.286361 IP 127.0.0.1.3309 > 127.0.0.1.40070: Flags [P.], seq 26772:26802, ack 117, win 512, options [nop,nop,TS val 1977541175 ecr 1977541175], length 30: IPROTO
	1) size 30: request: INSERT, SYNC: 0
   81  16:57:31.286363 IP 127.0.0.1.3309 > 127.0.0.1.40070: Flags [P.], seq 26802:26836, ack 117, win 512, options [nop,nop,TS val 1977541175 ecr 1977541175], length 34: IPROTO
	1) size 34: request: INSERT, SYNC: 0
   82  16:57:31.286365 IP 127.0.0.1.3309 > 127.0.0.1.40070: Flags [P.], seq 26836:26862, ack 117, win 512, options [nop,nop,TS val 1977541175 ecr 1977541175], length 26: IPROTO
	1) size 26: request: INSERT, SYNC: 0
   83  16:57:31.286369 IP 127.0.0.1.3309 > 127.0.0.1.40070: Flags [P.], seq 26862:26888, ack 117, win 512, options [nop,nop,TS val 1977541175 ecr 1977541175], length 26: IPROTO
	1) size 26: request: INSERT, SYNC: 0
   84  16:57:31.286371 IP 127.0.0.1.3309 > 127.0.0.1.40070: Flags [P.], seq 26888:26918, ack 117, win 512, options [nop,nop,TS val 1977541175 ecr 1977541175], length 30: IPROTO
	1) size 30: request: INSERT, SYNC: 0
   85  16:57:31.286373 IP 127.0.0.1.3309 > 127.0.0.1.40070: Flags [P.], seq 26918:26945, ack 117, win 512, options [nop,nop,TS val 1977541175 ecr 1977541175], length 27: IPROTO
	1) size 27: request: INSERT, SYNC: 0
   86  16:57:31.286375 IP 127.0.0.1.3309 > 127.0.0.1.40070: Flags [P.], seq 26945:27001, ack 117, win 512, options [nop,nop,TS val 1977541175 ecr 1977541175], length 56: IPROTO
	1) size 56: request: INSERT, SYNC: 0
   87  16:57:31.286582 IP 127.0.0.1.3309 > 127.0.0.1.40070: Flags [P.], seq 27001:27014, ack 117, win 512, options [nop,nop,TS val 1977541175 ecr 1977541175], length 13: IPROTO
	1) size 13: response: HEARTBEAT
   88  16:57:31.286719 IP 127.0.0.1.3309 > 127.0.0.1.40070: Flags [P.], seq 27014:27082, ack 117, win 512, options [nop,nop,TS val 1977541175 ecr 1977541175], length 68: IPROTO
	1) size 68: request: INSERT, SYNC: 0, REPLICA_ID: 1, LSN: 11, TIMESTAMP: 2022-12-15 16:57:31.286489
   89  16:57:31.286800 IP 127.0.0.1.3309 > 127.0.0.1.40070: Flags [P.], seq 27082:27095, ack 117, win 512, options [nop,nop,TS val 1977541176 ecr 1977541175], length 13: IPROTO
	1) size 13: response: HEARTBEAT
   90  16:57:31.290485 IP 127.0.0.1.40070 > 127.0.0.1.3309: Flags [.], ack 27095, win 359, options [nop,nop,TS val 1977541179 ecr 1977541175], length 0
   91  16:57:31.295019 IP 127.0.0.1.40070 > 127.0.0.1.3309: Flags [P.], seq 117:219, ack 27095, win 512, options [nop,nop,TS val 1977541184 ecr 1977541175], length 102: IPROTO
	1) size 102: request: SUBSCRIBE, SYNC: 0
   92  16:57:31.295163 IP 127.0.0.1.3309 > 127.0.0.1.40070: Flags [P.], seq 27095:27149, ack 219, win 512, options [nop,nop,TS val 1977541184 ecr 1977541184], length 54: IPROTO
	1) size 54: response: OK, SYNC: 0, SCHEMA_VERSION: 0
   93  16:57:31.295184 IP 127.0.0.1.3309 > 127.0.0.1.40070: Flags [P.], seq 27149:27164, ack 219, win 512, options [nop,nop,TS val 1977541184 ecr 1977541184], length 15: IPROTO
	1) size 15: request: RAFT, GROUP_ID: 1, SYNC: 0
   94  16:57:31.295204 IP 127.0.0.1.40070 > 127.0.0.1.3309: Flags [.], ack 27164, win 512, options [nop,nop,TS val 1977541184 ecr 1977541184], length 0
   95  16:57:31.295333 IP 127.0.0.1.40070 > 127.0.0.1.3309: Flags [P.], seq 219:232, ack 27164, win 512, options [nop,nop,TS val 1977541184 ecr 1977541184], length 13: IPROTO
	1) size 13: response: HEARTBEAT
   96  16:57:31.295554 IP 127.0.0.1.3309 > 127.0.0.1.40070: Flags [P.], seq 27164:27184, ack 232, win 512, options [nop,nop,TS val 1977541184 ecr 1977541184], length 20: IPROTO
	1) size 20: request: HEARTBEAT, REPLICA_ID: 1, TIMESTAMP: 2022-12-15 16:57:31.295484
   97  16:57:31.295749 IP 127.0.0.1.40070 > 127.0.0.1.3309: Flags [P.], seq 232:245, ack 27184, win 512, options [nop,nop,TS val 1977541184 ecr 1977541184], length 13: IPROTO
	1) size 13: response: HEARTBEAT
   98  16:57:31.336637 IP 127.0.0.1.3309 > 127.0.0.1.40070: Flags [.], ack 245, win 512, options [nop,nop,TS val 1977541225 ecr 1977541184], length 0
   99  16:57:31.368370 IP 127.0.0.1.40076 > 127.0.0.1.3309: Flags [S], seq 3722433644, win 65495, options [mss 65495,sackOK,TS val 1977541257 ecr 0,nop,wscale 7], length 0
  100  16:57:31.368378 IP 127.0.0.1.3309 > 127.0.0.1.40076: Flags [S.], seq 3735401205, ack 3722433645, win 65483, options [mss 65495,sackOK,TS val 1977541257 ecr 1977541257,nop,wscale 7], length 0
  101  16:57:31.368385 IP 127.0.0.1.40076 > 127.0.0.1.3309: Flags [.], ack 1, win 512, options [nop,nop,TS val 1977541257 ecr 1977541257], length 0
  102  16:57:31.368682 IP 127.0.0.1.3309 > 127.0.0.1.40076: Flags [P.], seq 1:129, ack 1, win 512, options [nop,nop,TS val 1977541257 ecr 1977541257], length 128: IPROTO: Tarantool 2.10.4 (Binary) e6bd3069-1336-4934-97d1-61b2dc4392f9 
  103  16:57:31.368687 IP 127.0.0.1.40076 > 127.0.0.1.3309: Flags [.], ack 129, win 511, options [nop,nop,TS val 1977541257 ecr 1977541257], length 0
  104  16:57:31.368744 IP 127.0.0.1.40076 > 127.0.0.1.3309: Flags [P.], seq 1:20, ack 129, win 512, options [nop,nop,TS val 1977541257 ecr 1977541257], length 19: IPROTO
	1) size 19: request: ID, SYNC: 1
  105  16:57:31.368748 IP 127.0.0.1.3309 > 127.0.0.1.40076: Flags [.], ack 20, win 512, options [nop,nop,TS val 1977541257 ecr 1977541257], length 0
  106  16:57:31.368886 IP 127.0.0.1.3309 > 127.0.0.1.40076: Flags [P.], seq 129:166, ack 20, win 512, options [nop,nop,TS val 1977541258 ecr 1977541257], length 37: IPROTO
	1) size 37: response: OK, SYNC: 1, SCHEMA_VERSION: 80
  107  16:57:31.368950 IP 127.0.0.1.40076 > 127.0.0.1.3309: Flags [P.], seq 20:89, ack 166, win 512, options [nop,nop,TS val 1977541258 ecr 1977541258], length 69: IPROTO
	1) size 23: request: SELECT, SYNC: 2
	2) size 23: request: SELECT, SYNC: 3
	3) size 23: request: SELECT, SYNC: 4
  108  16:57:31.369122 IP 127.0.0.1.3309 > 127.0.0.1.40076: Flags [P.], seq 166:19926, ack 89, win 512, options [nop,nop,TS val 1977541258 ecr 1977541258], length 19760: IPROTO
	1) size 4646: response: OK, SYNC: 2, SCHEMA_VERSION: 80
	2) size 2165: response: OK, SYNC: 3, SCHEMA_VERSION: 80
	3) size 12949: response: OK, SYNC: 4, SCHEMA_VERSION: 80
  109  16:57:31.369454 IP 127.0.0.1.40076 > 127.0.0.1.3309: Flags [P.], seq 89:112, ack 19926, win 512, options [nop,nop,TS val 1977541258 ecr 1977541258], length 23: IPROTO
	1) size 23: UNKNOWN
  110  16:57:31.369464 IP 127.0.0.1.40076 > 127.0.0.1.3309: Flags [P.], seq 112:122, ack 19926, win 512, options [nop,nop,TS val 1977541258 ecr 1977541258], length 10: IPROTO
	1) size 10: request: PING, SYNC: 5
  111  16:57:31.369561 IP 127.0.0.1.3309 > 127.0.0.1.40076: Flags [.], ack 122, win 512, options [nop,nop,TS val 1977541258 ecr 1977541258], length 0
  112  16:57:31.369694 IP 127.0.0.1.3309 > 127.0.0.1.40076: Flags [P.], seq 19926:19978, ack 122, win 512, options [nop,nop,TS val 1977541258 ecr 1977541258], length 52: IPROTO
	1) size 29: response: OK, SYNC: 5, SCHEMA_VERSION: 80
	2) size 23: UNKNOWN
  113  16:57:31.369766 IP 127.0.0.1.40076 > 127.0.0.1.3309: Flags [P.], seq 122:164, ack 19978, win 512, options [nop,nop,TS val 1977541258 ecr 1977541258], length 42: IPROTO
	1) size 19: request: INSERT, SYNC: 6
	2) size 23: UNKNOWN
  114  16:57:31.370030 IP 127.0.0.1.3309 > 127.0.0.1.40070: Flags [P.], seq 27184:27217, ack 245, win 512, options [nop,nop,TS val 1977541259 ecr 1977541184], length 33: IPROTO
	1) size 33: request: INSERT, SYNC: 0, REPLICA_ID: 1, LSN: 12, TIMESTAMP: 2022-12-15 16:57:31.369981, FLAGS: 6
  115  16:57:31.370150 IP 127.0.0.1.3309 > 127.0.0.1.40070: Flags [P.], seq 27217:27244, ack 245, win 512, options [nop,nop,TS val 1977541259 ecr 1977541184], length 27: IPROTO
	1) size 27: request: RAFT_CONFIRM, SYNC: 0, REPLICA_ID: 1, LSN: 13, TIMESTAMP: 2022-12-15 16:57:31.370125
  116  16:57:31.370210 IP 127.0.0.1.40070 > 127.0.0.1.3309: Flags [.], ack 27244, win 512, options [nop,nop,TS val 1977541259 ecr 1977541259], length 0
  117  16:57:31.370210 IP 127.0.0.1.3309 > 127.0.0.1.40076: Flags [P.], seq 19978:20016, ack 164, win 512, options [nop,nop,TS val 1977541259 ecr 1977541258], length 38: IPROTO
	1) size 38: response: OK, SYNC: 6, SCHEMA_VERSION: 80
  118  16:57:31.370301 IP 127.0.0.1.40076 > 127.0.0.1.3309: Flags [P.], seq 164:183, ack 20016, win 512, options [nop,nop,TS val 1977541259 ecr 1977541259], length 19: IPROTO
	1) size 19: request: INSERT, SYNC: 7
  119  16:57:31.370368 IP 127.0.0.1.40070 > 127.0.0.1.3309: Flags [P.], seq 245:268, ack 27244, win 512, options [nop,nop,TS val 1977541259 ecr 1977541259], length 23: IPROTO
	1) size 23: response: OK, SYNC: 0, SCHEMA_VERSION: 0, TIMESTAMP: 2022-12-15 16:57:31.369981
  120  16:57:31.370446 IP 127.0.0.1.3309 > 127.0.0.1.40070: Flags [.], ack 268, win 512, options [nop,nop,TS val 1977541259 ecr 1977541259], length 0
  121  16:57:31.370452 IP 127.0.0.1.40070 > 127.0.0.1.3309: Flags [P.], seq 268:291, ack 27244, win 512, options [nop,nop,TS val 1977541259 ecr 1977541259], length 23: IPROTO
	1) size 23: response: OK, SYNC: 0, SCHEMA_VERSION: 0, TIMESTAMP: 2022-12-15 16:57:31.370125
  122  16:57:31.370460 IP 127.0.0.1.3309 > 127.0.0.1.40070: Flags [.], ack 291, win 512, options [nop,nop,TS val 1977541259 ecr 1977541259], length 0
  123  16:57:31.370481 IP 127.0.0.1.3309 > 127.0.0.1.40070: Flags [P.], seq 27244:27277, ack 291, win 512, options [nop,nop,TS val 1977541259 ecr 1977541259], length 33: IPROTO
	1) size 33: request: INSERT, SYNC: 0, REPLICA_ID: 1, LSN: 14, TIMESTAMP: 2022-12-15 16:57:31.370455, FLAGS: 6
  124  16:57:31.370486 IP 127.0.0.1.3309 > 127.0.0.1.40070: Flags [P.], seq 27277:27304, ack 291, win 512, options [nop,nop,TS val 1977541259 ecr 1977541259], length 27: IPROTO
	1) size 27: request: RAFT_CONFIRM, SYNC: 0, REPLICA_ID: 1, LSN: 15, TIMESTAMP: 2022-12-15 16:57:31.370469
  125  16:57:31.370566 IP 127.0.0.1.3309 > 127.0.0.1.40076: Flags [P.], seq 20016:20054, ack 183, win 512, options [nop,nop,TS val 1977541259 ecr 1977541259], length 38: IPROTO
	1) size 38: response: OK, SYNC: 7, SCHEMA_VERSION: 80
  126  16:57:31.370566 IP 127.0.0.1.40070 > 127.0.0.1.3309: Flags [.], ack 27304, win 512, options [nop,nop,TS val 1977541259 ecr 1977541259], length 0
  127  16:57:31.370627 IP 127.0.0.1.40076 > 127.0.0.1.3309: Flags [P.], seq 183:202, ack 20054, win 512, options [nop,nop,TS val 1977541259 ecr 1977541259], length 19: IPROTO
	1) size 19: request: INSERT, SYNC: 8
  128  16:57:31.370804 IP 127.0.0.1.40070 > 127.0.0.1.3309: Flags [P.], seq 291:314, ack 27304, win 512, options [nop,nop,TS val 1977541260 ecr 1977541259], length 23: IPROTO
	1) size 23: response: OK, SYNC: 0, SCHEMA_VERSION: 0, TIMESTAMP: 2022-12-15 16:57:31.370455
  129  16:57:31.370845 IP 127.0.0.1.3309 > 127.0.0.1.40070: Flags [P.], seq 27304:27337, ack 314, win 512, options [nop,nop,TS val 1977541260 ecr 1977541260], length 33: IPROTO
	1) size 33: request: INSERT, SYNC: 0, REPLICA_ID: 1, LSN: 16, TIMESTAMP: 2022-12-15 16:57:31.370790, FLAGS: 6
  130  16:57:31.370868 IP 127.0.0.1.3309 > 127.0.0.1.40070: Flags [P.], seq 27337:27364, ack 314, win 512, options [nop,nop,TS val 1977541260 ecr 1977541260], length 27: IPROTO
	1) size 27: request: RAFT_CONFIRM, SYNC: 0, REPLICA_ID: 1, LSN: 17, TIMESTAMP: 2022-12-15 16:57:31.370849
  131  16:57:31.370898 IP 127.0.0.1.40070 > 127.0.0.1.3309: Flags [.], ack 27364, win 512, options [nop,nop,TS val 1977541260 ecr 1977541260], length 0
  132  16:57:31.370907 IP 127.0.0.1.40070 > 127.0.0.1.3309: Flags [P.], seq 314:337, ack 27364, win 512, options [nop,nop,TS val 1977541260 ecr 1977541260], length 23: IPROTO
	1) size 23: response: OK, SYNC: 0, SCHEMA_VERSION: 0, TIMESTAMP: 2022-12-15 16:57:31.370469
  133  16:57:31.371014 IP 127.0.0.1.3309 > 127.0.0.1.40076: Flags [P.], seq 20054:20092, ack 202, win 512, options [nop,nop,TS val 1977541260 ecr 1977541259], length 38: IPROTO
	1) size 38: response: OK, SYNC: 8, SCHEMA_VERSION: 80
  134  16:57:31.371066 IP 127.0.0.1.40076 > 127.0.0.1.3309: Flags [P.], seq 202:238, ack 20092, win 512, options [nop,nop,TS val 1977541260 ecr 1977541260], length 36: IPROTO
	1) size 36: request: INSERT, SYNC: 9
  135  16:57:31.371114 IP 127.0.0.1.40070 > 127.0.0.1.3309: Flags [P.], seq 337:360, ack 27364, win 512, options [nop,nop,TS val 1977541260 ecr 1977541260], length 23: IPROTO
	1) size 23: response: OK, SYNC: 0, SCHEMA_VERSION: 0, TIMESTAMP: 2022-12-15 16:57:31.370790
  136  16:57:31.371124 IP 127.0.0.1.40070 > 127.0.0.1.3309: Flags [P.], seq 360:383, ack 27364, win 512, options [nop,nop,TS val 1977541260 ecr 1977541260], length 23: IPROTO
	1) size 23: response: OK, SYNC: 0, SCHEMA_VERSION: 0, TIMESTAMP: 2022-12-15 16:57:31.370849
  137  16:57:31.371200 IP 127.0.0.1.3309 > 127.0.0.1.40070: Flags [.], ack 383, win 512, options [nop,nop,TS val 1977541260 ecr 1977541260], length 0
  138  16:57:31.371215 IP 127.0.0.1.3309 > 127.0.0.1.40070: Flags [P.], seq 27364:27414, ack 383, win 512, options [nop,nop,TS val 1977541260 ecr 1977541260], length 50: IPROTO
	1) size 50: request: INSERT, SYNC: 0, REPLICA_ID: 1, LSN: 18, TIMESTAMP: 2022-12-15 16:57:31.371191, FLAGS: 6
  139  16:57:31.371222 IP 127.0.0.1.3309 > 127.0.0.1.40070: Flags [P.], seq 27414:27441, ack 383, win 512, options [nop,nop,TS val 1977541260 ecr 1977541260], length 27: IPROTO
	1) size 27: request: RAFT_CONFIRM, SYNC: 0, REPLICA_ID: 1, LSN: 19, TIMESTAMP: 2022-12-15 16:57:31.371215
  140  16:57:31.371229 IP 127.0.0.1.40070 > 127.0.0.1.3309: Flags [.], ack 27441, win 512, options [nop,nop,TS val 1977541260 ecr 1977541260], length 0
  141  16:57:31.371234 IP 127.0.0.1.3309 > 127.0.0.1.40076: Flags [P.], seq 20092:20147, ack 238, win 512, options [nop,nop,TS val 1977541260 ecr 1977541260], length 55: IPROTO
	1) size 55: response: OK, SYNC: 9, SCHEMA_VERSION: 80
  142  16:57:31.371254 IP 127.0.0.1.40076 > 127.0.0.1.3309: Flags [P.], seq 238:272, ack 20147, win 512, options [nop,nop,TS val 1977541260 ecr 1977541260], length 34: IPROTO
	1) size 34: request: INSERT, SYNC: 10
  143  16:57:31.371308 IP 127.0.0.1.40070 > 127.0.0.1.3309: Flags [P.], seq 383:406, ack 27441, win 512, options [nop,nop,TS val 1977541260 ecr 1977541260], length 23: IPROTO
	1) size 23: response: OK, SYNC: 0, SCHEMA_VERSION: 0, TIMESTAMP: 2022-12-15 16:57:31.371191
  144  16:57:31.371317 IP 127.0.0.1.40070 > 127.0.0.1.3309: Flags [P.], seq 406:429, ack 27441, win 512, options [nop,nop,TS val 1977541260 ecr 1977541260], length 23: IPROTO
	1) size 23: response: OK, SYNC: 0, SCHEMA_VERSION: 0, TIMESTAMP: 2022-12-15 16:57:31.371215
  145  16:57:31.371329 IP 127.0.0.1.3309 > 127.0.0.1.40070: Flags [.], ack 429, win 512, options [nop,nop,TS val 1977541260 ecr 1977541260], length 0
  146  16:57:31.371341 IP 127.0.0.1.3309 > 127.0.0.1.40076: Flags [P.], seq 20147:20200, ack 272, win 512, options [nop,nop,TS val 1977541260 ecr 1977541260], length 53: IPROTO
	1) size 53: response: OK, SYNC: 10, SCHEMA_VERSION: 80
  147  16:57:31.371343 IP 127.0.0.1.3309 > 127.0.0.1.40070: Flags [P.], seq 27441:27489, ack 429, win 512, options [nop,nop,TS val 1977541260 ecr 1977541260], length 48: IPROTO
	1) size 48: request: INSERT, SYNC: 0, REPLICA_ID: 1, LSN: 20, TIMESTAMP: 2022-12-15 16:57:31.371308, FLAGS: 6
  148  16:57:31.371348 IP 127.0.0.1.3309 > 127.0.0.1.40070: Flags [P.], seq 27489:27516, ack 429, win 512, options [nop,nop,TS val 1977541260 ecr 1977541260], length 27: IPROTO
	1) size 27: request: RAFT_CONFIRM, SYNC: 0, REPLICA_ID: 1, LSN: 21, TIMESTAMP: 2022-12-15 16:57:31.371325
  149  16:57:31.371352 IP 127.0.0.1.40076 > 127.0.0.1.3309: Flags [P.], seq 272:311, ack 20200, win 512, options [nop,nop,TS val 1977541260 ecr 1977541260], length 39: IPROTO
	1) size 39: request: INSERT, SYNC: 11
  150  16:57:31.371352 IP 127.0.0.1.40070 > 127.0.0.1.3309: Flags [.], ack 27516, win 512, options [nop,nop,TS val 1977541260 ecr 1977541260], length 0
  151  16:57:31.371378 IP 127.0.0.1.3309 > 127.0.0.1.40070: Flags [P.], seq 27516:27569, ack 429, win 512, options [nop,nop,TS val 1977541260 ecr 1977541260], length 53: IPROTO
	1) size 53: request: INSERT, SYNC: 0, REPLICA_ID: 1, LSN: 22, TIMESTAMP: 2022-12-15 16:57:31.371363, FLAGS: 6
  152  16:57:31.371384 IP 127.0.0.1.3309 > 127.0.0.1.40070: Flags [P.], seq 27569:27596, ack 429, win 512, options [nop,nop,TS val 1977541260 ecr 1977541260], length 27: IPROTO
	1) size 27: request: RAFT_CONFIRM, SYNC: 0, REPLICA_ID: 1, LSN: 23, TIMESTAMP: 2022-12-15 16:57:31.371377
  153  16:57:31.371391 IP 127.0.0.1.3309 > 127.0.0.1.40076: Flags [P.], seq 20200:20258, ack 311, win 512, options [nop,nop,TS val 1977541260 ecr 1977541260], length 58: IPROTO
	1) size 58: response: OK, SYNC: 11, SCHEMA_VERSION: 80
  154  16:57:31.371392 IP 127.0.0.1.40070 > 127.0.0.1.3309: Flags [.], ack 27596, win 512, options [nop,nop,TS val 1977541260 ecr 1977541260], length 0
  155  16:57:31.371417 IP 127.0.0.1.40070 > 127.0.0.1.3309: Flags [P.], seq 429:452, ack 27596, win 512, options [nop,nop,TS val 1977541260 ecr 1977541260], length 23: IPROTO
	1) size 23: response: OK, SYNC: 0, SCHEMA_VERSION: 0, TIMESTAMP: 2022-12-15 16:57:31.371308
  156  16:57:31.371430 IP 127.0.0.1.40070 > 127.0.0.1.3309: Flags [P.], seq 452:475, ack 27596, win 512, options [nop,nop,TS val 1977541260 ecr 1977541260], length 23: IPROTO
	1) size 23: response: OK, SYNC: 0, SCHEMA_VERSION: 0, TIMESTAMP: 2022-12-15 16:57:31.371325
  157  16:57:31.371435 IP 127.0.0.1.3309 > 127.0.0.1.40070: Flags [.], ack 475, win 512, options [nop,nop,TS val 1977541260 ecr 1977541260], length 0
  158  16:57:31.371435 IP 127.0.0.1.40070 > 127.0.0.1.3309: Flags [P.], seq 475:498, ack 27596, win 512, options [nop,nop,TS val 1977541260 ecr 1977541260], length 23: IPROTO
	1) size 23: response: OK, SYNC: 0, SCHEMA_VERSION: 0, TIMESTAMP: 2022-12-15 16:57:31.371363
  159  16:57:31.371443 IP 127.0.0.1.40076 > 127.0.0.1.3309: Flags [P.], seq 311:347, ack 20258, win 512, options [nop,nop,TS val 1977541260 ecr 1977541260], length 36: IPROTO
	1) size 36: request: INSERT, SYNC: 12
  160  16:57:31.371451 IP 127.0.0.1.40070 > 127.0.0.1.3309: Flags [P.], seq 498:521, ack 27596, win 512, options [nop,nop,TS val 1977541260 ecr 1977541260], length 23: IPROTO
	1) size 23: response: OK, SYNC: 0, SCHEMA_VERSION: 0, TIMESTAMP: 2022-12-15 16:57:31.371377
  161  16:57:31.371457 IP 127.0.0.1.3309 > 127.0.0.1.40070: Flags [.], ack 521, win 512, options [nop,nop,TS val 1977541260 ecr 1977541260], length 0
  162  16:57:31.371476 IP 127.0.0.1.3309 > 127.0.0.1.40070: Flags [P.], seq 27596:27646, ack 521, win 512, options [nop,nop,TS val 1977541260 ecr 1977541260], length 50: IPROTO
	1) size 50: request: INSERT, SYNC: 0, REPLICA_ID: 1, LSN: 24, TIMESTAMP: 2022-12-15 16:57:31.371459, FLAGS: 6
  163  16:57:31.371479 IP 127.0.0.1.3309 > 127.0.0.1.40076: Flags [P.], seq 20258:20313, ack 347, win 512, options [nop,nop,TS val 1977541260 ecr 1977541260], length 55: IPROTO
	1) size 55: response: OK, SYNC: 12, SCHEMA_VERSION: 80
  164  16:57:31.371480 IP 127.0.0.1.3309 > 127.0.0.1.40070: Flags [P.], seq 27646:27673, ack 521, win 512, options [nop,nop,TS val 1977541260 ecr 1977541260], length 27: IPROTO
	1) size 27: request: RAFT_CONFIRM, SYNC: 0, REPLICA_ID: 1, LSN: 25, TIMESTAMP: 2022-12-15 16:57:31.371464
  165  16:57:31.371484 IP 127.0.0.1.40070 > 127.0.0.1.3309: Flags [.], ack 27673, win 512, options [nop,nop,TS val 1977541260 ecr 1977541260], length 0
  166  16:57:31.371492 IP 127.0.0.1.40076 > 127.0.0.1.3309: Flags [P.], seq 347:373, ack 20313, win 512, options [nop,nop,TS val 1977541260 ecr 1977541260], length 26: IPROTO
	1) size 26: request: SELECT, SYNC: 13
  167  16:57:31.371509 IP 127.0.0.1.3309 > 127.0.0.1.40076: Flags [P.], seq 20313:20351, ack 373, win 512, options [nop,nop,TS val 1977541260 ecr 1977541260], length 38: IPROTO
	1) size 38: response: OK, SYNC: 13, SCHEMA_VERSION: 80
  168  16:57:31.371522 IP 127.0.0.1.40076 > 127.0.0.1.3309: Flags [P.], seq 373:402, ack 20351, win 512, options [nop,nop,TS val 1977541260 ecr 1977541260], length 29: IPROTO
	1) size 29: request: SELECT, SYNC: 14
  169  16:57:31.371534 IP 127.0.0.1.3309 > 127.0.0.1.40076: Flags [P.], seq 20351:20476, ack 402, win 512, options [nop,nop,TS val 1977541260 ecr 1977541260], length 125: IPROTO
	1) size 125: response: OK, SYNC: 14, SCHEMA_VERSION: 80
  170  16:57:31.371546 IP 127.0.0.1.40076 > 127.0.0.1.3309: Flags [P.], seq 402:423, ack 20476, win 512, options [nop,nop,TS val 1977541260 ecr 1977541260], length 21: IPROTO
	1) size 21: request: REPLACE, SYNC: 15
  171  16:57:31.371567 IP 127.0.0.1.40070 > 127.0.0.1.3309: Flags [P.], seq 521:544, ack 27673, win 512, options [nop,nop,TS val 1977541260 ecr 1977541260], length 23: IPROTO
	1) size 23: response: OK, SYNC: 0, SCHEMA_VERSION: 0, TIMESTAMP: 2022-12-15 16:57:31.371459
  172  16:57:31.371579 IP 127.0.0.1.40070 > 127.0.0.1.3309: Flags [P.], seq 544:567, ack 27673, win 512, options [nop,nop,TS val 1977541260 ecr 1977541260], length 23: IPROTO
	1) size 23: response: OK, SYNC: 0, SCHEMA_VERSION: 0, TIMESTAMP: 2022-12-15 16:57:31.371464
  173  16:57:31.371612 IP 127.0.0.1.3309 > 127.0.0.1.40070: Flags [.], ack 567, win 512, options [nop,nop,TS val 1977541260 ecr 1977541260], length 0
  174  16:57:31.371626 IP 127.0.0.1.3309 > 127.0.0.1.40070: Flags [P.], seq 27673:27708, ack 567, win 512, options [nop,nop,TS val 1977541260 ecr 1977541260], length 35: IPROTO
	1) size 35: request: REPLACE, SYNC: 0, REPLICA_ID: 1, LSN: 26, TIMESTAMP: 2022-12-15 16:57:31.371598, FLAGS: 6
  175  16:57:31.371633 IP 127.0.0.1.3309 > 127.0.0.1.40070: Flags [P.], seq 27708:27735, ack 567, win 512, options [nop,nop,TS val 1977541260 ecr 1977541260], length 27: IPROTO
	1) size 27: request: RAFT_CONFIRM, SYNC: 0, REPLICA_ID: 1, LSN: 27, TIMESTAMP: 2022-12-15 16:57:31.371622
  176  16:57:31.371635 IP 127.0.0.1.3309 > 127.0.0.1.40076: Flags [P.], seq 20476:20516, ack 423, win 512, options [nop,nop,TS val 1977541260 ecr 1977541260], length 40: IPROTO
	1) size 40: response: OK, SYNC: 15, SCHEMA_VERSION: 80
  177  16:57:31.371639 IP 127.0.0.1.40070 > 127.0.0.1.3309: Flags [.], ack 27735, win 512, options [nop,nop,TS val 1977541260 ecr 1977541260], length 0
  178  16:57:31.371650 IP 127.0.0.1.40076 > 127.0.0.1.3309: Flags [P.], seq 423:452, ack 20516, win 512, options [nop,nop,TS val 1977541260 ecr 1977541260], length 29: IPROTO
	1) size 29: request: UPDATE, SYNC: 16
  179  16:57:31.371705 IP 127.0.0.1.40070 > 127.0.0.1.3309: Flags [P.], seq 567:590, ack 27735, win 512, options [nop,nop,TS val 1977541260 ecr 1977541260], length 23: IPROTO
	1) size 23: response: OK, SYNC: 0, SCHEMA_VERSION: 0, TIMESTAMP: 2022-12-15 16:57:31.371598
  180  16:57:31.371722 IP 127.0.0.1.40070 > 127.0.0.1.3309: Flags [P.], seq 590:613, ack 27735, win 512, options [nop,nop,TS val 1977541260 ecr 1977541260], length 23: IPROTO
	1) size 23: response: OK, SYNC: 0, SCHEMA_VERSION: 0, TIMESTAMP: 2022-12-15 16:57:31.371622
  181  16:57:31.371734 IP 127.0.0.1.3309 > 127.0.0.1.40070: Flags [.], ack 613, win 512, options [nop,nop,TS val 1977541260 ecr 1977541260], length 0
  182  16:57:31.371751 IP 127.0.0.1.3309 > 127.0.0.1.40070: Flags [P.], seq 27735:27776, ack 613, win 512, options [nop,nop,TS val 1977541260 ecr 1977541260], length 41: IPROTO
	1) size 41: request: UPDATE, SYNC: 0, REPLICA_ID: 1, LSN: 28, TIMESTAMP: 2022-12-15 16:57:31.371725, FLAGS: 6
  183  16:57:31.371759 IP 127.0.0.1.3309 > 127.0.0.1.40070: Flags [P.], seq 27776:27803, ack 613, win 512, options [nop,nop,TS val 1977541260 ecr 1977541260], length 27: IPROTO
	1) size 27: request: RAFT_CONFIRM, SYNC: 0, REPLICA_ID: 1, LSN: 29, TIMESTAMP: 2022-12-15 16:57:31.371747
  184  16:57:31.371760 IP 127.0.0.1.3309 > 127.0.0.1.40076: Flags [P.], seq 20516:20554, ack 452, win 512, options [nop,nop,TS val 1977541260 ecr 1977541260], length 38: IPROTO
	1) size 38: response: OK, SYNC: 16, SCHEMA_VERSION: 80
  185  16:57:31.371765 IP 127.0.0.1.40070 > 127.0.0.1.3309: Flags [.], ack 27803, win 512, options [nop,nop,TS val 1977541260 ecr 1977541260], length 0
  186  16:57:31.371774 IP 127.0.0.1.40076 > 127.0.0.1.3309: Flags [P.], seq 452:488, ack 20554, win 512, options [nop,nop,TS val 1977541260 ecr 1977541260], length 36: IPROTO
	1) size 36: request: UPSERT, SYNC: 17
  187  16:57:31.371819 IP 127.0.0.1.3309 > 127.0.0.1.40070: Flags [P.], seq 27803:27853, ack 613, win 512, options [nop,nop,TS val 1977541261 ecr 1977541260], length 50: IPROTO
	1) size 50: request: UPSERT, SYNC: 0, REPLICA_ID: 1, LSN: 30, TIMESTAMP: 2022-12-15 16:57:31.371804, FLAGS: 6
  188  16:57:31.371825 IP 127.0.0.1.3309 > 127.0.0.1.40070: Flags [P.], seq 27853:27880, ack 613, win 512, options [nop,nop,TS val 1977541261 ecr 1977541260], length 27: IPROTO
	1) size 27: request: RAFT_CONFIRM, SYNC: 0, REPLICA_ID: 1, LSN: 31, TIMESTAMP: 2022-12-15 16:57:31.371814
  189  16:57:31.371826 IP 127.0.0.1.3309 > 127.0.0.1.40076: Flags [P.], seq 20554:20589, ack 488, win 512, options [nop,nop,TS val 1977541261 ecr 1977541260], length 35: IPROTO
	1) size 35: response: OK, SYNC: 17, SCHEMA_VERSION: 80
  190  16:57:31.371828 IP 127.0.0.1.40070 > 127.0.0.1.3309: Flags [P.], seq 613:636, ack 27880, win 512, options [nop,nop,TS val 1977541261 ecr 1977541261], length 23: IPROTO
	1) size 23: response: OK, SYNC: 0, SCHEMA_VERSION: 0, TIMESTAMP: 2022-12-15 16:57:31.371725
  191  16:57:31.371836 IP 127.0.0.1.40076 > 127.0.0.1.3309: Flags [P.], seq 488:508, ack 20589, win 512, options [nop,nop,TS val 1977541261 ecr 1977541261], length 20: IPROTO
	1) size 20: request: DELETE, SYNC: 18
  192  16:57:31.371841 IP 127.0.0.1.40070 > 127.0.0.1.3309: Flags [P.], seq 636:659, ack 27880, win 512, options [nop,nop,TS val 1977541261 ecr 1977541261], length 23: IPROTO
	1) size 23: response: OK, SYNC: 0, SCHEMA_VERSION: 0, TIMESTAMP: 2022-12-15 16:57:31.371747
  193  16:57:31.371846 IP 127.0.0.1.3309 > 127.0.0.1.40070: Flags [.], ack 659, win 512, options [nop,nop,TS val 1977541261 ecr 1977541261], length 0
  194  16:57:31.371861 IP 127.0.0.1.3309 > 127.0.0.1.40070: Flags [P.], seq 27880:27912, ack 659, win 512, options [nop,nop,TS val 1977541261 ecr 1977541261], length 32: IPROTO
	1) size 32: request: DELETE, SYNC: 0, REPLICA_ID: 1, LSN: 32, TIMESTAMP: 2022-12-15 16:57:31.371849, FLAGS: 6
  195  16:57:31.371868 IP 127.0.0.1.3309 > 127.0.0.1.40070: Flags [P.], seq 27912:27939, ack 659, win 512, options [nop,nop,TS val 1977541261 ecr 1977541261], length 27: IPROTO
	1) size 27: request: RAFT_CONFIRM, SYNC: 0, REPLICA_ID: 1, LSN: 33, TIMESTAMP: 2022-12-15 16:57:31.371856
  196  16:57:31.371870 IP 127.0.0.1.3309 > 127.0.0.1.40076: Flags [P.], seq 20589:20627, ack 508, win 512, options [nop,nop,TS val 1977541261 ecr 1977541261], length 38: IPROTO
	1) size 38: response: OK, SYNC: 18, SCHEMA_VERSION: 80
  197  16:57:31.371873 IP 127.0.0.1.40070 > 127.0.0.1.3309: Flags [.], ack 27939, win 512, options [nop,nop,TS val 1977541261 ecr 1977541261], length 0
  198  16:57:31.371880 IP 127.0.0.1.40076 > 127.0.0.1.3309: Flags [P.], seq 508:528, ack 20627, win 512, options [nop,nop,TS val 1977541261 ecr 1977541261], length 20: IPROTO
	1) size 20: request: DELETE, SYNC: 19
  199  16:57:31.371930 IP 127.0.0.1.40070 > 127.0.0.1.3309: Flags [P.], seq 659:682, ack 27939, win 512, options [nop,nop,TS val 1977541261 ecr 1977541261], length 23: IPROTO
	1) size 23: response: OK, SYNC: 0, SCHEMA_VERSION: 0, TIMESTAMP: 2022-12-15 16:57:31.371804
  200  16:57:31.371948 IP 127.0.0.1.40070 > 127.0.0.1.3309: Flags [P.], seq 682:705, ack 27939, win 512, options [nop,nop,TS val 1977541261 ecr 1977541261], length 23: IPROTO
	1) size 23: response: OK, SYNC: 0, SCHEMA_VERSION: 0, TIMESTAMP: 2022-12-15 16:57:31.371814
  201  16:57:31.371958 IP 127.0.0.1.40070 > 127.0.0.1.3309: Flags [P.], seq 705:728, ack 27939, win 512, options [nop,nop,TS val 1977541261 ecr 1977541261], length 23: IPROTO
	1) size 23: response: OK, SYNC: 0, SCHEMA_VERSION: 0, TIMESTAMP: 2022-12-15 16:57:31.371849
  202  16:57:31.371960 IP 127.0.0.1.3309 > 127.0.0.1.40070: Flags [.], ack 705, win 512, options [nop,nop,TS val 1977541261 ecr 1977541261], length 0
  203  16:57:31.371971 IP 127.0.0.1.40070 > 127.0.0.1.3309: Flags [P.], seq 728:751, ack 27939, win 512, options [nop,nop,TS val 1977541261 ecr 1977541261], length 23: IPROTO
	1) size 23: response: OK, SYNC: 0, SCHEMA_VERSION: 0, TIMESTAMP: 2022-12-15 16:57:31.371856
  204  16:57:31.371977 IP 127.0.0.1.3309 > 127.0.0.1.40070: Flags [P.], seq 27939:27971, ack 751, win 512, options [nop,nop,TS val 1977541261 ecr 1977541261], length 32: IPROTO
	1) size 32: request: DELETE, SYNC: 0, REPLICA_ID: 1, LSN: 34, TIMESTAMP: 2022-12-15 16:57:31.371951, FLAGS: 6
  205  16:57:31.371984 IP 127.0.0.1.3309 > 127.0.0.1.40076: Flags [P.], seq 20627:20665, ack 528, win 512, options [nop,nop,TS val 1977541261 ecr 1977541261], length 38: IPROTO
	1) size 38: response: OK, SYNC: 19, SCHEMA_VERSION: 80
  206  16:57:31.371984 IP 127.0.0.1.3309 > 127.0.0.1.40070: Flags [P.], seq 27971:27998, ack 751, win 512, options [nop,nop,TS val 1977541261 ecr 1977541261], length 27: IPROTO
	1) size 27: request: RAFT_CONFIRM, SYNC: 0, REPLICA_ID: 1, LSN: 35, TIMESTAMP: 2022-12-15 16:57:31.371971
  207  16:57:31.371988 IP 127.0.0.1.40070 > 127.0.0.1.3309: Flags [.], ack 27998, win 512, options [nop,nop,TS val 1977541261 ecr 1977541261], length 0
  208  16:57:31.371995 IP 127.0.0.1.40076 > 127.0.0.1.3309: Flags [P.], seq 528:548, ack 20665, win 512, options [nop,nop,TS val 1977541261 ecr 1977541261], length 20: IPROTO
	1) size 20: request: DELETE, SYNC: 20
  209  16:57:31.372021 IP 127.0.0.1.3309 > 127.0.0.1.40070: Flags [P.], seq 27998:28030, ack 751, win 512, options [nop,nop,TS val 1977541261 ecr 1977541261], length 32: IPROTO
	1) size 32: request: DELETE, SYNC: 0, REPLICA_ID: 1, LSN: 36, TIMESTAMP: 2022-12-15 16:57:31.372007, FLAGS: 6
  210  16:57:31.372031 IP 127.0.0.1.3309 > 127.0.0.1.40070: Flags [P.], seq 28030:28057, ack 751, win 512, options [nop,nop,TS val 1977541261 ecr 1977541261], length 27: IPROTO
	1) size 27: request: RAFT_CONFIRM, SYNC: 0, REPLICA_ID: 1, LSN: 37, TIMESTAMP: 2022-12-15 16:57:31.372020
  211  16:57:31.372036 IP 127.0.0.1.40070 > 127.0.0.1.3309: Flags [.], ack 28057, win 512, options [nop,nop,TS val 1977541261 ecr 1977541261], length 0
  212  16:57:31.372036 IP 127.0.0.1.3309 > 127.0.0.1.40076: Flags [P.], seq 20665:20703, ack 548, win 512, options [nop,nop,TS val 1977541261 ecr 1977541261], length 38: IPROTO
	1) size 38: response: OK, SYNC: 20, SCHEMA_VERSION: 80
  213  16:57:31.372046 IP 127.0.0.1.40076 > 127.0.0.1.3309: Flags [P.], seq 548:608, ack 20703, win 512, options [nop,nop,TS val 1977541261 ecr 1977541261], length 60: IPROTO
	1) size 60: request: EVAL, SYNC: 21
  214  16:57:31.372059 IP 127.0.0.1.40070 > 127.0.0.1.3309: Flags [P.], seq 751:774, ack 28057, win 512, options [nop,nop,TS val 1977541261 ecr 1977541261], length 23: IPROTO
	1) size 23: response: OK, SYNC: 0, SCHEMA_VERSION: 0, TIMESTAMP: 2022-12-15 16:57:31.371951
  215  16:57:31.372070 IP 127.0.0.1.3309 > 127.0.0.1.40076: Flags [P.], seq 20703:20739, ack 608, win 512, options [nop,nop,TS val 1977541261 ecr 1977541261], length 36: IPROTO
	1) size 36: response: OK, SYNC: 21, SCHEMA_VERSION: 80
  216  16:57:31.372079 IP 127.0.0.1.40070 > 127.0.0.1.3309: Flags [P.], seq 774:797, ack 28057, win 512, options [nop,nop,TS val 1977541261 ecr 1977541261], length 23: IPROTO
	1) size 23: response: OK, SYNC: 0, SCHEMA_VERSION: 0, TIMESTAMP: 2022-12-15 16:57:31.371971
  217  16:57:31.372084 IP 127.0.0.1.40070 > 127.0.0.1.3309: Flags [P.], seq 797:820, ack 28057, win 512, options [nop,nop,TS val 1977541261 ecr 1977541261], length 23: IPROTO
	1) size 23: response: OK, SYNC: 0, SCHEMA_VERSION: 0, TIMESTAMP: 2022-12-15 16:57:31.372007
  218  16:57:31.372085 IP 127.0.0.1.40076 > 127.0.0.1.3309: Flags [P.], seq 608:639, ack 20739, win 512, options [nop,nop,TS val 1977541261 ecr 1977541261], length 31: IPROTO
	1) size 31: request: EVAL, SYNC: 22
  219  16:57:31.372113 IP 127.0.0.1.3309 > 127.0.0.1.40076: Flags [P.], seq 20739:20780, ack 639, win 512, options [nop,nop,TS val 1977541261 ecr 1977541261], length 41: IPROTO
	1) size 41: response: OK, SYNC: 22, SCHEMA_VERSION: 80
  220  16:57:31.372121 IP 127.0.0.1.40076 > 127.0.0.1.3309: Flags [P.], seq 639:685, ack 20780, win 512, options [nop,nop,TS val 1977541261 ecr 1977541261], length 46: IPROTO
	1) size 46: request: EVAL, SYNC: 23
  221  16:57:31.372127 IP 127.0.0.1.3309 > 127.0.0.1.40070: Flags [.], ack 820, win 512, options [nop,nop,TS val 1977541261 ecr 1977541261], length 0
  222  16:57:31.372139 IP 127.0.0.1.3309 > 127.0.0.1.40076: Flags [P.], seq 20780:20815, ack 685, win 512, options [nop,nop,TS val 1977541261 ecr 1977541261], length 35: IPROTO
	1) size 35: response: OK, SYNC: 23, SCHEMA_VERSION: 80
  223  16:57:31.372155 IP 127.0.0.1.40076 > 127.0.0.1.3309: Flags [P.], seq 685:702, ack 20815, win 512, options [nop,nop,TS val 1977541261 ecr 1977541261], length 17: IPROTO
	1) size 17: request: CALL, SYNC: 24
  224  16:57:31.372170 IP 127.0.0.1.3309 > 127.0.0.1.40076: Flags [P.], seq 20815:20851, ack 702, win 512, options [nop,nop,TS val 1977541261 ecr 1977541261], length 36: IPROTO
	1) size 36: response: OK, SYNC: 24, SCHEMA_VERSION: 80
  225  16:57:31.372180 IP 127.0.0.1.40076 > 127.0.0.1.3309: Flags [P.], seq 702:752, ack 20851, win 512, options [nop,nop,TS val 1977541261 ecr 1977541261], length 50: IPROTO
	1) size 50: request: EVAL, SYNC: 25
  226  16:57:31.372181 IP 127.0.0.1.40070 > 127.0.0.1.3309: Flags [P.], seq 820:843, ack 28057, win 512, options [nop,nop,TS val 1977541261 ecr 1977541261], length 23: IPROTO
	1) size 23: response: OK, SYNC: 0, SCHEMA_VERSION: 0, TIMESTAMP: 2022-12-15 16:57:31.372020
  227  16:57:31.372197 IP 127.0.0.1.3309 > 127.0.0.1.40076: Flags [P.], seq 20851:20886, ack 752, win 512, options [nop,nop,TS val 1977541261 ecr 1977541261], length 35: IPROTO
	1) size 35: response: OK, SYNC: 25, SCHEMA_VERSION: 80
  228  16:57:31.372204 IP 127.0.0.1.40076 > 127.0.0.1.3309: Flags [P.], seq 752:772, ack 20886, win 512, options [nop,nop,TS val 1977541261 ecr 1977541261], length 20: IPROTO
	1) size 20: request: CALL, SYNC: 26
  229  16:57:31.372216 IP 127.0.0.1.3309 > 127.0.0.1.40076: Flags [P.], seq 20886:20924, ack 772, win 512, options [nop,nop,TS val 1977541261 ecr 1977541261], length 38: IPROTO
	1) size 38: response: OK, SYNC: 26, SCHEMA_VERSION: 80
  230  16:57:31.372224 IP 127.0.0.1.40076 > 127.0.0.1.3309: Flags [P.], seq 772:799, ack 20924, win 512, options [nop,nop,TS val 1977541261 ecr 1977541261], length 27: IPROTO
	1) size 27: request: PREPARE, SYNC: 27
  231  16:57:31.372270 IP 127.0.0.1.3309 > 127.0.0.1.40076: Flags [P.], seq 20924:21023, ack 799, win 512, options [nop,nop,TS val 1977541261 ecr 1977541261], length 99: IPROTO
	1) size 99: response: OK, SYNC: 27, SCHEMA_VERSION: 80
  232  16:57:31.372281 IP 127.0.0.1.40076 > 127.0.0.1.3309: Flags [P.], seq 799:823, ack 21023, win 512, options [nop,nop,TS val 1977541261 ecr 1977541261], length 24: IPROTO
	1) size 24: request: EXECUTE, SYNC: 28
  233  16:57:31.372297 IP 127.0.0.1.3309 > 127.0.0.1.40076: Flags [P.], seq 21023:21097, ack 823, win 512, options [nop,nop,TS val 1977541261 ecr 1977541261], length 74: IPROTO
	1) size 74: response: OK, SYNC: 28, SCHEMA_VERSION: 80
  234  16:57:31.372309 IP 127.0.0.1.40076 > 127.0.0.1.3309: Flags [P.], seq 823:835, ack 21097, win 512, options [nop,nop,TS val 1977541261 ecr 1977541261], length 12: IPROTO
	1) size 12: request: BEGIN, STREAM_ID: 1, SYNC: 29
  235  16:57:31.372324 IP 127.0.0.1.3309 > 127.0.0.1.40076: Flags [P.], seq 21097:21126, ack 835, win 512, options [nop,nop,TS val 1977541261 ecr 1977541261], length 29: IPROTO
	1) size 29: response: OK, SYNC: 29, SCHEMA_VERSION: 80
  236  16:57:31.372331 IP 127.0.0.1.40076 > 127.0.0.1.3309: Flags [P.], seq 835:847, ack 21126, win 512, options [nop,nop,TS val 1977541261 ecr 1977541261], length 12: IPROTO
	1) size 12: request: ROLLBACK, STREAM_ID: 1, SYNC: 30
  237  16:57:31.372343 IP 127.0.0.1.3309 > 127.0.0.1.40076: Flags [P.], seq 21126:21155, ack 847, win 512, options [nop,nop,TS val 1977541261 ecr 1977541261], length 29: IPROTO
	1) size 29: response: OK, SYNC: 30, SCHEMA_VERSION: 80
  238  16:57:31.372350 IP 127.0.0.1.40076 > 127.0.0.1.3309: Flags [P.], seq 847:859, ack 21155, win 512, options [nop,nop,TS val 1977541261 ecr 1977541261], length 12: IPROTO
	1) size 12: request: COMMIT, STREAM_ID: 1, SYNC: 31
  239  16:57:31.372362 IP 127.0.0.1.3309 > 127.0.0.1.40076: Flags [P.], seq 21155:21184, ack 859, win 512, options [nop,nop,TS val 1977541261 ecr 1977541261], length 29: IPROTO
	1) size 29: response: OK, SYNC: 31, SCHEMA_VERSION: 80
  240  16:57:31.372419 IP 127.0.0.1.40076 > 127.0.0.1.3309: Flags [F.], seq 859, ack 21184, win 512, options [nop,nop,TS val 1977541261 ecr 1977541261], length 0
  241  16:57:31.372427 IP 127.0.0.1.3309 > 127.0.0.1.40076: Flags [F.], seq 21184, ack 860, win 512, options [nop,nop,TS val 1977541261 ecr 1977541261], length 0
  242  16:57:31.372435 IP 127.0.0.1.40076 > 127.0.0.1.3309: Flags [.], ack 21185, win 512, options [nop,nop,TS val 1977541261 ecr 1977541261], length 0
  243  16:57:31.373225 IP 127.0.0.1.40070 > 127.0.0.1.3309: Flags [F.], seq 843, ack 28057, win 512, options [nop,nop,TS val 1977541262 ecr 1977541261], length 0
  244  16:57:31.373454 IP 127.0.0.1.3309 > 127.0.0.1.40070: Flags [F.], seq 28057, ack 844, win 512, options [nop,nop,TS val 1977541262 ecr 1977541261], length 0
  245  16:57:31.373458 IP 127.0.0.1.40070 > 127.0.0.1.3309: Flags [.], ack 28058, win 512, options [nop,nop,TS val 1977541262 ecr 1977541262], length 0
  246  16:57:32.818697 IP 127.0.0.1.40078 > 127.0.0.1.3309: Flags [S], seq 725422438, win 65495, options [mss 65495,sackOK,TS val 1977542707 ecr 0,nop,wscale 7], length 0
  247  16:57:32.818705 IP 127.0.0.1.3309 > 127.0.0.1.40078: Flags [S.], seq 2701899671, ack 725422439, win 65483, options [mss 65495,sackOK,TS val 1977542707 ecr 1977542707,nop,wscale 7], length 0
  248  16:57:32.818713 IP 127.0.0.1.40078 > 127.0.0.1.3309: Flags [.], ack 1, win 512, options [nop,nop,TS val 1977542707 ecr 1977542707], length 0
  249  16:57:32.818891 IP 127.0.0.1.3309 > 127.0.0.1.40078: Flags [P.], seq 1:129, ack 1, win 512, options [nop,nop,TS val 1977542708 ecr 1977542707], length 128: IPROTO: Tarantool 2.10.4 (Binary) 056cb614-461f-4cc2-a26b-8a50f5286086 
  250  16:57:32.818896 IP 127.0.0.1.40078 > 127.0.0.1.3309: Flags [.], ack 129, win 511, options [nop,nop,TS val 1977542708 ecr 1977542708], length 0
  251  16:57:32.818950 IP 127.0.0.1.40078 > 127.0.0.1.3309: Flags [P.], seq 1:20, ack 129, win 512, options [nop,nop,TS val 1977542708 ecr 1977542708], length 19: IPROTO
	1) size 19: request: ID, SYNC: 1
  252  16:57:32.818955 IP 127.0.0.1.3309 > 127.0.0.1.40078: Flags [.], ack 20, win 512, options [nop,nop,TS val 1977542708 ecr 1977542708], length 0
  253  16:57:32.819084 IP 127.0.0.1.3309 > 127.0.0.1.40078: Flags [P.], seq 129:166, ack 20, win 512, options [nop,nop,TS val 1977542708 ecr 1977542708], length 37: IPROTO
	1) size 37: response: OK, SYNC: 1, SCHEMA_VERSION: 78
  254  16:57:32.819150 IP 127.0.0.1.40078 > 127.0.0.1.3309: Flags [P.], seq 20:89, ack 166, win 512, options [nop,nop,TS val 1977542708 ecr 1977542708], length 69: IPROTO
	1) size 23: request: SELECT, SYNC: 2
	2) size 23: request: SELECT, SYNC: 3
	3) size 23: request: SELECT, SYNC: 4
  255  16:57:32.819319 IP 127.0.0.1.3309 > 127.0.0.1.40078: Flags [P.], seq 166:19859, ack 89, win 512, options [nop,nop,TS val 1977542708 ecr 1977542708], length 19693: IPROTO
	1) size 4613: response: OK, SYNC: 2, SCHEMA_VERSION: 78
	2) size 2131: response: OK, SYNC: 3, SCHEMA_VERSION: 78
	3) size 12949: response: OK, SYNC: 4, SCHEMA_VERSION: 78
  256  16:57:32.819674 IP 127.0.0.1.40078 > 127.0.0.1.3309: Flags [P.], seq 89:112, ack 19859, win 512, options [nop,nop,TS val 1977542708 ecr 1977542708], length 23: IPROTO
	1) size 23: UNKNOWN
  257  16:57:32.819692 IP 127.0.0.1.40078 > 127.0.0.1.3309: Flags [P.], seq 112:182, ack 19859, win 512, options [nop,nop,TS val 1977542708 ecr 1977542708], length 70: IPROTO
	1) size 70: request: EVAL, SYNC: 5
  258  16:57:32.819734 IP 127.0.0.1.3309 > 127.0.0.1.40078: Flags [.], ack 182, win 512, options [nop,nop,TS val 1977542708 ecr 1977542708], length 0
  259  16:57:32.819884 IP 127.0.0.1.3309 > 127.0.0.1.40078: Flags [P.], seq 19859:19942, ack 182, win 512, options [nop,nop,TS val 1977542709 ecr 1977542708], length 83: IPROTO
	1) size 60: response: OK, SYNC: 5, SCHEMA_VERSION: 78
	2) size 23: UNKNOWN
  260  16:57:32.819963 IP 127.0.0.1.40078 > 127.0.0.1.3309: Flags [P.], seq 182:252, ack 19942, win 512, options [nop,nop,TS val 1977542709 ecr 1977542709], length 70: IPROTO
	1) size 47: request: CALL, SYNC: 6
	2) size 23: UNKNOWN
  261  16:57:32.820143 IP 127.0.0.1.3309 > 127.0.0.1.40078: Flags [P.], seq 19942:20022, ack 252, win 512, options [nop,nop,TS val 1977542709 ecr 1977542709], length 80: IPROTO
	1) size 80: response: OK, SYNC: 6, SCHEMA_VERSION: 78
  262  16:57:32.820243 IP 127.0.0.1.40078 > 127.0.0.1.3309: Flags [P.], seq 252:301, ack 20022, win 512, options [nop,nop,TS val 1977542709 ecr 1977542709], length 49: IPROTO
	1) size 49: request: CALL, SYNC: 7
  263  16:57:32.820381 IP 127.0.0.1.3309 > 127.0.0.1.40078: Flags [P.], seq 20022:20118, ack 301, win 512, options [nop,nop,TS val 1977542709 ecr 1977542709], length 96: IPROTO
	1) size 96: response: ERR: unknown, SYNC: 7, SCHEMA_VERSION: 78
  264  16:57:32.820466 IP 127.0.0.1.40078 > 127.0.0.1.3309: Flags [P.], seq 301:362, ack 20118, win 512, options [nop,nop,TS val 1977542709 ecr 1977542709], length 61: IPROTO
	1) size 61: request: CALL, SYNC: 8
  265  16:57:32.820575 IP 127.0.0.1.3309 > 127.0.0.1.40078: Flags [P.], seq 20118:20221, ack 362, win 512, options [nop,nop,TS val 1977542709 ecr 1977542709], length 103: IPROTO
	1) size 103: response: OK, SYNC: 8, SCHEMA_VERSION: 78
  266  16:57:32.820661 IP 127.0.0.1.40078 > 127.0.0.1.3309: Flags [P.], seq 362:425, ack 20221, win 512, options [nop,nop,TS val 1977542709 ecr 1977542709], length 63: IPROTO
	1) size 63: request: CALL, SYNC: 9
  267  16:57:32.820841 IP 127.0.0.1.3309 > 127.0.0.1.40078: Flags [P.], seq 20221:20341, ack 425, win 512, options [nop,nop,TS val 1977542710 ecr 1977542709], length 120: IPROTO
	1) size 120: response: ERR: unknown, SYNC: 9, SCHEMA_VERSION: 78
  268  16:57:32.820928 IP 127.0.0.1.40078 > 127.0.0.1.3309: Flags [P.], seq 425:459, ack 20341, win 512, options [nop,nop,TS val 1977542710 ecr 1977542710], length 34: IPROTO
	1) size 34: request: CALL, SYNC: 10
  269  16:57:32.821055 IP 127.0.0.1.3309 > 127.0.0.1.40078: Flags [P.], seq 20341:20579, ack 459, win 512, options [nop,nop,TS val 1977542710 ecr 1977542710], length 238: IPROTO
	1) size 238: response: OK, SYNC: 10, SCHEMA_VERSION: 78
  270  16:57:32.821152 IP 127.0.0.1.40078 > 127.0.0.1.3309: Flags [P.], seq 459:499, ack 20579, win 512, options [nop,nop,TS val 1977542710 ecr 1977542710], length 40: IPROTO
	1) size 40: request: CALL, SYNC: 11
  271  16:57:32.821176 IP 127.0.0.1.3309 > 127.0.0.1.40078: Flags [P.], seq 20579:20886, ack 499, win 512, options [nop,nop,TS val 1977542710 ecr 1977542710], length 307: IPROTO
	1) size 307: response: ERR: ER_ACCESS_DENIED, SYNC: 11, SCHEMA_VERSION: 78
  272  16:57:32.821203 IP 127.0.0.1.40078 > 127.0.0.1.3309: Flags [P.], seq 499:593, ack 20886, win 512, options [nop,nop,TS val 1977542710 ecr 1977542710], length 94: IPROTO
	1) size 94: request: CALL, SYNC: 12
  273  16:57:32.821225 IP 127.0.0.1.3309 > 127.0.0.1.40078: Flags [P.], seq 20886:21062, ack 593, win 512, options [nop,nop,TS val 1977542710 ecr 1977542710], length 176: IPROTO
	1) size 176: response: OK, SYNC: 12, SCHEMA_VERSION: 78
  274  16:57:32.821253 IP 127.0.0.1.40078 > 127.0.0.1.3309: Flags [P.], seq 593:689, ack 21062, win 512, options [nop,nop,TS val 1977542710 ecr 1977542710], length 96: IPROTO
	1) size 96: request: CALL, SYNC: 13
  275  16:57:32.821272 IP 127.0.0.1.3309 > 127.0.0.1.40078: Flags [P.], seq 21062:21239, ack 689, win 512, options [nop,nop,TS val 1977542710 ecr 1977542710], length 177: IPROTO
	1) size 177: response: ERR: unknown, SYNC: 13, SCHEMA_VERSION: 78
  276  16:57:32.821298 IP 127.0.0.1.40078 > 127.0.0.1.3309: Flags [P.], seq 689:708, ack 21239, win 512, options [nop,nop,TS val 1977542710 ecr 1977542710], length 19: IPROTO
	1) size 19: request: CALL_16, SYNC: 14
  277  16:57:32.821311 IP 127.0.0.1.3309 > 127.0.0.1.40078: Flags [P.], seq 21239:21342, ack 708, win 512, options [nop,nop,TS val 1977542710 ecr 1977542710], length 103: IPROTO
	1) size 103: response: OK, SYNC: 14, SCHEMA_VERSION: 78
  278  16:57:32.821335 IP 127.0.0.1.40078 > 127.0.0.1.3309: Flags [P.], seq 708:727, ack 21342, win 512, options [nop,nop,TS val 1977542710 ecr 1977542710], length 19: IPROTO
	1) size 19: request: CALL_16, SYNC: 15
  279  16:57:32.821347 IP 127.0.0.1.3309 > 127.0.0.1.40078: Flags [P.], seq 21342:21447, ack 727, win 512, options [nop,nop,TS val 1977542710 ecr 1977542710], length 105: IPROTO
	1) size 105: response: OK, SYNC: 15, SCHEMA_VERSION: 78
  280  16:57:32.821365 IP 127.0.0.1.40078 > 127.0.0.1.3309: Flags [P.], seq 727:746, ack 21447, win 512, options [nop,nop,TS val 1977542710 ecr 1977542710], length 19: IPROTO
	1) size 19: request: CALL_16, SYNC: 16
  281  16:57:32.821377 IP 127.0.0.1.3309 > 127.0.0.1.40078: Flags [P.], seq 21447:21552, ack 746, win 512, options [nop,nop,TS val 1977542710 ecr 1977542710], length 105: IPROTO
	1) size 105: response: OK, SYNC: 16, SCHEMA_VERSION: 78
  282  16:57:32.821392 IP 127.0.0.1.40078 > 127.0.0.1.3309: Flags [P.], seq 746:765, ack 21552, win 512, options [nop,nop,TS val 1977542710 ecr 1977542710], length 19: IPROTO
	1) size 19: request: CALL_16, SYNC: 17
  283  16:57:32.821404 IP 127.0.0.1.3309 > 127.0.0.1.40078: Flags [P.], seq 21552:21655, ack 765, win 512, options [nop,nop,TS val 1977542710 ecr 1977542710], length 103: IPROTO
	1) size 103: response: OK, SYNC: 17, SCHEMA_VERSION: 78
  284  16:57:32.821418 IP 127.0.0.1.40078 > 127.0.0.1.3309: Flags [P.], seq 765:784, ack 21655, win 512, options [nop,nop,TS val 1977542710 ecr 1977542710], length 19: IPROTO
	1) size 19: request: CALL_16, SYNC: 18
  285  16:57:32.821431 IP 127.0.0.1.3309 > 127.0.0.1.40078: Flags [P.], seq 21655:21759, ack 784, win 512, options [nop,nop,TS val 1977542710 ecr 1977542710], length 104: IPROTO
	1) size 104: response: OK, SYNC: 18, SCHEMA_VERSION: 78
  286  16:57:32.821444 IP 127.0.0.1.40078 > 127.0.0.1.3309: Flags [P.], seq 784:803, ack 21759, win 512, options [nop,nop,TS val 1977542710 ecr 1977542710], length 19: IPROTO
	1) size 19: request: CALL_16, SYNC: 19
  287  16:57:32.821457 IP 127.0.0.1.3309 > 127.0.0.1.40078: Flags [P.], seq 21759:21864, ack 803, win 512, options [nop,nop,TS val 1977542710 ecr 1977542710], length 105: IPROTO
	1) size 105: response: OK, SYNC: 19, SCHEMA_VERSION: 78
  288  16:57:32.821473 IP 127.0.0.1.40078 > 127.0.0.1.3309: Flags [P.], seq 803:822, ack 21864, win 512, options [nop,nop,TS val 1977542710 ecr 1977542710], length 19: IPROTO
	1) size 19: request: CALL_16, SYNC: 20
  289  16:57:32.821487 IP 127.0.0.1.3309 > 127.0.0.1.40078: Flags [P.], seq 21864:21969, ack 822, win 512, options [nop,nop,TS val 1977542710 ecr 1977542710], length 105: IPROTO
	1) size 105: response: OK, SYNC: 20, SCHEMA_VERSION: 78
  290  16:57:32.821577 IP 127.0.0.1.40078 > 127.0.0.1.3309: Flags [F.], seq 822, ack 21969, win 512, options [nop,nop,TS val 1977542710 ecr 1977542710], length 0
  291  16:57:32.821584 IP 127.0.0.1.3309 > 127.0.0.1.40078: Flags [F.], seq 21969, ack 823, win 512, options [nop,nop,TS val 1977542710 ecr 1977542710], length 0
  292  16:57:32.821591 IP 127.0.0.1.40078 > 127.0.0.1.3309: Flags [.], ack 21970, win 512, options [nop,nop,TS val 1977542710 ecr 1977542710], length 0
