    1  08:05:02.114768 IP (tos 0x0, ttl 64, id 56001, offset 0, flags [DF], proto TCP (6), length 60)
    127.0.0.1.38762 > 127.0.0.1.3301: Flags [S], cksum 0xfe30 (incorrect -> 0x24da), seq 192836087, win 65495, options [mss 65495,sackOK,TS val 662036973 ecr 0,nop,wscale 7], length 0
    2  08:05:02.114779 IP (tos 0x0, ttl 64, id 0, offset 0, flags [DF], proto TCP (6), length 60)
    127.0.0.1.3301 > 127.0.0.1.38762: Flags [S.], cksum 0xfe30 (incorrect -> 0x854e), seq 2501050640, ack 192836088, win 65483, options [mss 65495,sackOK,TS val 662036973 ecr 662036973,nop,wscale 7], length 0
    3  08:05:02.114788 IP (tos 0x0, ttl 64, id 56002, offset 0, flags [DF], proto TCP (6), length 52)
    127.0.0.1.38762 > 127.0.0.1.3301: Flags [.], cksum 0xfe28 (incorrect -> 0xac0a), ack 1, win 512, options [nop,nop,TS val 662036973 ecr 662036973], length 0
    4  08:05:02.115027 IP (tos 0x0, ttl 64, id 52730, offset 0, flags [DF], proto TCP (6), length 180)
    127.0.0.1.3301 > 127.0.0.1.38762: Flags [P.], seq 1:129, ack 1, win 512, options [nop,nop,TS val 662036974 ecr 662036973], length 128: IPROTO, length: 128 [|iproto]
    5  08:05:02.115031 IP (tos 0x0, ttl 64, id 56003, offset 0, flags [DF], proto TCP (6), length 52)
    127.0.0.1.38762 > 127.0.0.1.3301: Flags [.], cksum 0xfe28 (incorrect -> 0xab89), ack 129, win 511, options [nop,nop,TS val 662036974 ecr 662036974], length 0
    6  08:05:02.115104 IP (tos 0x0, ttl 64, id 56004, offset 0, flags [DF], proto TCP (6), length 70)
    127.0.0.1.38762 > 127.0.0.1.3301: Flags [P.], cksum 0xfe3a (incorrect -> 0xaff3), seq 1:19, ack 129, win 512, options [nop,nop,TS val 662036974 ecr 662036974], length 18: IPROTO
	1) size 18: request: ID, SYNC: 0
	VERSION: 4
	FEATURES: [0, 1, 2, 3, 4]
    7  08:05:02.115107 IP (tos 0x0, ttl 64, id 52731, offset 0, flags [DF], proto TCP (6), length 52)
    127.0.0.1.3301 > 127.0.0.1.38762: Flags [.], cksum 0xfe28 (incorrect -> 0xab76), ack 19, win 512, options [nop,nop,TS val 662036974 ecr 662036974], length 0
    8  08:05:02.115258 IP (tos 0x0, ttl 64, id 52732, offset 0, flags [DF], proto TCP (6), length 105)
    127.0.0.1.3301 > 127.0.0.1.38762: Flags [P.], seq 129:182, ack 19, win 512, options [nop,nop,TS val 662036974 ecr 662036974], length 53: IPROTO
	1) [|iproto]
    9  08:05:02.115502 IP (tos 0x0, ttl 64, id 21169, offset 0, flags [DF], proto TCP (6), length 60)
    127.0.0.1.38776 > 127.0.0.1.3301: Flags [S], cksum 0xfe30 (incorrect -> 0x78fc), seq 626328559, win 65495, options [mss 65495,sackOK,TS val 662036974 ecr 0,nop,wscale 7], length 0
   10  08:05:02.115505 IP (tos 0x0, ttl 64, id 0, offset 0, flags [DF], proto TCP (6), length 60)
    127.0.0.1.3301 > 127.0.0.1.38776: Flags [S.], cksum 0xfe30 (incorrect -> 0xa50b), seq 3995720797, ack 626328560, win 65483, options [mss 65495,sackOK,TS val 662036974 ecr 662036974,nop,wscale 7], length 0
   11  08:05:02.115509 IP (tos 0x0, ttl 64, id 21170, offset 0, flags [DF], proto TCP (6), length 52)
    127.0.0.1.38776 > 127.0.0.1.3301: Flags [.], cksum 0xfe28 (incorrect -> 0xcbc7), ack 1, win 512, options [nop,nop,TS val 662036974 ecr 662036974], length 0
   12  08:05:02.115687 IP (tos 0x0, ttl 64, id 48779, offset 0, flags [DF], proto TCP (6), length 180)
    127.0.0.1.3301 > 127.0.0.1.38776: Flags [P.], seq 1:129, ack 1, win 512, options [nop,nop,TS val 662036974 ecr 662036974], length 128: IPROTO, length: 128 [|iproto]
   13  08:05:02.115692 IP (tos 0x0, ttl 64, id 21171, offset 0, flags [DF], proto TCP (6), length 52)
    127.0.0.1.38776 > 127.0.0.1.3301: Flags [.], cksum 0xfe28 (incorrect -> 0xcb48), ack 129, win 511, options [nop,nop,TS val 662036974 ecr 662036974], length 0
   14  08:05:02.115754 IP (tos 0x0, ttl 64, id 21172, offset 0, flags [DF], proto TCP (6), length 78)
    127.0.0.1.38776 > 127.0.0.1.3301: Flags [P.], seq 1:27, ack 129, win 512, options [nop,nop,TS val 662036974 ecr 662036974], length 26: IPROTO
	1) [|iproto]
   15  08:05:02.115758 IP (tos 0x0, ttl 64, id 48780, offset 0, flags [DF], proto TCP (6), length 52)
    127.0.0.1.3301 > 127.0.0.1.38776: Flags [.], cksum 0xfe28 (incorrect -> 0xcb2d), ack 27, win 512, options [nop,nop,TS val 662036974 ecr 662036974], length 0
   16  08:05:02.115851 IP (tos 0x0, ttl 64, id 48781, offset 0, flags [DF], proto TCP (6), length 139)
    127.0.0.1.3301 > 127.0.0.1.38776: Flags [P.], seq 129:216, ack 27, win 512, options [nop,nop,TS val 662036974 ecr 662036974], length 87: IPROTO
	1) [|iproto]
   17  08:05:02.115869 IP (tos 0x0, ttl 64, id 21173, offset 0, flags [DF], proto TCP (6), length 78)
    127.0.0.1.38776 > 127.0.0.1.3301: Flags [P.], seq 27:53, ack 216, win 512, options [nop,nop,TS val 662036975 ecr 662036974], length 26: IPROTO
	1) [|iproto]
   18  08:05:02.116102 IP (tos 0x0, ttl 64, id 48782, offset 0, flags [DF], proto TCP (6), length 139)
    127.0.0.1.3301 > 127.0.0.1.38776: Flags [P.], seq 216:303, ack 53, win 512, options [nop,nop,TS val 662036975 ecr 662036975], length 87: IPROTO
	1) [|iproto]
   19  08:05:02.116159 IP (tos 0x0, ttl 64, id 21174, offset 0, flags [DF], proto TCP (6), length 78)
    127.0.0.1.38776 > 127.0.0.1.3301: Flags [P.], seq 53:79, ack 303, win 512, options [nop,nop,TS val 662036975 ecr 662036975], length 26: IPROTO
	1) [|iproto]
   20  08:05:02.124378 IP (tos 0x0, ttl 64, id 48783, offset 0, flags [DF], proto TCP (6), length 177)
    127.0.0.1.3301 > 127.0.0.1.38776: Flags [P.], seq 303:428, ack 79, win 512, options [nop,nop,TS val 662036983 ecr 662036975], length 125: IPROTO
	1) [|iproto]
   21  08:05:02.124450 IP (tos 0x0, ttl 64, id 21175, offset 0, flags [DF], proto TCP (6), length 78)
    127.0.0.1.38776 > 127.0.0.1.3301: Flags [P.], seq 79:105, ack 428, win 512, options [nop,nop,TS val 662036983 ecr 662036983], length 26: IPROTO
	1) [|iproto]
   22  08:05:02.132068 IP (tos 0x0, ttl 64, id 56005, offset 0, flags [DF], proto TCP (6), length 52)
    127.0.0.1.38762 > 127.0.0.1.3301: Flags [F.], cksum 0xfe28 (incorrect -> 0xab2f), seq 19, ack 182, win 512, options [nop,nop,TS val 662036991 ecr 662036974], length 0
   23  08:05:02.132102 IP (tos 0x0, ttl 64, id 52733, offset 0, flags [DF], proto TCP (6), length 52)
    127.0.0.1.3301 > 127.0.0.1.38762: Flags [F.], cksum 0xfe28 (incorrect -> 0xab1d), seq 182, ack 20, win 512, options [nop,nop,TS val 662036991 ecr 662036991], length 0
   24  08:05:02.132117 IP (tos 0x0, ttl 64, id 56006, offset 0, flags [DF], proto TCP (6), length 52)
    127.0.0.1.38762 > 127.0.0.1.3301: Flags [.], cksum 0xfe28 (incorrect -> 0xab1d), ack 183, win 512, options [nop,nop,TS val 662036991 ecr 662036991], length 0
   25  08:05:02.132152 IP (tos 0x0, ttl 64, id 48784, offset 0, flags [DF], proto TCP (6), length 177)
    127.0.0.1.3301 > 127.0.0.1.38776: Flags [P.], seq 428:553, ack 105, win 512, options [nop,nop,TS val 662036991 ecr 662036983], length 125: IPROTO
	1) [|iproto]
   26  08:05:02.132155 IP (tos 0x0, ttl 64, id 21176, offset 0, flags [DF], proto TCP (6), length 52)
    127.0.0.1.38776 > 127.0.0.1.3301: Flags [F.], cksum 0xfe28 (incorrect -> 0xc999), seq 105, ack 428, win 512, options [nop,nop,TS val 662036991 ecr 662036983], length 0
   27  08:05:02.132168 IP (tos 0x0, ttl 64, id 48785, offset 0, flags [DF], proto TCP (6), length 52)
    127.0.0.1.3301 > 127.0.0.1.38776: Flags [F.], cksum 0xfe28 (incorrect -> 0xc913), seq 553, ack 106, win 512, options [nop,nop,TS val 662036991 ecr 662036991], length 0
   28  08:05:02.132173 IP (tos 0x0, ttl 64, id 0, offset 0, flags [DF], proto TCP (6), length 40)
    127.0.0.1.38776 > 127.0.0.1.3301: Flags [R], cksum 0xe3d3 (correct), seq 626328664, win 0, length 0
   29  08:05:02.132174 IP (tos 0x0, ttl 64, id 0, offset 0, flags [DF], proto TCP (6), length 40)
    127.0.0.1.38776 > 127.0.0.1.3301: Flags [R], cksum 0xe3d2 (correct), seq 626328665, win 0, length 0
   30  08:05:02.166049 IP (tos 0x0, ttl 64, id 16815, offset 0, flags [DF], proto TCP (6), length 60)
    127.0.0.1.38784 > 127.0.0.1.3301: Flags [S], cksum 0xfe30 (incorrect -> 0xe8de), seq 3193502413, win 65495, options [mss 65495,sackOK,TS val 662037025 ecr 0,nop,wscale 7], length 0
   31  08:05:02.166059 IP (tos 0x0, ttl 64, id 0, offset 0, flags [DF], proto TCP (6), length 60)
    127.0.0.1.3301 > 127.0.0.1.38784: Flags [S.], cksum 0xfe30 (incorrect -> 0x5509), seq 618489180, ack 3193502414, win 65483, options [mss 65495,sackOK,TS val 662037025 ecr 662037025,nop,wscale 7], length 0
   32  08:05:02.166068 IP (tos 0x0, ttl 64, id 16816, offset 0, flags [DF], proto TCP (6), length 52)
    127.0.0.1.38784 > 127.0.0.1.3301: Flags [.], cksum 0xfe28 (incorrect -> 0x7bc5), ack 1, win 512, options [nop,nop,TS val 662037025 ecr 662037025], length 0
   33  08:05:02.166384 IP (tos 0x0, ttl 64, id 45569, offset 0, flags [DF], proto TCP (6), length 180)
    127.0.0.1.3301 > 127.0.0.1.38784: Flags [P.], seq 1:129, ack 1, win 512, options [nop,nop,TS val 662037025 ecr 662037025], length 128: IPROTO, length: 128 [|iproto]
   34  08:05:02.166391 IP (tos 0x0, ttl 64, id 16817, offset 0, flags [DF], proto TCP (6), length 52)
    127.0.0.1.38784 > 127.0.0.1.3301: Flags [.], cksum 0xfe28 (incorrect -> 0x7b46), ack 129, win 511, options [nop,nop,TS val 662037025 ecr 662037025], length 0
   35  08:05:02.166425 IP (tos 0x0, ttl 64, id 16818, offset 0, flags [DF], proto TCP (6), length 70)
    127.0.0.1.38784 > 127.0.0.1.3301: Flags [P.], cksum 0xfe3a (incorrect -> 0x7fb0), seq 1:19, ack 129, win 512, options [nop,nop,TS val 662037025 ecr 662037025], length 18: IPROTO
	1) size 18: request: ID, SYNC: 0
	VERSION: 4
	FEATURES: [0, 1, 2, 3, 4]
   36  08:05:02.166429 IP (tos 0x0, ttl 64, id 45570, offset 0, flags [DF], proto TCP (6), length 52)
    127.0.0.1.3301 > 127.0.0.1.38784: Flags [.], cksum 0xfe28 (incorrect -> 0x7b33), ack 19, win 512, options [nop,nop,TS val 662037025 ecr 662037025], length 0
   37  08:05:02.166668 IP (tos 0x0, ttl 64, id 45571, offset 0, flags [DF], proto TCP (6), length 105)
    127.0.0.1.3301 > 127.0.0.1.38784: Flags [P.], seq 129:182, ack 19, win 512, options [nop,nop,TS val 662037025 ecr 662037025], length 53: IPROTO
	1) [|iproto]
   38  08:05:02.166811 IP (tos 0x0, ttl 64, id 19991, offset 0, flags [DF], proto TCP (6), length 60)
    127.0.0.1.38796 > 127.0.0.1.3301: Flags [S], cksum 0xfe30 (incorrect -> 0xcf06), seq 3226014377, win 65495, options [mss 65495,sackOK,TS val 662037025 ecr 0,nop,wscale 7], length 0
   39  08:05:02.166816 IP (tos 0x0, ttl 64, id 0, offset 0, flags [DF], proto TCP (6), length 60)
    127.0.0.1.3301 > 127.0.0.1.38796: Flags [S.], cksum 0xfe30 (incorrect -> 0x9f30), seq 894628071, ack 3226014378, win 65483, options [mss 65495,sackOK,TS val 662037025 ecr 662037025,nop,wscale 7], length 0
   40  08:05:02.166820 IP (tos 0x0, ttl 64, id 19992, offset 0, flags [DF], proto TCP (6), length 52)
    127.0.0.1.38796 > 127.0.0.1.3301: Flags [.], cksum 0xfe28 (incorrect -> 0xc5ec), ack 1, win 512, options [nop,nop,TS val 662037025 ecr 662037025], length 0
   41  08:05:02.166965 IP (tos 0x0, ttl 64, id 38853, offset 0, flags [DF], proto TCP (6), length 180)
    127.0.0.1.3301 > 127.0.0.1.38796: Flags [P.], seq 1:129, ack 1, win 512, options [nop,nop,TS val 662037026 ecr 662037025], length 128: IPROTO, length: 128 [|iproto]
   42  08:05:02.166970 IP (tos 0x0, ttl 64, id 19993, offset 0, flags [DF], proto TCP (6), length 52)
    127.0.0.1.38796 > 127.0.0.1.3301: Flags [.], cksum 0xfe28 (incorrect -> 0xc56b), ack 129, win 511, options [nop,nop,TS val 662037026 ecr 662037026], length 0
   43  08:05:02.167016 IP (tos 0x0, ttl 64, id 19994, offset 0, flags [DF], proto TCP (6), length 78)
    127.0.0.1.38796 > 127.0.0.1.3301: Flags [P.], seq 1:27, ack 129, win 512, options [nop,nop,TS val 662037026 ecr 662037026], length 26: IPROTO
	1) [|iproto]
   44  08:05:02.167020 IP (tos 0x0, ttl 64, id 38854, offset 0, flags [DF], proto TCP (6), length 52)
    127.0.0.1.3301 > 127.0.0.1.38796: Flags [.], cksum 0xfe28 (incorrect -> 0xc550), ack 27, win 512, options [nop,nop,TS val 662037026 ecr 662037026], length 0
   45  08:05:02.167146 IP (tos 0x0, ttl 64, id 38855, offset 0, flags [DF], proto TCP (6), length 177)
    127.0.0.1.3301 > 127.0.0.1.38796: Flags [P.], seq 129:254, ack 27, win 512, options [nop,nop,TS val 662037026 ecr 662037026], length 125: IPROTO
	1) [|iproto]
   46  08:05:02.167208 IP (tos 0x0, ttl 64, id 19995, offset 0, flags [DF], proto TCP (6), length 78)
    127.0.0.1.38796 > 127.0.0.1.3301: Flags [P.], seq 27:53, ack 254, win 512, options [nop,nop,TS val 662037026 ecr 662037026], length 26: IPROTO
	1) [|iproto]
   47  08:05:02.167360 IP (tos 0x0, ttl 64, id 16819, offset 0, flags [DF], proto TCP (6), length 106)
    127.0.0.1.38784 > 127.0.0.1.3301: Flags [P.], seq 19:73, ack 182, win 512, options [nop,nop,TS val 662037026 ecr 662037025], length 54: IPROTO
	1) [|iproto]
   48  08:05:02.167522 IP (tos 0x0, ttl 64, id 45572, offset 0, flags [DF], proto TCP (6), length 85)
    127.0.0.1.3301 > 127.0.0.1.38784: Flags [P.], seq 182:215, ack 73, win 512, options [nop,nop,TS val 662037026 ecr 662037026], length 33: IPROTO
	1) [|iproto]
   49  08:05:02.167596 IP (tos 0x0, ttl 64, id 16820, offset 0, flags [DF], proto TCP (6), length 106)
    127.0.0.1.38784 > 127.0.0.1.3301: Flags [P.], seq 73:127, ack 215, win 512, options [nop,nop,TS val 662037026 ecr 662037026], length 54: IPROTO
	1) [|iproto]
   50  08:05:02.167844 IP (tos 0x0, ttl 64, id 45573, offset 0, flags [DF], proto TCP (6), length 65)
    127.0.0.1.3301 > 127.0.0.1.38784: Flags [P.], cksum 0xfe35 (incorrect -> 0x98b0), seq 215:228, ack 127, win 512, options [nop,nop,TS val 662037026 ecr 662037026], length 13: IPROTO
	1) size 13: response: HEARTBEAT
	VCLOCK: {1: 9}
   51  08:05:02.167855 IP (tos 0x0, ttl 64, id 45574, offset 0, flags [DF], proto TCP (6), length 60)
    127.0.0.1.3301 > 127.0.0.1.38784: Flags [P.], cksum 0xfe30 (incorrect -> 0xa888), seq 228:236, ack 127, win 512, options [nop,nop,TS val 662037027 ecr 662037026], length 8: IPROTO
	1) size 8: request: JOIN_META, SYNC: 0 [|iproto]
   52  08:05:02.167858 IP (tos 0x0, ttl 64, id 45575, offset 0, flags [DF], proto TCP (6), length 69)
    127.0.0.1.3301 > 127.0.0.1.38784: Flags [P.], cksum 0xfe39 (incorrect -> 0x1745), seq 236:253, ack 127, win 512, options [nop,nop,TS val 662037027 ecr 662037026], length 17: IPROTO
	1) size 17: request: RAFT_PROMOTE, SYNC: 0, REPLICA_ID: 1
	REPLICA_ID: 1
	LSN: 0
	TERM: 2
   53  08:05:02.167860 IP (tos 0x0, ttl 64, id 45576, offset 0, flags [DF], proto TCP (6), length 60)
    127.0.0.1.3301 > 127.0.0.1.38784: Flags [P.], cksum 0xfe30 (incorrect -> 0xa86e), seq 253:261, ack 127, win 512, options [nop,nop,TS val 662037027 ecr 662037026], length 8: IPROTO
	1) size 8: request: JOIN_SNAPSHOT, SYNC: 0
   54  08:05:02.167947 IP (tos 0x0, ttl 64, id 16821, offset 0, flags [DF], proto TCP (6), length 52)
    127.0.0.1.38784 > 127.0.0.1.3301: Flags [.], cksum 0xfe28 (incorrect -> 0x7a40), ack 261, win 512, options [nop,nop,TS val 662037027 ecr 662037026], length 0
   55  08:05:02.168039 IP (tos 0x0, ttl 64, id 45577, offset 0, flags [DF], proto TCP (6), length 115)
    127.0.0.1.3301 > 127.0.0.1.38784: Flags [P.], seq 261:324, ack 127, win 512, options [nop,nop,TS val 662037027 ecr 662037027], length 63: IPROTO
	1) [|iproto]
   56  08:05:02.168046 IP (tos 0x0, ttl 64, id 45578, offset 0, flags [DF], proto TCP (6), length 80)
    127.0.0.1.3301 > 127.0.0.1.38784: Flags [P.], seq 324:352, ack 127, win 512, options [nop,nop,TS val 662037027 ecr 662037027], length 28: IPROTO
	1) [|iproto]
   57  08:05:02.168050 IP (tos 0x0, ttl 64, id 45579, offset 0, flags [DF], proto TCP (6), length 85)
    127.0.0.1.3301 > 127.0.0.1.38784: Flags [P.], seq 352:385, ack 127, win 512, options [nop,nop,TS val 662037027 ecr 662037027], length 33: IPROTO
	1) [|iproto]
   58  08:05:02.168052 IP (tos 0x0, ttl 64, id 45580, offset 0, flags [DF], proto TCP (6), length 103)
    127.0.0.1.3301 > 127.0.0.1.38784: Flags [P.], seq 385:436, ack 127, win 512, options [nop,nop,TS val 662037027 ecr 662037027], length 51: IPROTO
	1) [|iproto]
   59  08:05:02.168056 IP (tos 0x0, ttl 64, id 45581, offset 0, flags [DF], proto TCP (6), length 105)
    127.0.0.1.3301 > 127.0.0.1.38784: Flags [P.], seq 436:489, ack 127, win 512, options [nop,nop,TS val 662037027 ecr 662037027], length 53: IPROTO
	1) [|iproto]
   60  08:05:02.168059 IP (tos 0x0, ttl 64, id 45582, offset 0, flags [DF], proto TCP (6), length 87)
    127.0.0.1.3301 > 127.0.0.1.38784: Flags [P.], seq 489:524, ack 127, win 512, options [nop,nop,TS val 662037027 ecr 662037027], length 35: IPROTO
	1) [|iproto]
   61  08:05:02.168061 IP (tos 0x0, ttl 64, id 45583, offset 0, flags [DF], proto TCP (6), length 110)
    127.0.0.1.3301 > 127.0.0.1.38784: Flags [P.], seq 524:582, ack 127, win 512, options [nop,nop,TS val 662037027 ecr 662037027], length 58: IPROTO
	1) [|iproto]
   62  08:05:02.168064 IP (tos 0x0, ttl 64, id 45584, offset 0, flags [DF], proto TCP (6), length 112)
    127.0.0.1.3301 > 127.0.0.1.38784: Flags [P.], seq 582:642, ack 127, win 512, options [nop,nop,TS val 662037027 ecr 662037027], length 60: IPROTO
	1) [|iproto]
   63  08:05:02.168066 IP (tos 0x0, ttl 64, id 45585, offset 0, flags [DF], proto TCP (6), length 111)
    127.0.0.1.3301 > 127.0.0.1.38784: Flags [P.], seq 642:701, ack 127, win 512, options [nop,nop,TS val 662037027 ecr 662037027], length 59: IPROTO
	1) [|iproto]
   64  08:05:02.168069 IP (tos 0x0, ttl 64, id 45586, offset 0, flags [DF], proto TCP (6), length 110)
    127.0.0.1.3301 > 127.0.0.1.38784: Flags [P.], seq 701:759, ack 127, win 512, options [nop,nop,TS val 662037027 ecr 662037027], length 58: IPROTO
	1) [|iproto]
   65  08:05:02.168109 IP (tos 0x0, ttl 64, id 16822, offset 0, flags [DF], proto TCP (6), length 52)
    127.0.0.1.38784 > 127.0.0.1.3301: Flags [.], cksum 0xfe28 (incorrect -> 0x784d), ack 759, win 512, options [nop,nop,TS val 662037027 ecr 662037027], length 0
   66  08:05:02.168115 IP (tos 0x0, ttl 64, id 45587, offset 0, flags [DF], proto TCP (6), length 2853)
    127.0.0.1.3301 > 127.0.0.1.38784: Flags [P.], seq 759:3560, ack 127, win 512, options [nop,nop,TS val 662037027 ecr 662037027], length 2801: IPROTO
	1) [|iproto]
   67  08:05:02.168119 IP (tos 0x0, ttl 64, id 45588, offset 0, flags [DF], proto TCP (6), length 110)
    127.0.0.1.3301 > 127.0.0.1.38784: Flags [P.], seq 3560:3618, ack 127, win 512, options [nop,nop,TS val 662037027 ecr 662037027], length 58: IPROTO
	1) [|iproto]
   68  08:05:02.168121 IP (tos 0x0, ttl 64, id 45589, offset 0, flags [DF], proto TCP (6), length 112)
    127.0.0.1.3301 > 127.0.0.1.38784: Flags [P.], seq 3618:3678, ack 127, win 512, options [nop,nop,TS val 662037027 ecr 662037027], length 60: IPROTO
	1) [|iproto]
   69  08:05:02.168124 IP (tos 0x0, ttl 64, id 45590, offset 0, flags [DF], proto TCP (6), length 111)
    127.0.0.1.3301 > 127.0.0.1.38784: Flags [P.], seq 3678:3737, ack 127, win 512, options [nop,nop,TS val 662037027 ecr 662037027], length 59: IPROTO
	1) [|iproto]
   70  08:05:02.168126 IP (tos 0x0, ttl 64, id 45591, offset 0, flags [DF], proto TCP (6), length 110)
    127.0.0.1.3301 > 127.0.0.1.38784: Flags [P.], seq 3737:3795, ack 127, win 512, options [nop,nop,TS val 662037027 ecr 662037027], length 58: IPROTO
	1) [|iproto]
   71  08:05:02.168129 IP (tos 0x0, ttl 64, id 45592, offset 0, flags [DF], proto TCP (6), length 112)
    127.0.0.1.3301 > 127.0.0.1.38784: Flags [P.], seq 3795:3855, ack 127, win 512, options [nop,nop,TS val 662037027 ecr 662037027], length 60: IPROTO
	1) [|iproto]
   72  08:05:02.168131 IP (tos 0x0, ttl 64, id 45593, offset 0, flags [DF], proto TCP (6), length 111)
    127.0.0.1.3301 > 127.0.0.1.38784: Flags [P.], seq 3855:3914, ack 127, win 512, options [nop,nop,TS val 662037027 ecr 662037027], length 59: IPROTO
	1) [|iproto]
   73  08:05:02.168134 IP (tos 0x0, ttl 64, id 45594, offset 0, flags [DF], proto TCP (6), length 110)
    127.0.0.1.3301 > 127.0.0.1.38784: Flags [P.], seq 3914:3972, ack 127, win 512, options [nop,nop,TS val 662037027 ecr 662037027], length 58: IPROTO
	1) [|iproto]
   74  08:05:02.168136 IP (tos 0x0, ttl 64, id 45595, offset 0, flags [DF], proto TCP (6), length 112)
    127.0.0.1.3301 > 127.0.0.1.38784: Flags [P.], seq 3972:4032, ack 127, win 512, options [nop,nop,TS val 662037027 ecr 662037027], length 60: IPROTO
	1) [|iproto]
   75  08:05:02.168139 IP (tos 0x0, ttl 64, id 45596, offset 0, flags [DF], proto TCP (6), length 111)
    127.0.0.1.3301 > 127.0.0.1.38784: Flags [P.], seq 4032:4091, ack 127, win 512, options [nop,nop,TS val 662037027 ecr 662037027], length 59: IPROTO
	1) [|iproto]
   76  08:05:02.168141 IP (tos 0x0, ttl 64, id 45597, offset 0, flags [DF], proto TCP (6), length 133)
    127.0.0.1.3301 > 127.0.0.1.38784: Flags [P.], seq 4091:4172, ack 127, win 512, options [nop,nop,TS val 662037027 ecr 662037027], length 81: IPROTO
	1) [|iproto]
   77  08:05:02.168144 IP (tos 0x0, ttl 64, id 45598, offset 0, flags [DF], proto TCP (6), length 135)
    127.0.0.1.3301 > 127.0.0.1.38784: Flags [P.], seq 4172:4255, ack 127, win 512, options [nop,nop,TS val 662037027 ecr 662037027], length 83: IPROTO
	1) [|iproto]
   78  08:05:02.168147 IP (tos 0x0, ttl 64, id 45599, offset 0, flags [DF], proto TCP (6), length 134)
    127.0.0.1.3301 > 127.0.0.1.38784: Flags [P.], seq 4255:4337, ack 127, win 512, options [nop,nop,TS val 662037027 ecr 662037027], length 82: IPROTO
	1) [|iproto]
   79  08:05:02.168149 IP (tos 0x0, ttl 64, id 45600, offset 0, flags [DF], proto TCP (6), length 110)
    127.0.0.1.3301 > 127.0.0.1.38784: Flags [P.], seq 4337:4395, ack 127, win 512, options [nop,nop,TS val 662037027 ecr 662037027], length 58: IPROTO
	1) [|iproto]
   80  08:05:02.168152 IP (tos 0x0, ttl 64, id 45601, offset 0, flags [DF], proto TCP (6), length 112)
    127.0.0.1.3301 > 127.0.0.1.38784: Flags [P.], seq 4395:4455, ack 127, win 512, options [nop,nop,TS val 662037027 ecr 662037027], length 60: IPROTO
	1) [|iproto]
   81  08:05:02.168154 IP (tos 0x0, ttl 64, id 45602, offset 0, flags [DF], proto TCP (6), length 111)
    127.0.0.1.3301 > 127.0.0.1.38784: Flags [P.], seq 4455:4514, ack 127, win 512, options [nop,nop,TS val 662037027 ecr 662037027], length 59: IPROTO
	1) [|iproto]
   82  08:05:02.168157 IP (tos 0x0, ttl 64, id 45603, offset 0, flags [DF], proto TCP (6), length 110)
    127.0.0.1.3301 > 127.0.0.1.38784: Flags [P.], seq 4514:4572, ack 127, win 512, options [nop,nop,TS val 662037027 ecr 662037027], length 58: IPROTO
	1) [|iproto]
   83  08:05:02.168159 IP (tos 0x0, ttl 64, id 45604, offset 0, flags [DF], proto TCP (6), length 112)
    127.0.0.1.3301 > 127.0.0.1.38784: Flags [P.], seq 4572:4632, ack 127, win 512, options [nop,nop,TS val 662037027 ecr 662037027], length 60: IPROTO
	1) [|iproto]
   84  08:05:02.168162 IP (tos 0x0, ttl 64, id 45605, offset 0, flags [DF], proto TCP (6), length 111)
    127.0.0.1.3301 > 127.0.0.1.38784: Flags [P.], seq 4632:4691, ack 127, win 512, options [nop,nop,TS val 662037027 ecr 662037027], length 59: IPROTO
	1) [|iproto]
   85  08:05:02.168164 IP (tos 0x0, ttl 64, id 45606, offset 0, flags [DF], proto TCP (6), length 110)
    127.0.0.1.3301 > 127.0.0.1.38784: Flags [P.], seq 4691:4749, ack 127, win 512, options [nop,nop,TS val 662037027 ecr 662037027], length 58: IPROTO
	1) [|iproto]
   86  08:05:02.168291 IP (tos 0x0, ttl 64, id 16823, offset 0, flags [DF], proto TCP (6), length 52)
    127.0.0.1.38784 > 127.0.0.1.3301: Flags [.], cksum 0xfe28 (incorrect -> 0x68d6), ack 4749, win 481, options [nop,nop,TS val 662037027 ecr 662037027], length 0
   87  08:05:02.168297 IP (tos 0x0, ttl 64, id 45607, offset 0, flags [DF], proto TCP (6), length 14028)
    127.0.0.1.3301 > 127.0.0.1.38784: Flags [P.], seq 4749:18725, ack 127, win 512, options [nop,nop,TS val 662037027 ecr 662037027], length 13976: IPROTO
	1) [|iproto]
   88  08:05:02.168300 IP (tos 0x0, ttl 64, id 45608, offset 0, flags [DF], proto TCP (6), length 309)
    127.0.0.1.3301 > 127.0.0.1.38784: Flags [P.], seq 18725:18982, ack 127, win 512, options [nop,nop,TS val 662037027 ecr 662037027], length 257: IPROTO
	1) [|iproto]
   89  08:05:02.168304 IP (tos 0x0, ttl 64, id 45609, offset 0, flags [DF], proto TCP (6), length 145)
    127.0.0.1.3301 > 127.0.0.1.38784: Flags [P.], seq 18982:19075, ack 127, win 512, options [nop,nop,TS val 662037027 ecr 662037027], length 93: IPROTO
	1) [|iproto]
   90  08:05:02.168306 IP (tos 0x0, ttl 64, id 45610, offset 0, flags [DF], proto TCP (6), length 312)
    127.0.0.1.3301 > 127.0.0.1.38784: Flags [P.], seq 19075:19335, ack 127, win 512, options [nop,nop,TS val 662037027 ecr 662037027], length 260: IPROTO
	1) [|iproto]
   91  08:05:02.168309 IP (tos 0x0, ttl 64, id 45611, offset 0, flags [DF], proto TCP (6), length 225)
    127.0.0.1.3301 > 127.0.0.1.38784: Flags [P.], seq 19335:19508, ack 127, win 512, options [nop,nop,TS val 662037027 ecr 662037027], length 173: IPROTO
	1) [|iproto]
   92  08:05:02.168311 IP (tos 0x0, ttl 64, id 45612, offset 0, flags [DF], proto TCP (6), length 228)
    127.0.0.1.3301 > 127.0.0.1.38784: Flags [P.], seq 19508:19684, ack 127, win 512, options [nop,nop,TS val 662037027 ecr 662037027], length 176: IPROTO
	1) [|iproto]
   93  08:05:02.168314 IP (tos 0x0, ttl 64, id 45613, offset 0, flags [DF], proto TCP (6), length 614)
    127.0.0.1.3301 > 127.0.0.1.38784: Flags [P.], seq 19684:20246, ack 127, win 512, options [nop,nop,TS val 662037027 ecr 662037027], length 562: IPROTO
	1) [|iproto]
   94  08:05:02.168316 IP (tos 0x0, ttl 64, id 45614, offset 0, flags [DF], proto TCP (6), length 617)
    127.0.0.1.3301 > 127.0.0.1.38784: Flags [P.], seq 20246:20811, ack 127, win 512, options [nop,nop,TS val 662037027 ecr 662037027], length 565: IPROTO
	1) [|iproto]
   95  08:05:02.168319 IP (tos 0x0, ttl 64, id 45615, offset 0, flags [DF], proto TCP (6), length 267)
    127.0.0.1.3301 > 127.0.0.1.38784: Flags [P.], seq 20811:21026, ack 127, win 512, options [nop,nop,TS val 662037027 ecr 662037027], length 215: IPROTO
	1) [|iproto]
   96  08:05:02.168322 IP (tos 0x0, ttl 64, id 45616, offset 0, flags [DF], proto TCP (6), length 270)
    127.0.0.1.3301 > 127.0.0.1.38784: Flags [P.], seq 21026:21244, ack 127, win 512, options [nop,nop,TS val 662037027 ecr 662037027], length 218: IPROTO
	1) [|iproto]
   97  08:05:02.168324 IP (tos 0x0, ttl 64, id 45617, offset 0, flags [DF], proto TCP (6), length 232)
    127.0.0.1.3301 > 127.0.0.1.38784: Flags [P.], seq 21244:21424, ack 127, win 512, options [nop,nop,TS val 662037027 ecr 662037027], length 180: IPROTO
	1) [|iproto]
   98  08:05:02.168327 IP (tos 0x0, ttl 64, id 45618, offset 0, flags [DF], proto TCP (6), length 235)
    127.0.0.1.3301 > 127.0.0.1.38784: Flags [P.], seq 21424:21607, ack 127, win 512, options [nop,nop,TS val 662037027 ecr 662037027], length 183: IPROTO
	1) [|iproto]
   99  08:05:02.168329 IP (tos 0x0, ttl 64, id 45619, offset 0, flags [DF], proto TCP (6), length 137)
    127.0.0.1.3301 > 127.0.0.1.38784: Flags [P.], seq 21607:21692, ack 127, win 512, options [nop,nop,TS val 662037027 ecr 662037027], length 85: IPROTO
	1) [|iproto]
  100  08:05:02.168334 IP (tos 0x0, ttl 64, id 45620, offset 0, flags [DF], proto TCP (6), length 163)
    127.0.0.1.3301 > 127.0.0.1.38784: Flags [P.], seq 21692:21803, ack 127, win 512, options [nop,nop,TS val 662037027 ecr 662037027], length 111: IPROTO
	1) [|iproto]
  101  08:05:02.168337 IP (tos 0x0, ttl 64, id 45621, offset 0, flags [DF], proto TCP (6), length 141)
    127.0.0.1.3301 > 127.0.0.1.38784: Flags [P.], seq 21803:21892, ack 127, win 512, options [nop,nop,TS val 662037027 ecr 662037027], length 89: IPROTO
	1) [|iproto]
  102  08:05:02.168340 IP (tos 0x0, ttl 64, id 45622, offset 0, flags [DF], proto TCP (6), length 234)
    127.0.0.1.3301 > 127.0.0.1.38784: Flags [P.], seq 21892:22074, ack 127, win 512, options [nop,nop,TS val 662037027 ecr 662037027], length 182: IPROTO
	1) [|iproto]
  103  08:05:02.168342 IP (tos 0x0, ttl 64, id 45623, offset 0, flags [DF], proto TCP (6), length 237)
    127.0.0.1.3301 > 127.0.0.1.38784: Flags [P.], seq 22074:22259, ack 127, win 512, options [nop,nop,TS val 662037027 ecr 662037027], length 185: IPROTO
	1) [|iproto]
  104  08:05:02.168345 IP (tos 0x0, ttl 64, id 45624, offset 0, flags [DF], proto TCP (6), length 347)
    127.0.0.1.3301 > 127.0.0.1.38784: Flags [P.], seq 22259:22554, ack 127, win 512, options [nop,nop,TS val 662037027 ecr 662037027], length 295: IPROTO
	1) [|iproto]
  105  08:05:02.168347 IP (tos 0x0, ttl 64, id 45625, offset 0, flags [DF], proto TCP (6), length 254)
    127.0.0.1.3301 > 127.0.0.1.38784: Flags [P.], seq 22554:22756, ack 127, win 512, options [nop,nop,TS val 662037027 ecr 662037027], length 202: IPROTO
	1) [|iproto]
  106  08:05:02.168350 IP (tos 0x0, ttl 64, id 45626, offset 0, flags [DF], proto TCP (6), length 180)
    127.0.0.1.3301 > 127.0.0.1.38784: Flags [P.], seq 22756:22884, ack 127, win 512, options [nop,nop,TS val 662037027 ecr 662037027], length 128: IPROTO
	1) [|iproto]
  107  08:05:02.168353 IP (tos 0x0, ttl 64, id 45627, offset 0, flags [DF], proto TCP (6), length 157)
    127.0.0.1.3301 > 127.0.0.1.38784: Flags [P.], seq 22884:22989, ack 127, win 512, options [nop,nop,TS val 662037027 ecr 662037027], length 105: IPROTO
	1) [|iproto]
  108  08:05:02.168356 IP (tos 0x0, ttl 64, id 45628, offset 0, flags [DF], proto TCP (6), length 101)
    127.0.0.1.3301 > 127.0.0.1.38784: Flags [P.], seq 22989:23038, ack 127, win 512, options [nop,nop,TS val 662037027 ecr 662037027], length 49: IPROTO
	1) [|iproto]
  109  08:05:02.168360 IP (tos 0x0, ttl 64, id 45629, offset 0, flags [DF], proto TCP (6), length 105)
    127.0.0.1.3301 > 127.0.0.1.38784: Flags [P.], seq 23038:23091, ack 127, win 512, options [nop,nop,TS val 662037027 ecr 662037027], length 53: IPROTO
	1) [|iproto]
  110  08:05:02.168362 IP (tos 0x0, ttl 64, id 45630, offset 0, flags [DF], proto TCP (6), length 107)
    127.0.0.1.3301 > 127.0.0.1.38784: Flags [P.], seq 23091:23146, ack 127, win 512, options [nop,nop,TS val 662037027 ecr 662037027], length 55: IPROTO
	1) [|iproto]
  111  08:05:02.168365 IP (tos 0x0, ttl 64, id 45631, offset 0, flags [DF], proto TCP (6), length 102)
    127.0.0.1.3301 > 127.0.0.1.38784: Flags [P.], seq 23146:23196, ack 127, win 512, options [nop,nop,TS val 662037027 ecr 662037027], length 50: IPROTO
	1) [|iproto]
  112  08:05:02.168367 IP (tos 0x0, ttl 64, id 45632, offset 0, flags [DF], proto TCP (6), length 107)
    127.0.0.1.3301 > 127.0.0.1.38784: Flags [P.], seq 23196:23251, ack 127, win 512, options [nop,nop,TS val 662037027 ecr 662037027], length 55: IPROTO
	1) [|iproto]
  113  08:05:02.168370 IP (tos 0x0, ttl 64, id 45633, offset 0, flags [DF], proto TCP (6), length 102)
    127.0.0.1.3301 > 127.0.0.1.38784: Flags [P.], seq 23251:23301, ack 127, win 512, options [nop,nop,TS val 662037027 ecr 662037027], length 50: IPROTO
	1) [|iproto]
  114  08:05:02.168373 IP (tos 0x0, ttl 64, id 45634, offset 0, flags [DF], proto TCP (6), length 107)
    127.0.0.1.3301 > 127.0.0.1.38784: Flags [P.], seq 23301:23356, ack 127, win 512, options [nop,nop,TS val 662037027 ecr 662037027], length 55: IPROTO
	1) [|iproto]
  115  08:05:02.168375 IP (tos 0x0, ttl 64, id 45635, offset 0, flags [DF], proto TCP (6), length 105)
    127.0.0.1.3301 > 127.0.0.1.38784: Flags [P.], seq 23356:23409, ack 127, win 512, options [nop,nop,TS val 662037027 ecr 662037027], length 53: IPROTO
	1) [|iproto]
  116  08:05:02.168378 IP (tos 0x0, ttl 64, id 45636, offset 0, flags [DF], proto TCP (6), length 102)
    127.0.0.1.3301 > 127.0.0.1.38784: Flags [P.], seq 23409:23459, ack 127, win 512, options [nop,nop,TS val 662037027 ecr 662037027], length 50: IPROTO
	1) [|iproto]
  117  08:05:02.168380 IP (tos 0x0, ttl 64, id 45637, offset 0, flags [DF], proto TCP (6), length 107)
    127.0.0.1.3301 > 127.0.0.1.38784: Flags [P.], seq 23459:23514, ack 127, win 512, options [nop,nop,TS val 662037027 ecr 662037027], length 55: IPROTO
	1) [|iproto]
  118  08:05:02.168383 IP (tos 0x0, ttl 64, id 45638, offset 0, flags [DF], proto TCP (6), length 105)
    127.0.0.1.3301 > 127.0.0.1.38784: Flags [P.], seq 23514:23567, ack 127, win 512, options [nop,nop,TS val 662037027 ecr 662037027], length 53: IPROTO
	1) [|iproto]
  119  08:05:02.168385 IP (tos 0x0, ttl 64, id 45639, offset 0, flags [DF], proto TCP (6), length 102)
    127.0.0.1.3301 > 127.0.0.1.38784: Flags [P.], seq 23567:23617, ack 127, win 512, options [nop,nop,TS val 662037027 ecr 662037027], length 50: IPROTO
	1) [|iproto]
  120  08:05:02.168388 IP (tos 0x0, ttl 64, id 45640, offset 0, flags [DF], proto TCP (6), length 107)
    127.0.0.1.3301 > 127.0.0.1.38784: Flags [P.], seq 23617:23672, ack 127, win 512, options [nop,nop,TS val 662037027 ecr 662037027], length 55: IPROTO
	1) [|iproto]
  121  08:05:02.168390 IP (tos 0x0, ttl 64, id 45641, offset 0, flags [DF], proto TCP (6), length 105)
    127.0.0.1.3301 > 127.0.0.1.38784: Flags [P.], seq 23672:23725, ack 127, win 512, options [nop,nop,TS val 662037027 ecr 662037027], length 53: IPROTO
	1) [|iproto]
  122  08:05:02.168393 IP (tos 0x0, ttl 64, id 45642, offset 0, flags [DF], proto TCP (6), length 102)
    127.0.0.1.3301 > 127.0.0.1.38784: Flags [P.], seq 23725:23775, ack 127, win 512, options [nop,nop,TS val 662037027 ecr 662037027], length 50: IPROTO
	1) [|iproto]
  123  08:05:02.168396 IP (tos 0x0, ttl 64, id 45643, offset 0, flags [DF], proto TCP (6), length 107)
    127.0.0.1.3301 > 127.0.0.1.38784: Flags [P.], seq 23775:23830, ack 127, win 512, options [nop,nop,TS val 662037027 ecr 662037027], length 55: IPROTO
	1) [|iproto]
  124  08:05:02.168398 IP (tos 0x0, ttl 64, id 45644, offset 0, flags [DF], proto TCP (6), length 107)
    127.0.0.1.3301 > 127.0.0.1.38784: Flags [P.], seq 23830:23885, ack 127, win 512, options [nop,nop,TS val 662037027 ecr 662037027], length 55: IPROTO
	1) [|iproto]
  125  08:05:02.168401 IP (tos 0x0, ttl 64, id 45645, offset 0, flags [DF], proto TCP (6), length 105)
    127.0.0.1.3301 > 127.0.0.1.38784: Flags [P.], seq 23885:23938, ack 127, win 512, options [nop,nop,TS val 662037027 ecr 662037027], length 53: IPROTO
	1) [|iproto]
  126  08:05:02.168403 IP (tos 0x0, ttl 64, id 45646, offset 0, flags [DF], proto TCP (6), length 102)
    127.0.0.1.3301 > 127.0.0.1.38784: Flags [P.], seq 23938:23988, ack 127, win 512, options [nop,nop,TS val 662037027 ecr 662037027], length 50: IPROTO
	1) [|iproto]
  127  08:05:02.168710 IP (tos 0x0, ttl 64, id 38856, offset 0, flags [DF], proto TCP (6), length 217)
    127.0.0.1.3301 > 127.0.0.1.38796: Flags [P.], seq 254:419, ack 53, win 512, options [nop,nop,TS val 662037027 ecr 662037026], length 165: IPROTO
	1) [|iproto]
  128  08:05:02.171963 IP (tos 0x0, ttl 64, id 45647, offset 0, flags [DF], proto TCP (6), length 3582)
    127.0.0.1.3301 > 127.0.0.1.38784: Flags [P.], seq 23988:27518, ack 127, win 512, options [nop,nop,TS val 662037031 ecr 662037027], length 3530: IPROTO
	1) [|iproto]
  129  08:05:02.173348 IP (tos 0x0, ttl 64, id 16824, offset 0, flags [DF], proto TCP (6), length 52)
    127.0.0.1.38784 > 127.0.0.1.3301: Flags [.], cksum 0xfe28 (incorrect -> 0x106e), ack 27518, win 339, options [nop,nop,TS val 662037032 ecr 662037027], length 0
  130  08:05:02.175889 IP (tos 0x0, ttl 64, id 19996, offset 0, flags [DF], proto TCP (6), length 78)
    127.0.0.1.38796 > 127.0.0.1.3301: Flags [P.], seq 53:79, ack 419, win 512, options [nop,nop,TS val 662037035 ecr 662037027], length 26: IPROTO
	1) [|iproto]
  131  08:05:02.178357 IP (tos 0x0, ttl 64, id 16825, offset 0, flags [DF], proto TCP (6), length 154)
    127.0.0.1.38784 > 127.0.0.1.3301: Flags [P.], seq 127:229, ack 27518, win 512, options [nop,nop,TS val 662037037 ecr 662037027], length 102: IPROTO
	1) [|iproto]
  132  08:05:02.178408 IP (tos 0x0, ttl 64, id 19997, offset 0, flags [DF], proto TCP (6), length 52)
    127.0.0.1.38796 > 127.0.0.1.3301: Flags [F.], cksum 0xfe28 (incorrect -> 0xc3ed), seq 79, ack 419, win 512, options [nop,nop,TS val 662037037 ecr 662037027], length 0
  133  08:05:02.178421 IP (tos 0x0, ttl 64, id 38857, offset 0, flags [DF], proto TCP (6), length 52)
    127.0.0.1.3301 > 127.0.0.1.38796: Flags [F.], cksum 0xfe28 (incorrect -> 0xc3e4), seq 419, ack 80, win 512, options [nop,nop,TS val 662037037 ecr 662037035], length 0
  134  08:05:02.178445 IP (tos 0x0, ttl 64, id 19998, offset 0, flags [DF], proto TCP (6), length 52)
    127.0.0.1.38796 > 127.0.0.1.3301: Flags [.], cksum 0xfe28 (incorrect -> 0xc3e2), ack 420, win 512, options [nop,nop,TS val 662037037 ecr 662037037], length 0
  135  08:05:02.178520 IP (tos 0x0, ttl 64, id 45648, offset 0, flags [DF], proto TCP (6), length 106)
    127.0.0.1.3301 > 127.0.0.1.38784: Flags [P.], seq 27518:27572, ack 229, win 512, options [nop,nop,TS val 662037037 ecr 662037037], length 54: IPROTO
	1) [|iproto]
  136  08:05:02.178544 IP (tos 0x0, ttl 64, id 45649, offset 0, flags [DF], proto TCP (6), length 67)
    127.0.0.1.3301 > 127.0.0.1.38784: Flags [P.], cksum 0xfe37 (incorrect -> 0xaa5a), seq 27572:27587, ack 229, win 512, options [nop,nop,TS val 662037037 ecr 662037037], length 15: IPROTO
	1) size 15: request: RAFT, GROUP_ID: 1, SYNC: 0
	RAFT_TERM: 2
	RAFT_STATE: 1
  137  08:05:02.178580 IP (tos 0x0, ttl 64, id 16826, offset 0, flags [DF], proto TCP (6), length 52)
    127.0.0.1.38784 > 127.0.0.1.3301: Flags [.], cksum 0xfe28 (incorrect -> 0x0f07), ack 27587, win 512, options [nop,nop,TS val 662037037 ecr 662037037], length 0
  138  08:05:02.178718 IP (tos 0x0, ttl 64, id 16827, offset 0, flags [DF], proto TCP (6), length 67)
    127.0.0.1.38784 > 127.0.0.1.3301: Flags [P.], cksum 0xfe37 (incorrect -> 0x27f3), seq 229:244, ack 27587, win 512, options [nop,nop,TS val 662037037 ecr 662037037], length 15: IPROTO
	1) size 15: [|iproto]
  139  08:05:02.178805 IP (tos 0x0, ttl 64, id 45650, offset 0, flags [DF], proto TCP (6), length 75)
    127.0.0.1.3301 > 127.0.0.1.38784: Flags [P.], cksum 0xfe3f (incorrect -> 0xabdb), seq 27587:27610, ack 244, win 512, options [nop,nop,TS val 662037037 ecr 662037037], length 23: IPROTO
	1) size 23: request: HEARTBEAT, REPLICA_ID: 1, TIMESTAMP: 2023-08-30 08:05:02.178722
  140  08:05:02.178942 IP (tos 0x0, ttl 64, id 16828, offset 0, flags [DF], proto TCP (6), length 69)
    127.0.0.1.38784 > 127.0.0.1.3301: Flags [P.], cksum 0xfe39 (incorrect -> 0x2370), seq 244:261, ack 27610, win 512, options [nop,nop,TS val 662037038 ecr 662037037], length 17: IPROTO
	1) size 17: [|iproto]
  141  08:05:02.219994 IP (tos 0x0, ttl 64, id 45651, offset 0, flags [DF], proto TCP (6), length 52)
    127.0.0.1.3301 > 127.0.0.1.38784: Flags [.], cksum 0xfe28 (incorrect -> 0x0ea5), ack 261, win 512, options [nop,nop,TS val 662037079 ecr 662037038], length 0
  142  08:05:02.234412 IP (tos 0x0, ttl 64, id 38587, offset 0, flags [DF], proto TCP (6), length 60)
    127.0.0.1.38800 > 127.0.0.1.3301: Flags [S], cksum 0xfe30 (incorrect -> 0x2247), seq 1028342303, win 65495, options [mss 65495,sackOK,TS val 662037093 ecr 0,nop,wscale 7], length 0
  143  08:05:02.234419 IP (tos 0x0, ttl 64, id 0, offset 0, flags [DF], proto TCP (6), length 60)
    127.0.0.1.3301 > 127.0.0.1.38800: Flags [S.], cksum 0xfe30 (incorrect -> 0xa272), seq 1318332256, ack 1028342304, win 65483, options [mss 65495,sackOK,TS val 662037093 ecr 662037093,nop,wscale 7], length 0
  144  08:05:02.234426 IP (tos 0x0, ttl 64, id 38588, offset 0, flags [DF], proto TCP (6), length 52)
    127.0.0.1.38800 > 127.0.0.1.3301: Flags [.], cksum 0xfe28 (incorrect -> 0xc92e), ack 1, win 512, options [nop,nop,TS val 662037093 ecr 662037093], length 0
  145  08:05:02.234634 IP (tos 0x0, ttl 64, id 19861, offset 0, flags [DF], proto TCP (6), length 180)
    127.0.0.1.3301 > 127.0.0.1.38800: Flags [P.], seq 1:129, ack 1, win 512, options [nop,nop,TS val 662037093 ecr 662037093], length 128: IPROTO, length: 128 [|iproto]
  146  08:05:02.234639 IP (tos 0x0, ttl 64, id 38589, offset 0, flags [DF], proto TCP (6), length 52)
    127.0.0.1.38800 > 127.0.0.1.3301: Flags [.], cksum 0xfe28 (incorrect -> 0xc8af), ack 129, win 511, options [nop,nop,TS val 662037093 ecr 662037093], length 0
  147  08:05:02.234693 IP (tos 0x0, ttl 64, id 38590, offset 0, flags [DF], proto TCP (6), length 72)
    127.0.0.1.38800 > 127.0.0.1.3301: Flags [P.], cksum 0xfe3c (incorrect -> 0xca15), seq 1:21, ack 129, win 512, options [nop,nop,TS val 662037093 ecr 662037093], length 20: IPROTO
	1) size 20: request: ID, SYNC: 1
	VERSION: 4
	FEATURES: [0, 1, 2, 3, 4]
  148  08:05:02.234696 IP (tos 0x0, ttl 64, id 19862, offset 0, flags [DF], proto TCP (6), length 52)
    127.0.0.1.3301 > 127.0.0.1.38800: Flags [.], cksum 0xfe28 (incorrect -> 0xc89a), ack 21, win 512, options [nop,nop,TS val 662037093 ecr 662037093], length 0
  149  08:05:02.234845 IP (tos 0x0, ttl 64, id 19863, offset 0, flags [DF], proto TCP (6), length 105)
    127.0.0.1.3301 > 127.0.0.1.38800: Flags [P.], seq 129:182, ack 21, win 512, options [nop,nop,TS val 662037093 ecr 662037093], length 53: IPROTO
	1) [|iproto]
  150  08:05:02.234881 IP (tos 0x0, ttl 64, id 38591, offset 0, flags [DF], proto TCP (6), length 144)
    127.0.0.1.38800 > 127.0.0.1.3301: Flags [P.], seq 21:113, ack 182, win 512, options [nop,nop,TS val 662037094 ecr 662037093], length 92: IPROTO
	1) size 23: request: SELECT, SYNC: 2
	SPACE: _vspace (ID: 281)
	LIMIT: 4294967295
	KEY: []
	2) [|iproto]
  151  08:05:02.235098 IP (tos 0x0, ttl 64, id 19864, offset 0, flags [DF], proto TCP (6), length 20239)
    127.0.0.1.3301 > 127.0.0.1.38800: Flags [P.], seq 182:20369, ack 113, win 512, options [nop,nop,TS val 662037094 ecr 662037094], length 20187: IPROTO
	1) [|iproto]
  152  08:05:02.235411 IP (tos 0x0, ttl 64, id 38592, offset 0, flags [DF], proto TCP (6), length 75)
    127.0.0.1.38800 > 127.0.0.1.3301: Flags [P.], cksum 0xfe3f (incorrect -> 0x124a), seq 113:136, ack 20369, win 512, options [nop,nop,TS val 662037094 ecr 662037094], length 23: IPROTO
	1) size 23: UNKNOWN
  153  08:05:02.235421 IP (tos 0x0, ttl 64, id 38593, offset 0, flags [DF], proto TCP (6), length 62)
    127.0.0.1.38800 > 127.0.0.1.3301: Flags [P.], cksum 0xfe32 (incorrect -> 0xa43a), seq 136:146, ack 20369, win 512, options [nop,nop,TS val 662037094 ecr 662037094], length 10: IPROTO
	1) size 10: request: PING, SYNC: 6
  154  08:05:02.235458 IP (tos 0x0, ttl 64, id 19865, offset 0, flags [DF], proto TCP (6), length 52)
    127.0.0.1.3301 > 127.0.0.1.38800: Flags [.], cksum 0xfe28 (incorrect -> 0x790b), ack 146, win 512, options [nop,nop,TS val 662037094 ecr 662037094], length 0
  155  08:05:02.235565 IP (tos 0x0, ttl 64, id 19866, offset 0, flags [DF], proto TCP (6), length 110)
    127.0.0.1.3301 > 127.0.0.1.38800: Flags [P.], seq 20369:20427, ack 146, win 512, options [nop,nop,TS val 662037094 ecr 662037094], length 58: IPROTO
	1) [|iproto]
  156  08:05:02.235636 IP (tos 0x0, ttl 64, id 38594, offset 0, flags [DF], proto TCP (6), length 94)
    127.0.0.1.38800 > 127.0.0.1.3301: Flags [P.], seq 146:188, ack 20427, win 512, options [nop,nop,TS val 662037094 ecr 662037094], length 42: IPROTO
	1) size 19: request: INSERT, SYNC: 7
	SPACE_ID: 512
	TUPLE: [1, 10]
	2) [|iproto]
  157  08:05:02.235904 IP (tos 0x0, ttl 64, id 45652, offset 0, flags [DF], proto TCP (6), length 85)
    127.0.0.1.3301 > 127.0.0.1.38784: Flags [P.], seq 27610:27643, ack 261, win 512, options [nop,nop,TS val 662037095 ecr 662037038], length 33: IPROTO
	1) [|iproto]
  158  08:05:02.236017 IP (tos 0x0, ttl 64, id 45653, offset 0, flags [DF], proto TCP (6), length 79)
    127.0.0.1.3301 > 127.0.0.1.38784: Flags [P.], seq 27643:27670, ack 261, win 512, options [nop,nop,TS val 662037095 ecr 662037038], length 27: IPROTO
	1) [|iproto]
  159  08:05:02.236068 IP (tos 0x0, ttl 64, id 19867, offset 0, flags [DF], proto TCP (6), length 94)
    127.0.0.1.3301 > 127.0.0.1.38800: Flags [P.], seq 20427:20469, ack 188, win 512, options [nop,nop,TS val 662037095 ecr 662037094], length 42: IPROTO
	1) [|iproto]
  160  08:05:02.236100 IP (tos 0x0, ttl 64, id 16829, offset 0, flags [DF], proto TCP (6), length 52)
    127.0.0.1.38784 > 127.0.0.1.3301: Flags [.], cksum 0xfe28 (incorrect -> 0x0e20), ack 27670, win 512, options [nop,nop,TS val 662037095 ecr 662037095], length 0
  161  08:05:02.236132 IP (tos 0x0, ttl 64, id 38595, offset 0, flags [DF], proto TCP (6), length 71)
    127.0.0.1.38800 > 127.0.0.1.3301: Flags [P.], cksum 0xfe3b (incorrect -> 0xa59c), seq 188:207, ack 20469, win 512, options [nop,nop,TS val 662037095 ecr 662037095], length 19: IPROTO
	1) size 19: request: INSERT, SYNC: 8
	SPACE_ID: 512
	TUPLE: [2, 20]
  162  08:05:02.236214 IP (tos 0x0, ttl 64, id 16830, offset 0, flags [DF], proto TCP (6), length 79)
    127.0.0.1.38784 > 127.0.0.1.3301: Flags [P.], seq 261:288, ack 27670, win 512, options [nop,nop,TS val 662037095 ecr 662037095], length 27: IPROTO
	1) [|iproto]
  163  08:05:02.236250 IP (tos 0x0, ttl 64, id 45654, offset 0, flags [DF], proto TCP (6), length 52)
    127.0.0.1.3301 > 127.0.0.1.38784: Flags [.], cksum 0xfe28 (incorrect -> 0x0e05), ack 288, win 512, options [nop,nop,TS val 662037095 ecr 662037095], length 0
  164  08:05:02.236309 IP (tos 0x0, ttl 64, id 16831, offset 0, flags [DF], proto TCP (6), length 79)
    127.0.0.1.38784 > 127.0.0.1.3301: Flags [P.], seq 288:315, ack 27670, win 512, options [nop,nop,TS val 662037095 ecr 662037095], length 27: IPROTO
	1) [|iproto]
  165  08:05:02.236360 IP (tos 0x0, ttl 64, id 45655, offset 0, flags [DF], proto TCP (6), length 52)
    127.0.0.1.3301 > 127.0.0.1.38784: Flags [.], cksum 0xfe28 (incorrect -> 0x0dea), ack 315, win 512, options [nop,nop,TS val 662037095 ecr 662037095], length 0
  166  08:05:02.236373 IP (tos 0x0, ttl 64, id 45656, offset 0, flags [DF], proto TCP (6), length 85)
    127.0.0.1.3301 > 127.0.0.1.38784: Flags [P.], seq 27670:27703, ack 315, win 512, options [nop,nop,TS val 662037095 ecr 662037095], length 33: IPROTO
	1) [|iproto]
  167  08:05:02.236481 IP (tos 0x0, ttl 64, id 45657, offset 0, flags [DF], proto TCP (6), length 79)
    127.0.0.1.3301 > 127.0.0.1.38784: Flags [P.], seq 27703:27730, ack 315, win 512, options [nop,nop,TS val 662037095 ecr 662037095], length 27: IPROTO
	1) [|iproto]
  168  08:05:02.236555 IP (tos 0x0, ttl 64, id 16832, offset 0, flags [DF], proto TCP (6), length 52)
    127.0.0.1.38784 > 127.0.0.1.3301: Flags [.], cksum 0xfe28 (incorrect -> 0x0dae), ack 27730, win 512, options [nop,nop,TS val 662037095 ecr 662037095], length 0
  169  08:05:02.236570 IP (tos 0x0, ttl 64, id 19868, offset 0, flags [DF], proto TCP (6), length 94)
    127.0.0.1.3301 > 127.0.0.1.38800: Flags [P.], seq 20469:20511, ack 207, win 512, options [nop,nop,TS val 662037095 ecr 662037095], length 42: IPROTO
	1) [|iproto]
  170  08:05:02.236657 IP (tos 0x0, ttl 64, id 38596, offset 0, flags [DF], proto TCP (6), length 71)
    127.0.0.1.38800 > 127.0.0.1.3301: Flags [P.], cksum 0xfe3b (incorrect -> 0x9b5d), seq 207:226, ack 20511, win 512, options [nop,nop,TS val 662037095 ecr 662037095], length 19: IPROTO
	1) size 19: request: INSERT, SYNC: 9
	SPACE_ID: 512
	TUPLE: [3, 30]
  171  08:05:02.236672 IP (tos 0x0, ttl 64, id 16833, offset 0, flags [DF], proto TCP (6), length 79)
    127.0.0.1.38784 > 127.0.0.1.3301: Flags [P.], seq 315:342, ack 27730, win 512, options [nop,nop,TS val 662037095 ecr 662037095], length 27: IPROTO
	1) [|iproto]
  172  08:05:02.236803 IP (tos 0x0, ttl 64, id 16834, offset 0, flags [DF], proto TCP (6), length 79)
    127.0.0.1.38784 > 127.0.0.1.3301: Flags [P.], seq 342:369, ack 27730, win 512, options [nop,nop,TS val 662037095 ecr 662037095], length 27: IPROTO
	1) [|iproto]
  173  08:05:02.236813 IP (tos 0x0, ttl 64, id 45658, offset 0, flags [DF], proto TCP (6), length 52)
    127.0.0.1.3301 > 127.0.0.1.38784: Flags [.], cksum 0xfe28 (incorrect -> 0x0d78), ack 369, win 512, options [nop,nop,TS val 662037095 ecr 662037095], length 0
  174  08:05:02.236845 IP (tos 0x0, ttl 64, id 45659, offset 0, flags [DF], proto TCP (6), length 85)
    127.0.0.1.3301 > 127.0.0.1.38784: Flags [P.], seq 27730:27763, ack 369, win 512, options [nop,nop,TS val 662037095 ecr 662037095], length 33: IPROTO
	1) [|iproto]
  175  08:05:02.236856 IP (tos 0x0, ttl 64, id 45660, offset 0, flags [DF], proto TCP (6), length 79)
    127.0.0.1.3301 > 127.0.0.1.38784: Flags [P.], seq 27763:27790, ack 369, win 512, options [nop,nop,TS val 662037096 ecr 662037095], length 27: IPROTO
	1) [|iproto]
  176  08:05:02.236865 IP (tos 0x0, ttl 64, id 16835, offset 0, flags [DF], proto TCP (6), length 52)
    127.0.0.1.38784 > 127.0.0.1.3301: Flags [.], cksum 0xfe28 (incorrect -> 0x0d3b), ack 27790, win 512, options [nop,nop,TS val 662037096 ecr 662037095], length 0
  177  08:05:02.236915 IP (tos 0x0, ttl 64, id 19869, offset 0, flags [DF], proto TCP (6), length 94)
    127.0.0.1.3301 > 127.0.0.1.38800: Flags [P.], seq 20511:20553, ack 226, win 512, options [nop,nop,TS val 662037096 ecr 662037095], length 42: IPROTO
	1) [|iproto]
  178  08:05:02.236984 IP (tos 0x0, ttl 64, id 38597, offset 0, flags [DF], proto TCP (6), length 88)
    127.0.0.1.38800 > 127.0.0.1.3301: Flags [P.], seq 226:262, ack 20553, win 512, options [nop,nop,TS val 662037096 ecr 662037096], length 36: IPROTO
	1) [|iproto]
  179  08:05:02.237106 IP (tos 0x0, ttl 64, id 16836, offset 0, flags [DF], proto TCP (6), length 79)
    127.0.0.1.38784 > 127.0.0.1.3301: Flags [P.], seq 369:396, ack 27790, win 512, options [nop,nop,TS val 662037096 ecr 662037095], length 27: IPROTO
	1) [|iproto]
  180  08:05:02.237182 IP (tos 0x0, ttl 64, id 45661, offset 0, flags [DF], proto TCP (6), length 102)
    127.0.0.1.3301 > 127.0.0.1.38784: Flags [P.], seq 27790:27840, ack 396, win 512, options [nop,nop,TS val 662037096 ecr 662037096], length 50: IPROTO
	1) [|iproto]
  181  08:05:02.237191 IP (tos 0x0, ttl 64, id 45662, offset 0, flags [DF], proto TCP (6), length 79)
    127.0.0.1.3301 > 127.0.0.1.38784: Flags [P.], seq 27840:27867, ack 396, win 512, options [nop,nop,TS val 662037096 ecr 662037096], length 27: IPROTO
	1) [|iproto]
  182  08:05:02.237228 IP (tos 0x0, ttl 64, id 16837, offset 0, flags [DF], proto TCP (6), length 52)
    127.0.0.1.38784 > 127.0.0.1.3301: Flags [.], cksum 0xfe28 (incorrect -> 0x0cd2), ack 27867, win 512, options [nop,nop,TS val 662037096 ecr 662037096], length 0
  183  08:05:02.237244 IP (tos 0x0, ttl 64, id 16838, offset 0, flags [DF], proto TCP (6), length 79)
    127.0.0.1.38784 > 127.0.0.1.3301: Flags [P.], seq 396:423, ack 27867, win 512, options [nop,nop,TS val 662037096 ecr 662037096], length 27: IPROTO
	1) [|iproto]
  184  08:05:02.237249 IP (tos 0x0, ttl 64, id 19870, offset 0, flags [DF], proto TCP (6), length 111)
    127.0.0.1.3301 > 127.0.0.1.38800: Flags [P.], seq 20553:20612, ack 262, win 512, options [nop,nop,TS val 662037096 ecr 662037096], length 59: IPROTO
	1) [|iproto]
  185  08:05:02.237270 IP (tos 0x0, ttl 64, id 38598, offset 0, flags [DF], proto TCP (6), length 86)
    127.0.0.1.38800 > 127.0.0.1.3301: Flags [P.], seq 262:296, ack 20612, win 512, options [nop,nop,TS val 662037096 ecr 662037096], length 34: IPROTO
	1) [|iproto]
  186  08:05:02.237305 IP (tos 0x0, ttl 64, id 45663, offset 0, flags [DF], proto TCP (6), length 100)
    127.0.0.1.3301 > 127.0.0.1.38784: Flags [P.], seq 27867:27915, ack 423, win 512, options [nop,nop,TS val 662037096 ecr 662037096], length 48: IPROTO
	1) [|iproto]
  187  08:05:02.237310 IP (tos 0x0, ttl 64, id 45664, offset 0, flags [DF], proto TCP (6), length 79)
    127.0.0.1.3301 > 127.0.0.1.38784: Flags [P.], seq 27915:27942, ack 423, win 512, options [nop,nop,TS val 662037096 ecr 662037096], length 27: IPROTO
	1) [|iproto]
  188  08:05:02.237335 IP (tos 0x0, ttl 64, id 16839, offset 0, flags [DF], proto TCP (6), length 52)
    127.0.0.1.38784 > 127.0.0.1.3301: Flags [.], cksum 0xfe28 (incorrect -> 0x0c6c), ack 27942, win 512, options [nop,nop,TS val 662037096 ecr 662037096], length 0
  189  08:05:02.237345 IP (tos 0x0, ttl 64, id 16840, offset 0, flags [DF], proto TCP (6), length 79)
    127.0.0.1.38784 > 127.0.0.1.3301: Flags [P.], seq 423:450, ack 27942, win 512, options [nop,nop,TS val 662037096 ecr 662037096], length 27: IPROTO
	1) [|iproto]
  190  08:05:02.237370 IP (tos 0x0, ttl 64, id 16841, offset 0, flags [DF], proto TCP (6), length 79)
    127.0.0.1.38784 > 127.0.0.1.3301: Flags [P.], seq 450:477, ack 27942, win 512, options [nop,nop,TS val 662037096 ecr 662037096], length 27: IPROTO
	1) [|iproto]
  191  08:05:02.237374 IP (tos 0x0, ttl 64, id 45665, offset 0, flags [DF], proto TCP (6), length 52)
    127.0.0.1.3301 > 127.0.0.1.38784: Flags [.], cksum 0xfe28 (incorrect -> 0x0c36), ack 477, win 512, options [nop,nop,TS val 662037096 ecr 662037096], length 0
  192  08:05:02.237383 IP (tos 0x0, ttl 64, id 19871, offset 0, flags [DF], proto TCP (6), length 109)
    127.0.0.1.3301 > 127.0.0.1.38800: Flags [P.], seq 20612:20669, ack 296, win 512, options [nop,nop,TS val 662037096 ecr 662037096], length 57: IPROTO
	1) [|iproto]
  193  08:05:02.237396 IP (tos 0x0, ttl 64, id 38599, offset 0, flags [DF], proto TCP (6), length 91)
    127.0.0.1.38800 > 127.0.0.1.3301: Flags [P.], seq 296:335, ack 20669, win 512, options [nop,nop,TS val 662037096 ecr 662037096], length 39: IPROTO
	1) [|iproto]
  194  08:05:02.237426 IP (tos 0x0, ttl 64, id 45666, offset 0, flags [DF], proto TCP (6), length 105)
    127.0.0.1.3301 > 127.0.0.1.38784: Flags [P.], seq 27942:27995, ack 477, win 512, options [nop,nop,TS val 662037096 ecr 662037096], length 53: IPROTO
	1) [|iproto]
  195  08:05:02.237431 IP (tos 0x0, ttl 64, id 45667, offset 0, flags [DF], proto TCP (6), length 79)
    127.0.0.1.3301 > 127.0.0.1.38784: Flags [P.], seq 27995:28022, ack 477, win 512, options [nop,nop,TS val 662037096 ecr 662037096], length 27: IPROTO
	1) [|iproto]
  196  08:05:02.237437 IP (tos 0x0, ttl 64, id 19872, offset 0, flags [DF], proto TCP (6), length 114)
    127.0.0.1.3301 > 127.0.0.1.38800: Flags [P.], seq 20669:20731, ack 335, win 512, options [nop,nop,TS val 662037096 ecr 662037096], length 62: IPROTO
	1) [|iproto]
  197  08:05:02.237454 IP (tos 0x0, ttl 64, id 16842, offset 0, flags [DF], proto TCP (6), length 52)
    127.0.0.1.38784 > 127.0.0.1.3301: Flags [.], cksum 0xfe28 (incorrect -> 0x0be6), ack 28022, win 512, options [nop,nop,TS val 662037096 ecr 662037096], length 0
  198  08:05:02.237464 IP (tos 0x0, ttl 64, id 16843, offset 0, flags [DF], proto TCP (6), length 79)
    127.0.0.1.38784 > 127.0.0.1.3301: Flags [P.], seq 477:504, ack 28022, win 512, options [nop,nop,TS val 662037096 ecr 662037096], length 27: IPROTO
	1) [|iproto]
  199  08:05:02.237478 IP (tos 0x0, ttl 64, id 16844, offset 0, flags [DF], proto TCP (6), length 79)
    127.0.0.1.38784 > 127.0.0.1.3301: Flags [P.], seq 504:531, ack 28022, win 512, options [nop,nop,TS val 662037096 ecr 662037096], length 27: IPROTO
	1) [|iproto]
  200  08:05:02.237485 IP (tos 0x0, ttl 64, id 38600, offset 0, flags [DF], proto TCP (6), length 88)
    127.0.0.1.38800 > 127.0.0.1.3301: Flags [P.], seq 335:371, ack 20731, win 512, options [nop,nop,TS val 662037096 ecr 662037096], length 36: IPROTO
	1) [|iproto]
  201  08:05:02.237485 IP (tos 0x0, ttl 64, id 45668, offset 0, flags [DF], proto TCP (6), length 52)
    127.0.0.1.3301 > 127.0.0.1.38784: Flags [.], cksum 0xfe28 (incorrect -> 0x0bb0), ack 531, win 512, options [nop,nop,TS val 662037096 ecr 662037096], length 0
  202  08:05:02.237490 IP (tos 0x0, ttl 64, id 16845, offset 0, flags [DF], proto TCP (6), length 79)
    127.0.0.1.38784 > 127.0.0.1.3301: Flags [P.], seq 531:558, ack 28022, win 512, options [nop,nop,TS val 662037096 ecr 662037096], length 27: IPROTO
	1) [|iproto]
  203  08:05:02.237494 IP (tos 0x0, ttl 64, id 16846, offset 0, flags [DF], proto TCP (6), length 79)
    127.0.0.1.38784 > 127.0.0.1.3301: Flags [P.], seq 558:585, ack 28022, win 512, options [nop,nop,TS val 662037096 ecr 662037096], length 27: IPROTO
	1) [|iproto]
  204  08:05:02.237497 IP (tos 0x0, ttl 64, id 45669, offset 0, flags [DF], proto TCP (6), length 52)
    127.0.0.1.3301 > 127.0.0.1.38784: Flags [.], cksum 0xfe28 (incorrect -> 0x0b7a), ack 585, win 512, options [nop,nop,TS val 662037096 ecr 662037096], length 0
  205  08:05:02.237506 IP (tos 0x0, ttl 64, id 45670, offset 0, flags [DF], proto TCP (6), length 102)
    127.0.0.1.3301 > 127.0.0.1.38784: Flags [P.], seq 28022:28072, ack 585, win 512, options [nop,nop,TS val 662037096 ecr 662037096], length 50: IPROTO
	1) [|iproto]
  206  08:05:02.237511 IP (tos 0x0, ttl 64, id 45671, offset 0, flags [DF], proto TCP (6), length 79)
    127.0.0.1.3301 > 127.0.0.1.38784: Flags [P.], seq 28072:28099, ack 585, win 512, options [nop,nop,TS val 662037096 ecr 662037096], length 27: IPROTO
	1) [|iproto]
  207  08:05:02.237519 IP (tos 0x0, ttl 64, id 19873, offset 0, flags [DF], proto TCP (6), length 111)
    127.0.0.1.3301 > 127.0.0.1.38800: Flags [P.], seq 20731:20790, ack 371, win 512, options [nop,nop,TS val 662037096 ecr 662037096], length 59: IPROTO
	1) [|iproto]
  208  08:05:02.237530 IP (tos 0x0, ttl 64, id 38601, offset 0, flags [DF], proto TCP (6), length 78)
    127.0.0.1.38800 > 127.0.0.1.3301: Flags [P.], seq 371:397, ack 20790, win 512, options [nop,nop,TS val 662037096 ecr 662037096], length 26: IPROTO
	1) [|iproto]
  209  08:05:02.237546 IP (tos 0x0, ttl 64, id 19874, offset 0, flags [DF], proto TCP (6), length 94)
    127.0.0.1.3301 > 127.0.0.1.38800: Flags [P.], seq 20790:20832, ack 397, win 512, options [nop,nop,TS val 662037096 ecr 662037096], length 42: IPROTO
	1) [|iproto]
  210  08:05:02.237569 IP (tos 0x0, ttl 64, id 38602, offset 0, flags [DF], proto TCP (6), length 81)
    127.0.0.1.38800 > 127.0.0.1.3301: Flags [P.], seq 397:426, ack 20832, win 512, options [nop,nop,TS val 662037096 ecr 662037096], length 29: IPROTO
	1) [|iproto]
  211  08:05:02.237581 IP (tos 0x0, ttl 64, id 16847, offset 0, flags [DF], proto TCP (6), length 52)
    127.0.0.1.38784 > 127.0.0.1.3301: Flags [.], cksum 0xfe28 (incorrect -> 0x0b2d), ack 28099, win 512, options [nop,nop,TS val 662037096 ecr 662037096], length 0
  212  08:05:02.237581 IP (tos 0x0, ttl 64, id 19875, offset 0, flags [DF], proto TCP (6), length 181)
    127.0.0.1.3301 > 127.0.0.1.38800: Flags [P.], seq 20832:20961, ack 426, win 512, options [nop,nop,TS val 662037096 ecr 662037096], length 129: IPROTO
	1) [|iproto]
  213  08:05:02.237593 IP (tos 0x0, ttl 64, id 38603, offset 0, flags [DF], proto TCP (6), length 73)
    127.0.0.1.38800 > 127.0.0.1.3301: Flags [P.], cksum 0xfe3d (incorrect -> 0xa4ab), seq 426:447, ack 20961, win 512, options [nop,nop,TS val 662037096 ecr 662037096], length 21: IPROTO
	1) size 21: request: REPLACE, SYNC: 16
	SPACE_ID: 512
	TUPLE: [5, 6, 7, 8]
  214  08:05:02.237617 IP (tos 0x0, ttl 64, id 45672, offset 0, flags [DF], proto TCP (6), length 87)
    127.0.0.1.3301 > 127.0.0.1.38784: Flags [P.], seq 28099:28134, ack 585, win 512, options [nop,nop,TS val 662037096 ecr 662037096], length 35: IPROTO
	1) [|iproto]
  215  08:05:02.237623 IP (tos 0x0, ttl 64, id 45673, offset 0, flags [DF], proto TCP (6), length 79)
    127.0.0.1.3301 > 127.0.0.1.38784: Flags [P.], seq 28134:28161, ack 585, win 512, options [nop,nop,TS val 662037096 ecr 662037096], length 27: IPROTO
	1) [|iproto]
  216  08:05:02.237628 IP (tos 0x0, ttl 64, id 19876, offset 0, flags [DF], proto TCP (6), length 96)
    127.0.0.1.3301 > 127.0.0.1.38800: Flags [P.], seq 20961:21005, ack 447, win 512, options [nop,nop,TS val 662037096 ecr 662037096], length 44: IPROTO
	1) [|iproto]
  217  08:05:02.237654 IP (tos 0x0, ttl 64, id 38604, offset 0, flags [DF], proto TCP (6), length 81)
    127.0.0.1.38800 > 127.0.0.1.3301: Flags [P.], seq 447:476, ack 21005, win 512, options [nop,nop,TS val 662037096 ecr 662037096], length 29: IPROTO
	1) [|iproto]
  218  08:05:02.237669 IP (tos 0x0, ttl 64, id 16848, offset 0, flags [DF], proto TCP (6), length 52)
    127.0.0.1.38784 > 127.0.0.1.3301: Flags [.], cksum 0xfe28 (incorrect -> 0x0aef), ack 28161, win 512, options [nop,nop,TS val 662037096 ecr 662037096], length 0
  219  08:05:02.237678 IP (tos 0x0, ttl 64, id 45674, offset 0, flags [DF], proto TCP (6), length 93)
    127.0.0.1.3301 > 127.0.0.1.38784: Flags [P.], seq 28161:28202, ack 585, win 512, options [nop,nop,TS val 662037096 ecr 662037096], length 41: IPROTO
	1) [|iproto]
  220  08:05:02.237683 IP (tos 0x0, ttl 64, id 16849, offset 0, flags [DF], proto TCP (6), length 79)
    127.0.0.1.38784 > 127.0.0.1.3301: Flags [P.], seq 585:612, ack 28202, win 512, options [nop,nop,TS val 662037096 ecr 662037096], length 27: IPROTO
	1) [|iproto]
  221  08:05:02.237683 IP (tos 0x0, ttl 64, id 45675, offset 0, flags [DF], proto TCP (6), length 79)
    127.0.0.1.3301 > 127.0.0.1.38784: Flags [P.], seq 28202:28229, ack 585, win 512, options [nop,nop,TS val 662037096 ecr 662037096], length 27: IPROTO
	1) [|iproto]
  222  08:05:02.237686 IP (tos 0x0, ttl 64, id 19877, offset 0, flags [DF], proto TCP (6), length 94)
    127.0.0.1.3301 > 127.0.0.1.38800: Flags [P.], seq 21005:21047, ack 476, win 512, options [nop,nop,TS val 662037096 ecr 662037096], length 42: IPROTO
	1) [|iproto]
  223  08:05:02.237698 IP (tos 0x0, ttl 64, id 38605, offset 0, flags [DF], proto TCP (6), length 88)
    127.0.0.1.38800 > 127.0.0.1.3301: Flags [P.], seq 476:512, ack 21047, win 512, options [nop,nop,TS val 662037096 ecr 662037096], length 36: IPROTO
	1) [|iproto]
  224  08:05:02.237702 IP (tos 0x0, ttl 64, id 16850, offset 0, flags [DF], proto TCP (6), length 79)
    127.0.0.1.38784 > 127.0.0.1.3301: Flags [P.], seq 612:639, ack 28229, win 512, options [nop,nop,TS val 662037096 ecr 662037096], length 27: IPROTO
	1) [|iproto]
  225  08:05:02.237707 IP (tos 0x0, ttl 64, id 16851, offset 0, flags [DF], proto TCP (6), length 79)
    127.0.0.1.38784 > 127.0.0.1.3301: Flags [P.], seq 639:666, ack 28229, win 512, options [nop,nop,TS val 662037096 ecr 662037096], length 27: IPROTO
	1) [|iproto]
  226  08:05:02.237708 IP (tos 0x0, ttl 64, id 45676, offset 0, flags [DF], proto TCP (6), length 52)
    127.0.0.1.3301 > 127.0.0.1.38784: Flags [.], cksum 0xfe28 (incorrect -> 0x0a75), ack 639, win 512, options [nop,nop,TS val 662037096 ecr 662037096], length 0
  227  08:05:02.237723 IP (tos 0x0, ttl 64, id 45677, offset 0, flags [DF], proto TCP (6), length 102)
    127.0.0.1.3301 > 127.0.0.1.38784: Flags [P.], seq 28229:28279, ack 666, win 512, options [nop,nop,TS val 662037096 ecr 662037096], length 50: IPROTO
	1) [|iproto]
  228  08:05:02.237727 IP (tos 0x0, ttl 64, id 45678, offset 0, flags [DF], proto TCP (6), length 79)
    127.0.0.1.3301 > 127.0.0.1.38784: Flags [P.], seq 28279:28306, ack 666, win 512, options [nop,nop,TS val 662037096 ecr 662037096], length 27: IPROTO
	1) [|iproto]
  229  08:05:02.237735 IP (tos 0x0, ttl 64, id 19878, offset 0, flags [DF], proto TCP (6), length 91)
    127.0.0.1.3301 > 127.0.0.1.38800: Flags [P.], seq 21047:21086, ack 512, win 512, options [nop,nop,TS val 662037096 ecr 662037096], length 39: IPROTO
	1) [|iproto]
  230  08:05:02.237748 IP (tos 0x0, ttl 64, id 38606, offset 0, flags [DF], proto TCP (6), length 72)
    127.0.0.1.38800 > 127.0.0.1.3301: Flags [P.], cksum 0xfe3c (incorrect -> 0xb4cf), seq 512:532, ack 21086, win 512, options [nop,nop,TS val 662037096 ecr 662037096], length 20: IPROTO
	1) size 20: request: DELETE, SYNC: 19
	SPACE_ID: 512
	INDEX_ID: 0
	KEY: [1]
  231  08:05:02.237780 IP (tos 0x0, ttl 64, id 45679, offset 0, flags [DF], proto TCP (6), length 84)
    127.0.0.1.3301 > 127.0.0.1.38784: Flags [P.], seq 28306:28338, ack 666, win 512, options [nop,nop,TS val 662037096 ecr 662037096], length 32: IPROTO
	1) [|iproto]
  232  08:05:02.237785 IP (tos 0x0, ttl 64, id 45680, offset 0, flags [DF], proto TCP (6), length 79)
    127.0.0.1.3301 > 127.0.0.1.38784: Flags [P.], seq 28338:28365, ack 666, win 512, options [nop,nop,TS val 662037096 ecr 662037096], length 27: IPROTO
	1) [|iproto]
  233  08:05:02.237785 IP (tos 0x0, ttl 64, id 16852, offset 0, flags [DF], proto TCP (6), length 52)
    127.0.0.1.38784 > 127.0.0.1.3301: Flags [.], cksum 0xfe28 (incorrect -> 0x0a0d), ack 28306, win 512, options [nop,nop,TS val 662037096 ecr 662037096], length 0
  234  08:05:02.237789 IP (tos 0x0, ttl 64, id 19879, offset 0, flags [DF], proto TCP (6), length 94)
    127.0.0.1.3301 > 127.0.0.1.38800: Flags [P.], seq 21086:21128, ack 532, win 512, options [nop,nop,TS val 662037096 ecr 662037096], length 42: IPROTO
	1) [|iproto]
  235  08:05:02.237794 IP (tos 0x0, ttl 64, id 16853, offset 0, flags [DF], proto TCP (6), length 52)
    127.0.0.1.38784 > 127.0.0.1.3301: Flags [.], cksum 0xfe28 (incorrect -> 0x09d2), ack 28365, win 512, options [nop,nop,TS val 662037096 ecr 662037096], length 0
  236  08:05:02.237800 IP (tos 0x0, ttl 64, id 16854, offset 0, flags [DF], proto TCP (6), length 79)
    127.0.0.1.38784 > 127.0.0.1.3301: Flags [P.], seq 666:693, ack 28365, win 512, options [nop,nop,TS val 662037096 ecr 662037096], length 27: IPROTO
	1) [|iproto]
  237  08:05:02.237814 IP (tos 0x0, ttl 64, id 16855, offset 0, flags [DF], proto TCP (6), length 79)
    127.0.0.1.38784 > 127.0.0.1.3301: Flags [P.], seq 693:720, ack 28365, win 512, options [nop,nop,TS val 662037096 ecr 662037096], length 27: IPROTO
	1) [|iproto]
  238  08:05:02.237819 IP (tos 0x0, ttl 64, id 45681, offset 0, flags [DF], proto TCP (6), length 52)
    127.0.0.1.3301 > 127.0.0.1.38784: Flags [.], cksum 0xfe28 (incorrect -> 0x099c), ack 720, win 512, options [nop,nop,TS val 662037096 ecr 662037096], length 0
  239  08:05:02.237824 IP (tos 0x0, ttl 64, id 16856, offset 0, flags [DF], proto TCP (6), length 79)
    127.0.0.1.38784 > 127.0.0.1.3301: Flags [P.], seq 720:747, ack 28365, win 512, options [nop,nop,TS val 662037096 ecr 662037096], length 27: IPROTO
	1) [|iproto]
  240  08:05:02.237829 IP (tos 0x0, ttl 64, id 16857, offset 0, flags [DF], proto TCP (6), length 79)
    127.0.0.1.38784 > 127.0.0.1.3301: Flags [P.], seq 747:774, ack 28365, win 512, options [nop,nop,TS val 662037096 ecr 662037096], length 27: IPROTO
	1) [|iproto]
  241  08:05:02.237833 IP (tos 0x0, ttl 64, id 16858, offset 0, flags [DF], proto TCP (6), length 79)
    127.0.0.1.38784 > 127.0.0.1.3301: Flags [P.], seq 774:801, ack 28365, win 512, options [nop,nop,TS val 662037096 ecr 662037096], length 27: IPROTO
	1) [|iproto]
  242  08:05:02.237836 IP (tos 0x0, ttl 64, id 45682, offset 0, flags [DF], proto TCP (6), length 52)
    127.0.0.1.3301 > 127.0.0.1.38784: Flags [.], cksum 0xfe28 (incorrect -> 0x094b), ack 801, win 512, options [nop,nop,TS val 662037096 ecr 662037096], length 0
  243  08:05:02.237842 IP (tos 0x0, ttl 64, id 16859, offset 0, flags [DF], proto TCP (6), length 79)
    127.0.0.1.38784 > 127.0.0.1.3301: Flags [P.], seq 801:828, ack 28365, win 512, options [nop,nop,TS val 662037096 ecr 662037096], length 27: IPROTO
	1) [|iproto]
  244  08:05:02.237853 IP (tos 0x0, ttl 64, id 38607, offset 0, flags [DF], proto TCP (6), length 72)
    127.0.0.1.38800 > 127.0.0.1.3301: Flags [P.], cksum 0xfe3c (incorrect -> 0xb48e), seq 532:552, ack 21128, win 512, options [nop,nop,TS val 662037097 ecr 662037096], length 20: IPROTO
	1) size 20: request: DELETE, SYNC: 20
	SPACE_ID: 512
	INDEX_ID: 0
	KEY: [2]
  245  08:05:02.237880 IP (tos 0x0, ttl 64, id 45683, offset 0, flags [DF], proto TCP (6), length 84)
    127.0.0.1.3301 > 127.0.0.1.38784: Flags [P.], seq 28365:28397, ack 828, win 512, options [nop,nop,TS val 662037097 ecr 662037096], length 32: IPROTO
	1) [|iproto]
  246  08:05:02.237886 IP (tos 0x0, ttl 64, id 45684, offset 0, flags [DF], proto TCP (6), length 79)
    127.0.0.1.3301 > 127.0.0.1.38784: Flags [P.], seq 28397:28424, ack 828, win 512, options [nop,nop,TS val 662037097 ecr 662037096], length 27: IPROTO
	1) [|iproto]
  247  08:05:02.237889 IP (tos 0x0, ttl 64, id 19880, offset 0, flags [DF], proto TCP (6), length 94)
    127.0.0.1.3301 > 127.0.0.1.38800: Flags [P.], seq 21128:21170, ack 552, win 512, options [nop,nop,TS val 662037097 ecr 662037097], length 42: IPROTO
	1) [|iproto]
  248  08:05:02.237892 IP (tos 0x0, ttl 64, id 16860, offset 0, flags [DF], proto TCP (6), length 52)
    127.0.0.1.38784 > 127.0.0.1.3301: Flags [.], cksum 0xfe28 (incorrect -> 0x08f3), ack 28424, win 512, options [nop,nop,TS val 662037097 ecr 662037097], length 0
  249  08:05:02.237907 IP (tos 0x0, ttl 64, id 16861, offset 0, flags [DF], proto TCP (6), length 79)
    127.0.0.1.38784 > 127.0.0.1.3301: Flags [P.], seq 828:855, ack 28424, win 512, options [nop,nop,TS val 662037097 ecr 662037097], length 27: IPROTO
	1) [|iproto]
  250  08:05:02.237911 IP (tos 0x0, ttl 64, id 38608, offset 0, flags [DF], proto TCP (6), length 72)
    127.0.0.1.38800 > 127.0.0.1.3301: Flags [P.], cksum 0xfe3c (incorrect -> 0xb44d), seq 552:572, ack 21170, win 512, options [nop,nop,TS val 662037097 ecr 662037097], length 20: IPROTO
	1) size 20: request: DELETE, SYNC: 21
	SPACE_ID: 512
	INDEX_ID: 0
	KEY: [3]
  251  08:05:02.237912 IP (tos 0x0, ttl 64, id 16862, offset 0, flags [DF], proto TCP (6), length 79)
    127.0.0.1.38784 > 127.0.0.1.3301: Flags [P.], seq 855:882, ack 28424, win 512, options [nop,nop,TS val 662037097 ecr 662037097], length 27: IPROTO
	1) [|iproto]
  252  08:05:02.237916 IP (tos 0x0, ttl 64, id 45685, offset 0, flags [DF], proto TCP (6), length 52)
    127.0.0.1.3301 > 127.0.0.1.38784: Flags [.], cksum 0xfe28 (incorrect -> 0x08bd), ack 882, win 512, options [nop,nop,TS val 662037097 ecr 662037097], length 0
  253  08:05:02.237935 IP (tos 0x0, ttl 64, id 45686, offset 0, flags [DF], proto TCP (6), length 84)
    127.0.0.1.3301 > 127.0.0.1.38784: Flags [P.], seq 28424:28456, ack 882, win 512, options [nop,nop,TS val 662037097 ecr 662037097], length 32: IPROTO
	1) [|iproto]
  254  08:05:02.237940 IP (tos 0x0, ttl 64, id 45687, offset 0, flags [DF], proto TCP (6), length 79)
    127.0.0.1.3301 > 127.0.0.1.38784: Flags [P.], seq 28456:28483, ack 882, win 512, options [nop,nop,TS val 662037097 ecr 662037097], length 27: IPROTO
	1) [|iproto]
  255  08:05:02.237944 IP (tos 0x0, ttl 64, id 19881, offset 0, flags [DF], proto TCP (6), length 94)
    127.0.0.1.3301 > 127.0.0.1.38800: Flags [P.], seq 21170:21212, ack 572, win 512, options [nop,nop,TS val 662037097 ecr 662037097], length 42: IPROTO
	1) [|iproto]
  256  08:05:02.237944 IP (tos 0x0, ttl 64, id 16863, offset 0, flags [DF], proto TCP (6), length 52)
    127.0.0.1.38784 > 127.0.0.1.3301: Flags [.], cksum 0xfe28 (incorrect -> 0x0882), ack 28483, win 512, options [nop,nop,TS val 662037097 ecr 662037097], length 0
  257  08:05:02.237956 IP (tos 0x0, ttl 64, id 16864, offset 0, flags [DF], proto TCP (6), length 79)
    127.0.0.1.38784 > 127.0.0.1.3301: Flags [P.], seq 882:909, ack 28483, win 512, options [nop,nop,TS val 662037097 ecr 662037097], length 27: IPROTO
	1) [|iproto]
  258  08:05:02.237956 IP (tos 0x0, ttl 64, id 38609, offset 0, flags [DF], proto TCP (6), length 112)
    127.0.0.1.38800 > 127.0.0.1.3301: Flags [P.], seq 572:632, ack 21212, win 512, options [nop,nop,TS val 662037097 ecr 662037097], length 60: IPROTO
	1) [|iproto]
  259  08:05:02.237964 IP (tos 0x0, ttl 64, id 16865, offset 0, flags [DF], proto TCP (6), length 79)
    127.0.0.1.38784 > 127.0.0.1.3301: Flags [P.], seq 909:936, ack 28483, win 512, options [nop,nop,TS val 662037097 ecr 662037097], length 27: IPROTO
	1) [|iproto]
  260  08:05:02.237969 IP (tos 0x0, ttl 64, id 45688, offset 0, flags [DF], proto TCP (6), length 52)
    127.0.0.1.3301 > 127.0.0.1.38784: Flags [.], cksum 0xfe28 (incorrect -> 0x084c), ack 936, win 512, options [nop,nop,TS val 662037097 ecr 662037097], length 0
  261  08:05:02.237983 IP (tos 0x0, ttl 64, id 19882, offset 0, flags [DF], proto TCP (6), length 92)
    127.0.0.1.3301 > 127.0.0.1.38800: Flags [P.], seq 21212:21252, ack 632, win 512, options [nop,nop,TS val 662037097 ecr 662037097], length 40: IPROTO
	1) [|iproto]
  262  08:05:02.237992 IP (tos 0x0, ttl 64, id 38610, offset 0, flags [DF], proto TCP (6), length 83)
    127.0.0.1.38800 > 127.0.0.1.3301: Flags [P.], seq 632:663, ack 21252, win 512, options [nop,nop,TS val 662037097 ecr 662037097], length 31: IPROTO
	1) [|iproto]
  263  08:05:02.238007 IP (tos 0x0, ttl 64, id 19883, offset 0, flags [DF], proto TCP (6), length 97)
    127.0.0.1.3301 > 127.0.0.1.38800: Flags [P.], seq 21252:21297, ack 663, win 512, options [nop,nop,TS val 662037097 ecr 662037097], length 45: IPROTO
	1) [|iproto]
  264  08:05:02.238021 IP (tos 0x0, ttl 64, id 38611, offset 0, flags [DF], proto TCP (6), length 98)
    127.0.0.1.38800 > 127.0.0.1.3301: Flags [P.], seq 663:709, ack 21297, win 512, options [nop,nop,TS val 662037097 ecr 662037097], length 46: IPROTO
	1) [|iproto]
  265  08:05:02.238035 IP (tos 0x0, ttl 64, id 19884, offset 0, flags [DF], proto TCP (6), length 91)
    127.0.0.1.3301 > 127.0.0.1.38800: Flags [P.], seq 21297:21336, ack 709, win 512, options [nop,nop,TS val 662037097 ecr 662037097], length 39: IPROTO
	1) [|iproto]
  266  08:05:02.238043 IP (tos 0x0, ttl 64, id 38612, offset 0, flags [DF], proto TCP (6), length 69)
    127.0.0.1.38800 > 127.0.0.1.3301: Flags [P.], cksum 0xfe39 (incorrect -> 0xb1a1), seq 709:726, ack 21336, win 512, options [nop,nop,TS val 662037097 ecr 662037097], length 17: IPROTO
	1) size 17: request: CALL, SYNC: 25
	FUNCTION_NAME: f1
	TUPLE: []
  267  08:05:02.238055 IP (tos 0x0, ttl 64, id 19885, offset 0, flags [DF], proto TCP (6), length 92)
    127.0.0.1.3301 > 127.0.0.1.38800: Flags [P.], seq 21336:21376, ack 726, win 512, options [nop,nop,TS val 662037097 ecr 662037097], length 40: IPROTO
	1) [|iproto]
  268  08:05:02.238062 IP (tos 0x0, ttl 64, id 38613, offset 0, flags [DF], proto TCP (6), length 102)
    127.0.0.1.38800 > 127.0.0.1.3301: Flags [P.], seq 726:776, ack 21376, win 512, options [nop,nop,TS val 662037097 ecr 662037097], length 50: IPROTO
	1) [|iproto]
  269  08:05:02.238076 IP (tos 0x0, ttl 64, id 19886, offset 0, flags [DF], proto TCP (6), length 91)
    127.0.0.1.3301 > 127.0.0.1.38800: Flags [P.], seq 21376:21415, ack 776, win 512, options [nop,nop,TS val 662037097 ecr 662037097], length 39: IPROTO
	1) [|iproto]
  270  08:05:02.238083 IP (tos 0x0, ttl 64, id 38614, offset 0, flags [DF], proto TCP (6), length 72)
    127.0.0.1.38800 > 127.0.0.1.3301: Flags [P.], cksum 0xfe3c (incorrect -> 0x09c7), seq 776:796, ack 21415, win 512, options [nop,nop,TS val 662037097 ecr 662037097], length 20: IPROTO
	1) size 20: request: CALL, SYNC: 27
	FUNCTION_NAME: f2
	TUPLE: [1, "B"]
  271  08:05:02.238095 IP (tos 0x0, ttl 64, id 19887, offset 0, flags [DF], proto TCP (6), length 94)
    127.0.0.1.3301 > 127.0.0.1.38800: Flags [P.], seq 21415:21457, ack 796, win 512, options [nop,nop,TS val 662037097 ecr 662037097], length 42: IPROTO
	1) [|iproto]
  272  08:05:02.238102 IP (tos 0x0, ttl 64, id 38615, offset 0, flags [DF], proto TCP (6), length 79)
    127.0.0.1.38800 > 127.0.0.1.3301: Flags [P.], seq 796:823, ack 21457, win 512, options [nop,nop,TS val 662037097 ecr 662037097], length 27: IPROTO
	1) [|iproto]
  273  08:05:02.238144 IP (tos 0x0, ttl 64, id 19888, offset 0, flags [DF], proto TCP (6), length 155)
    127.0.0.1.3301 > 127.0.0.1.38800: Flags [P.], seq 21457:21560, ack 823, win 512, options [nop,nop,TS val 662037097 ecr 662037097], length 103: IPROTO
	1) [|iproto]
  274  08:05:02.238155 IP (tos 0x0, ttl 64, id 38616, offset 0, flags [DF], proto TCP (6), length 76)
    127.0.0.1.38800 > 127.0.0.1.3301: Flags [P.], seq 823:847, ack 21560, win 512, options [nop,nop,TS val 662037097 ecr 662037097], length 24: IPROTO
	1) [|iproto]
  275  08:05:02.238172 IP (tos 0x0, ttl 64, id 19889, offset 0, flags [DF], proto TCP (6), length 130)
    127.0.0.1.3301 > 127.0.0.1.38800: Flags [P.], seq 21560:21638, ack 847, win 512, options [nop,nop,TS val 662037097 ecr 662037097], length 78: IPROTO
	1) [|iproto]
  276  08:05:02.238182 IP (tos 0x0, ttl 64, id 38617, offset 0, flags [DF], proto TCP (6), length 64)
    127.0.0.1.38800 > 127.0.0.1.3301: Flags [P.], cksum 0xfe34 (incorrect -> 0x908e), seq 847:859, ack 21638, win 512, options [nop,nop,TS val 662037097 ecr 662037097], length 12: IPROTO
	1) size 12: request: BEGIN, STREAM_ID: 1, SYNC: 30
  277  08:05:02.238198 IP (tos 0x0, ttl 64, id 19890, offset 0, flags [DF], proto TCP (6), length 85)
    127.0.0.1.3301 > 127.0.0.1.38800: Flags [P.], seq 21638:21671, ack 859, win 512, options [nop,nop,TS val 662037097 ecr 662037097], length 33: IPROTO
	1) [|iproto]
  278  08:05:02.238205 IP (tos 0x0, ttl 64, id 38618, offset 0, flags [DF], proto TCP (6), length 64)
    127.0.0.1.38800 > 127.0.0.1.3301: Flags [P.], cksum 0xfe34 (incorrect -> 0x905e), seq 859:871, ack 21671, win 512, options [nop,nop,TS val 662037097 ecr 662037097], length 12: IPROTO
	1) size 12: request: ROLLBACK, STREAM_ID: 1, SYNC: 31
  279  08:05:02.238216 IP (tos 0x0, ttl 64, id 19891, offset 0, flags [DF], proto TCP (6), length 85)
    127.0.0.1.3301 > 127.0.0.1.38800: Flags [P.], seq 21671:21704, ack 871, win 512, options [nop,nop,TS val 662037097 ecr 662037097], length 33: IPROTO
	1) [|iproto]
  280  08:05:02.238223 IP (tos 0x0, ttl 64, id 38619, offset 0, flags [DF], proto TCP (6), length 64)
    127.0.0.1.38800 > 127.0.0.1.3301: Flags [P.], cksum 0xfe34 (incorrect -> 0x9031), seq 871:883, ack 21704, win 512, options [nop,nop,TS val 662037097 ecr 662037097], length 12: IPROTO
	1) size 12: request: COMMIT, STREAM_ID: 1, SYNC: 32
  281  08:05:02.238233 IP (tos 0x0, ttl 64, id 19892, offset 0, flags [DF], proto TCP (6), length 85)
    127.0.0.1.3301 > 127.0.0.1.38800: Flags [P.], seq 21704:21737, ack 883, win 512, options [nop,nop,TS val 662037097 ecr 662037097], length 33: IPROTO
	1) [|iproto]
  282  08:05:02.238265 IP (tos 0x0, ttl 64, id 38620, offset 0, flags [DF], proto TCP (6), length 52)
    127.0.0.1.38800 > 127.0.0.1.3301: Flags [F.], cksum 0xfe28 (incorrect -> 0x70cb), seq 883, ack 21737, win 512, options [nop,nop,TS val 662037097 ecr 662037097], length 0
  283  08:05:02.238272 IP (tos 0x0, ttl 64, id 19893, offset 0, flags [DF], proto TCP (6), length 52)
    127.0.0.1.3301 > 127.0.0.1.38800: Flags [F.], cksum 0xfe28 (incorrect -> 0x70ca), seq 21737, ack 884, win 512, options [nop,nop,TS val 662037097 ecr 662037097], length 0
  284  08:05:02.238278 IP (tos 0x0, ttl 64, id 38621, offset 0, flags [DF], proto TCP (6), length 52)
    127.0.0.1.38800 > 127.0.0.1.3301: Flags [.], cksum 0xfe28 (incorrect -> 0x70ca), ack 21738, win 512, options [nop,nop,TS val 662037097 ecr 662037097], length 0
  285  08:05:02.239347 IP (tos 0x0, ttl 64, id 16866, offset 0, flags [DF], proto TCP (6), length 52)
    127.0.0.1.38784 > 127.0.0.1.3301: Flags [F.], cksum 0xfe28 (incorrect -> 0x084a), seq 936, ack 28483, win 512, options [nop,nop,TS val 662037098 ecr 662037097], length 0
  286  08:05:02.239502 IP (tos 0x0, ttl 64, id 45689, offset 0, flags [DF], proto TCP (6), length 52)
    127.0.0.1.3301 > 127.0.0.1.38784: Flags [F.], cksum 0xfe28 (incorrect -> 0x0848), seq 28483, ack 937, win 512, options [nop,nop,TS val 662037098 ecr 662037098], length 0
  287  08:05:02.239505 IP (tos 0x0, ttl 64, id 16867, offset 0, flags [DF], proto TCP (6), length 52)
    127.0.0.1.38784 > 127.0.0.1.3301: Flags [.], cksum 0xfe28 (incorrect -> 0x0848), ack 28484, win 512, options [nop,nop,TS val 662037098 ecr 662037098], length 0
