    1  08:46:29.784434 IP 172.16.10.62.42836 > 93.184.216.34.443: Flags [S], seq 4032104602, win 64240, options [mss 1460,sackOK,TS val 349023283 ecr 0,nop,wscale 7], length 0
    2  08:46:30.067408 IP 93.184.216.34.443 > 172.16.10.62.42836: Flags [S.], seq 1112285027, ack 4032104603, win 65535, options [mss 1460,sackOK,TS val 2452491599 ecr 349023283,nop,wscale 9], length 0
    3  08:46:30.067546 IP 172.16.10.62.42836 > 93.184.216.34.443: Flags [.], ack 1, win 502, options [nop,nop,TS val 349023566 ecr 2452491599], length 0
    4  08:46:30.078638 IP 172.16.10.62.42836 > 93.184.216.34.443: Flags [P.], seq 1:518, ack 1, win 502, options [nop,nop,TS val 349023577 ecr 2452491599], length 517: TLS Handshake TLSv1.0 ClientHello, name: example.com [h2,http/1.1], versions: TLSv1.3,TLSv1.2
    5  08:46:30.272139 IP 93.184.216.34.443 > 172.16.10.62.42836: Flags [.], ack 518, win 131, options [nop,nop,TS val 2452491887 ecr 349023577], length 0
    6  08:46:30.272202 IP 93.184.216.34.443 > 172.16.10.62.42836: Flags [P.], seq 1:100, ack 518, win 131, options [nop,nop,TS val 2452491887 ecr 349023577], length 99: TLS Handshake TLSv1.2 ServerHello, version: TLSv1.3, ChangeCipherSpec TLSv1.2
    7  08:46:30.272271 IP 172.16.10.62.42836 > 93.184.216.34.443: Flags [.], ack 100, win 502, options [nop,nop,TS val 349023771 ecr 2452491887], length 0
    8  08:46:30.272922 IP 172.16.10.62.42836 > 93.184.216.34.443: Flags [P.], seq 518:1041, ack 100, win 502, options [nop,nop,TS val 349023772 ecr 2452491887], length 523: TLS ChangeCipherSpec TLSv1.2, Handshake TLSv1.2 ClientHello, name: example.com [h2,http/1.1], versions: TLSv1.3,TLSv1.2
    9  08:46:30.477422 IP 93.184.216.34.443 > 172.16.10.62.42836: Flags [.], ack 1041, win 133, options [nop,nop,TS val 2452492083 ecr 349023772], length 0
   10  08:46:30.477486 IP 93.184.216.34.443 > 172.16.10.62.42836: Flags [.], ack 1041, win 133, options [nop,nop,TS val 2452492083 ecr 349023772], length 0
   11  08:46:30.477497 IP 93.184.216.34.443 > 172.16.10.62.42836: Flags [P.], seq 100:2996, ack 1041, win 133, options [nop,nop,TS val 2452492084 ecr 349023772], length 2896: TLS Handshake TLSv1.2 ServerHello, version: TLSv1.3, ApplicationData TLSv1.2, ApplicationData TLSv1.2
   12  08:46:30.477525 IP 172.16.10.62.42836 > 93.184.216.34.443: Flags [.], ack 2996, win 480, options [nop,nop,TS val 349023976 ecr 2452492084], length 0
   13  08:46:30.477582 IP 93.184.216.34.443 > 172.16.10.62.42836: Flags [P.], seq 2996:3782, ack 1041, win 133, options [nop,nop,TS val 2452492084 ecr 349023772], length 786: TLS TLS Fragment or unknown record type(231)
   14  08:46:30.477611 IP 172.16.10.62.42836 > 93.184.216.34.443: Flags [.], ack 3782, win 474, options [nop,nop,TS val 349023976 ecr 2452492084], length 0
   15  08:46:30.480046 IP 172.16.10.62.42836 > 93.184.216.34.443: Flags [P.], seq 1041:1115, ack 3782, win 501, options [nop,nop,TS val 349023979 ecr 2452492084], length 74: TLS ApplicationData TLSv1.2
   16  08:46:30.480350 IP 172.16.10.62.42836 > 93.184.216.34.443: Flags [P.], seq 1115:1210, ack 3782, win 501, options [nop,nop,TS val 349023979 ecr 2452492084], length 95: TLS ApplicationData TLSv1.2, ApplicationData TLSv1.2
   17  08:46:30.480450 IP 172.16.10.62.42836 > 93.184.216.34.443: Flags [P.], seq 1210:1245, ack 3782, win 501, options [nop,nop,TS val 349023979 ecr 2452492084], length 35: TLS ApplicationData TLSv1.2
   18  08:46:30.480775 IP 172.16.10.62.42836 > 93.184.216.34.443: Flags [P.], seq 1245:1304, ack 3782, win 501, options [nop,nop,TS val 349023979 ecr 2452492084], length 59: TLS ApplicationData TLSv1.2
   19  08:46:30.681894 IP 93.184.216.34.443 > 172.16.10.62.42836: Flags [.], ack 1115, win 133, options [nop,nop,TS val 2452492291 ecr 349023979], length 0
   20  08:46:30.681957 IP 93.184.216.34.443 > 172.16.10.62.42836: Flags [.], ack 1210, win 133, options [nop,nop,TS val 2452492291 ecr 349023979], length 0
   21  08:46:30.681968 IP 93.184.216.34.443 > 172.16.10.62.42836: Flags [.], ack 1245, win 133, options [nop,nop,TS val 2452492291 ecr 349023979], length 0
   22  08:46:30.681976 IP 93.184.216.34.443 > 172.16.10.62.42836: Flags [.], ack 1304, win 133, options [nop,nop,TS val 2452492291 ecr 349023979], length 0
   23  08:46:30.681985 IP 93.184.216.34.443 > 172.16.10.62.42836: Flags [P.], seq 3782:4037, ack 1304, win 133, options [nop,nop,TS val 2452492291 ecr 349023979], length 255: TLS ApplicationData TLSv1.2
   24  08:46:30.682014 IP 172.16.10.62.42836 > 93.184.216.34.443: Flags [.], ack 4037, win 500, options [nop,nop,TS val 349024181 ecr 2452492291], length 0
   25  08:46:30.682072 IP 93.184.216.34.443 > 172.16.10.62.42836: Flags [P.], seq 4037:4292, ack 1304, win 133, options [nop,nop,TS val 2452492291 ecr 349023979], length 255: TLS ApplicationData TLSv1.2
   26  08:46:30.682095 IP 172.16.10.62.42836 > 93.184.216.34.443: Flags [.], ack 4292, win 499, options [nop,nop,TS val 349024181 ecr 2452492291], length 0
   27  08:46:30.682109 IP 93.184.216.34.443 > 172.16.10.62.42836: Flags [P.], seq 4292:4419, ack 1304, win 133, options [nop,nop,TS val 2452492291 ecr 349023979], length 127: TLS ApplicationData TLSv1.2, ApplicationData TLSv1.2, ApplicationData TLSv1.2
   28  08:46:30.682128 IP 172.16.10.62.42836 > 93.184.216.34.443: Flags [.], ack 4419, win 499, options [nop,nop,TS val 349024181 ecr 2452492291], length 0
   29  08:46:30.682139 IP 93.184.216.34.443 > 172.16.10.62.42836: Flags [P.], seq 4419:5934, ack 1304, win 133, options [nop,nop,TS val 2452492291 ecr 349023979], length 1515: TLS ApplicationData TLSv1.2, ApplicationData TLSv1.2, ApplicationData TLSv1.2
   30  08:46:30.682156 IP 172.16.10.62.42836 > 93.184.216.34.443: Flags [.], ack 5934, win 488, options [nop,nop,TS val 349024181 ecr 2452492291], length 0
   31  08:46:30.682608 IP 172.16.10.62.42836 > 93.184.216.34.443: Flags [P.], seq 1304:1335, ack 5934, win 488, options [nop,nop,TS val 349024181 ecr 2452492291], length 31: TLS ApplicationData TLSv1.2
   32  08:46:30.683272 IP 172.16.10.62.42836 > 93.184.216.34.443: Flags [P.], seq 1335:1359, ack 5934, win 501, options [nop,nop,TS val 349024182 ecr 2452492291], length 24: TLS ApplicationData TLSv1.2
   33  08:46:30.685033 IP 172.16.10.62.42836 > 93.184.216.34.443: Flags [F.], seq 1359, ack 5934, win 501, options [nop,nop,TS val 349024184 ecr 2452492291], length 0
   34  08:46:30.886272 IP 93.184.216.34.443 > 172.16.10.62.42836: Flags [.], ack 1335, win 133, options [nop,nop,TS val 2452492498 ecr 349024181,nop,nop,sack 1 {1359:1360}], length 0
   35  08:46:30.886345 IP 93.184.216.34.443 > 172.16.10.62.42836: Flags [.], ack 1360, win 133, options [nop,nop,TS val 2452492498 ecr 349024182], length 0
   36  08:46:30.886407 IP 93.184.216.34.443 > 172.16.10.62.42836: Flags [P.], seq 5934:5958, ack 1360, win 133, options [nop,nop,TS val 2452492498 ecr 349024182], length 24: TLS ApplicationData TLSv1.2
   37  08:46:30.886452 IP 172.16.10.62.42836 > 93.184.216.34.443: Flags [R], seq 4032105962, win 0, length 0
   38  08:46:30.886494 IP 93.184.216.34.443 > 172.16.10.62.42836: Flags [F.], seq 5958, ack 1360, win 133, options [nop,nop,TS val 2452492498 ecr 349024182], length 0
   39  08:46:30.886512 IP 172.16.10.62.42836 > 93.184.216.34.443: Flags [R], seq 4032105962, win 0, length 0
