    1  03:01:52.675146 IP (tos 0x0, ttl 63, id 63543, offset 0, flags [DF], proto TCP (6), length 60)
    172.16.10.62.35704 > 93.184.216.34.443: Flags [S], cksum 0x3226 (correct), seq 4147264741, win 64240, options [mss 1460,sackOK,TS val 2360008905 ecr 0,nop,wscale 7], length 0
    2  03:01:52.942787 IP (tos 0x0, ttl 54, id 44313, offset 0, flags [none], proto TCP (6), length 60)
    93.184.216.34.443 > 172.16.10.62.35704: Flags [S.], cksum 0x56fa (correct), seq 1962483114, ack 4147264742, win 65535, options [mss 1460,sackOK,TS val 267989869 ecr 2360008905,nop,wscale 9], length 0
    3  03:01:52.942879 IP (tos 0x0, ttl 63, id 63544, offset 0, flags [DF], proto TCP (6), length 52)
    172.16.10.62.35704 > 93.184.216.34.443: Flags [.], cksum 0x82c7 (correct), seq 1, ack 1, win 502, options [nop,nop,TS val 2360009172 ecr 267989869], length 0
    4  03:01:52.943029 IP (tos 0x0, ttl 63, id 63545, offset 0, flags [DF], proto TCP (6), length 59)
    172.16.10.62.35704 > 93.184.216.34.443: Flags [P.], cksum 0x1ab2 (correct), seq 1:8, ack 1, win 502, options [nop,nop,TS val 2360009173 ecr 267989869], length 7: TLS
	Alert TLSv1.0, length: 2 fatal: internal_error
    5  03:01:52.943151 IP (tos 0x0, ttl 63, id 63546, offset 0, flags [DF], proto TCP (6), length 52)
    172.16.10.62.35704 > 93.184.216.34.443: Flags [F.], cksum 0x82be (correct), seq 8, ack 1, win 502, options [nop,nop,TS val 2360009173 ecr 267989869], length 0
    6  03:01:53.147552 IP (tos 0x0, ttl 54, id 44356, offset 0, flags [none], proto TCP (6), length 64)
    93.184.216.34.443 > 172.16.10.62.35704: Flags [.], cksum 0xe4d5 (correct), seq 1, ack 1, win 128, options [nop,nop,TS val 267990140 ecr 2360009172,nop,nop,sack 1 {8:9}], length 0
    7  03:01:53.147596 IP (tos 0x0, ttl 54, id 44357, offset 0, flags [none], proto TCP (6), length 52)
    93.184.216.34.443 > 172.16.10.62.35704: Flags [.], cksum 0x8325 (correct), seq 1, ack 9, win 128, options [nop,nop,TS val 267990140 ecr 2360009173], length 0
    8  03:01:53.147602 IP (tos 0x0, ttl 54, id 44358, offset 0, flags [none], proto TCP (6), length 59)
    93.184.216.34.443 > 172.16.10.62.35704: Flags [P.], cksum 0x6111 (correct), seq 1:8, ack 9, win 128, options [nop,nop,TS val 267990140 ecr 2360009173], length 7: TLS
	Alert TLSv1.0, length: 2 fatal: unexpected_message
    9  03:01:53.147606 IP (tos 0x0, ttl 54, id 44359, offset 0, flags [none], proto TCP (6), length 52)
    93.184.216.34.443 > 172.16.10.62.35704: Flags [F.], cksum 0x831d (correct), seq 8, ack 9, win 128, options [nop,nop,TS val 267990140 ecr 2360009173], length 0
   10  03:01:53.147670 IP (tos 0x0, ttl 63, id 63547, offset 0, flags [DF], proto TCP (6), length 52)
    172.16.10.62.35704 > 93.184.216.34.443: Flags [.], cksum 0x80dc (correct), seq 9, ack 8, win 502, options [nop,nop,TS val 2360009377 ecr 267990140], length 0
   11  03:01:53.147693 IP (tos 0x0, ttl 63, id 63548, offset 0, flags [DF], proto TCP (6), length 52)
    172.16.10.62.35704 > 93.184.216.34.443: Flags [.], cksum 0x80db (correct), seq 9, ack 9, win 502, options [nop,nop,TS val 2360009377 ecr 267990140], length 0
